{
    "lastModified": 1455772206090,
    "result": [
               {
               "mediaId": 2487709,
               "type": "episode",
               "season": "01",
               "episode": "0001",
               "launchDate": "7/19/2012",
               "pubDate": "2012-07-19T16:00:00.000Z",
               "duration": "13:35",
               "durationSeconds": "815",
               "title": "Larry Eats a Pancake",
               "description": "Jerry's special guest is Larry David in the premiere episode of Comedians In Cars Getting Coffee.",
               "guests": [
                          {
                          "name": "Larry David"
                          }
                          ],
               "images": {
               "poster": "http://ccc.crackle.com/images/s1e1_poster.jpg",
               "thumb": "http://ccc.crackle.com/images/s1e1_thumb.jpg"
               },
               "mediaUrl": "http://content.uplynk.com/ext/e8773f7770a44dbd886eee4fca16a66b/2487709.m3u8?ad=crackle_live",
               "urlSlug": "larry-david-larry-eats-a-pancake",
               "pubDateTime": 1342713600,
               "slug": "larry-david-larry-eats-a-pancake",
               "videoUrl": "http://content-ause1.uplynk.com/bde2566cc46d4a3ba40a5f5da0986d1b/g.m3u8?ad=crackle_live&pbs=a40f9d3d563243c1a61f54bcf687c036"
               },
               {
               "mediaId": 2487728,
               "type": "episode",
               "season": "01",
               "episode": "0002",
               "launchDate": "8/2/2012",
               "pubDate": "2012-08-02T16:00:00.000Z",
               "duration": "11:33",
               "durationSeconds": "693",
               "title": "Mad Man in a Death Machine",
               "description": "Jerry's special guest is Ricky Gervais in this episode of Comedians In Cars Getting Coffee.",
               "guests": [
                          {
                          "name": "Ricky Gervais"
                          }
                          ],
               "images": {
               "poster": "http://ccc.crackle.com/images/s1e2_poster.jpg",
               "thumb": "http://ccc.crackle.com/images/s1e2_thumb.jpg"
               },
               "mediaUrl": "http://content.uplynk.com/ext/e8773f7770a44dbd886eee4fca16a66b/2487728.m3u8?ad=crackle_live",
               "urlSlug": "ricky-gervais-mad-man-in-a-death-machine",
               "pubDateTime": 1343923200,
               "slug": "ricky-gervais-mad-man-in-a-death-machine",
               "videoUrl": "http://content-ause4.uplynk.com/160eb182926e4429add19dddb75e65e0/g.m3u8?ad=crackle_live&pbs=2bf35c39b109460c9b43695f6350183a"
               },
               {
               "mediaId": 2487746,
               "type": "episode",
               "season": "01",
               "episode": "0003",
               "launchDate": "8/9/2012",
               "pubDate": "2012-08-09T16:00:00.000Z",
               "duration": "12:18",
               "durationSeconds": "738",
               "title": "A Monkey and a Lava Lamp",
               "description": "Jerry's special guest is Brian Regan in this episode of Comedians In Cars Getting Coffee.",
               "guests": [
                          {
                          "name": "Brian Regan"
                          }
                          ],
               "images": {
               "poster": "http://ccc.crackle.com/images/s1e3_poster.jpg",
               "thumb": "http://ccc.crackle.com/images/s1e3_thumb.jpg"
               },
               "mediaUrl": "http://content.uplynk.com/ext/e8773f7770a44dbd886eee4fca16a66b/2487746.m3u8?ad=crackle_live",
               "urlSlug": "brian-regan-a-monkey-and-a-lava-lamp",
               "pubDateTime": 1344528000,
               "slug": "brian-regan-a-monkey-and-a-lava-lamp",
               "videoUrl": "http://content-ause4.uplynk.com/e2b0f750b2cd4b77a1d65e69348e5c69/g.m3u8?ad=crackle_live&pbs=30d16e446ffb40779689d62861566cc8"
               },
               {
               "mediaId": 2487796,
               "type": "episode",
               "season": "01",
               "episode": "0004",
               "launchDate": "8/16/2012",
               "pubDate": "2012-08-16T16:00:00.000Z",
               "duration": "11:24",
               "durationSeconds": "684",
               "title": "Just a Lazy Shiftless Bastard",
               "description": "Jerry's special guest is Alec Baldwin in this episode of Comedians In Cars Getting Coffee.",
               "guests": [
                          {
                          "name": "Alec Baldwin"
                          }
                          ],
               "images": {
               "poster": "http://ccc.crackle.com/images/s1e4_poster.jpg",
               "thumb": "http://ccc.crackle.com/images/s1e4_thumb.jpg"
               },
               "mediaUrl": "http://content.uplynk.com/ext/e8773f7770a44dbd886eee4fca16a66b/2487796.m3u8?ad=crackle_live",
               "urlSlug": "alec-baldwin-just-a-lazy-shiftless-bastard",
               "pubDateTime": 1345132800,
               "slug": "alec-baldwin-just-a-lazy-shiftless-bastard",
               "videoUrl": "http://content-ause4.uplynk.com/a4a0bcec43a64254ab40b53d4680734c/g.m3u8?ad=crackle_live&pbs=0960b43583ec4841a9bf706d1e8e2883"
               },
               {
               "mediaId": 2487865,
               "type": "episode",
               "season": "01",
               "episode": "0005",
               "launchDate": "8/23/2012",
               "pubDate": "2012-08-23T16:00:00.000Z",
               "duration": "10:45",
               "durationSeconds": "645",
               "title": "A Taste of Hell From on High",
               "description": "Jerry's special guest is Joel Hodgson in this episode of Comedians In Cars Getting Coffee.",
               "guests": [
                          {
                          "name": "Joel Hodgson"
                          }
                          ],
               "images": {
               "poster": "http://ccc.crackle.com/images/s1e5_poster.jpg",
               "thumb": "http://ccc.crackle.com/images/s1e5_thumb.jpg"
               },
               "mediaUrl": "http://content.uplynk.com/ext/e8773f7770a44dbd886eee4fca16a66b/2487865.m3u8?ad=crackle_live",
               "urlSlug": "joel-hodgson-a-taste-of-hell-from-on-high",
               "pubDateTime": 1345737600,
               "slug": "joel-hodgson-a-taste-of-hell-from-on-high",
               "videoUrl": "http://content-ause4.uplynk.com/16e2fcf7cdd44a3198793b4e91068227/g.m3u8?ad=crackle_live&pbs=0d355a5301264259a947e21bc33b123d"
               },
               {
               "mediaId": 2487897,
               "type": "episode",
               "season": "01",
               "episode": "0006",
               "launchDate": "8/30/2012",
               "pubDate": "2012-08-30T16:00:00.000Z",
               "duration": "12:24",
               "durationSeconds": "744",
               "title": "Unusable on the Internet",
               "description": "Jerry's special guest is Bob Einstein in this episode of Comedians In Cars Getting Coffee.",
               "guests": [
                          {
                          "name": "Bob Einstein"
                          }
                          ],
               "images": {
               "poster": "http://ccc.crackle.com/images/s1e6_poster.jpg",
               "thumb": "http://ccc.crackle.com/images/s1e6_thumb.jpg"
               },
               "mediaUrl": "http://content.uplynk.com/ext/e8773f7770a44dbd886eee4fca16a66b/2487897.m3u8?ad=crackle_live",
               "urlSlug": "bob-einstein-unusable-on-the-internet",
               "pubDateTime": 1346342400,
               "slug": "bob-einstein-unusable-on-the-internet",
               "videoUrl": "http://content-ause4.uplynk.com/60cecf00e37c4e2ba4801c1ff13f76c8/g.m3u8?ad=crackle_live&pbs=8dbf7f81f45c4580be4ac4ee4822202e"
               },
               {
               "mediaId": 2487916,
               "type": "episode",
               "season": "01",
               "episode": "0007",
               "launchDate": "9/6/2012",
               "pubDate": "2012-09-06T16:00:00.000Z",
               "duration": "7:56",
               "durationSeconds": "476",
               "title": "You Don't Want to Offend a Cannibal",
               "description": "Jerry's special guest is Ted L. Nancy in this episode of Comedians In Cars Getting Coffee.",
               "guests": [
                          {
                          "name": "Barry Marder",
                          "pseudo": "Ted L. Nancy"
                          }
                          ],
               "images": {
               "poster": "http://ccc.crackle.com/images/s1e7_poster.jpg",
               "thumb": "http://ccc.crackle.com/images/s1e7_thumb.jpg"
               },
               "mediaUrl": "http://content.uplynk.com/ext/e8773f7770a44dbd886eee4fca16a66b/2487916.m3u8?ad=crackle_live",
               "urlSlug": "barry-marder-you-don-t-want-to-offend-a-cannibal",
               "pubDateTime": 1346947200,
               "slug": "barry-marder-you-dont-want-to-offend-a-cannibal",
               "videoUrl": "http://content-ause4.uplynk.com/2283920c5fbd4472b6ae3e26520853b9/g.m3u8?ad=crackle_live&pbs=7812f175f57544d5ba2cbf3f9d0d725d"
               },
               {
               "mediaId": 2487936,
               "type": "episode",
               "season": "01",
               "episode": "0008",
               "launchDate": "9/13/2012",
               "pubDate": "2012-09-13T16:00:00.000Z",
               "duration": "11:08",
               "durationSeconds": "668",
               "title": "I Hear Downton Abbey is Pretty Good...",
               "description": "Jerry's special guests are Colin Quinn and Mario Joyner in this episode of Comedians In Cars Getting Coffee.",
               "guests": [
                          {
                          "name": "Colin Quinn"
                          },
                          {
                          "name": "Mario Joyner"
                          }
                          ],
               "images": {
               "poster": "http://ccc.crackle.com/images/s1e8_poster.jpg",
               "thumb": "http://ccc.crackle.com/images/s1e8_thumb.jpg"
               },
               "mediaUrl": "http://content.uplynk.com/ext/e8773f7770a44dbd886eee4fca16a66b/2487936.m3u8?ad=crackle_live",
               "urlSlug": "colin-quinn-mario-joyner-i-hear-downton-abbey-is-pretty-good",
               "pubDateTime": 1347552000,
               "slug": "colin-quinn-mario-joyner-i-hear-downton-abbey-is-pretty-good",
               "videoUrl": "http://content-ause4.uplynk.com/be49056e27f9478485a60c79d5c57c3e/g.m3u8?ad=crackle_live&pbs=264cfc6759a540d2befb2f5b14d077e6"
               },
               {
               "mediaId": 2488037,
               "type": "episode",
               "season": "01",
               "episode": "0009",
               "launchDate": "9/20/2012",
               "pubDate": "2012-09-20T16:00:00.000Z",
               "duration": "17:07",
               "durationSeconds": "1027",
               "title": "I Want Sandwiches, I Want Chicken",
               "description": "Jerry's special guests are Carl Reiner and Mel Brooks in this episode of Comedians In Cars Getting Coffee.",
               "guests": [
                          {
                          "name": "Carl Reiner"
                          },
                          {
                          "name": "Mel Brooks"
                          }
                          ],
               "images": {
               "poster": "http://ccc.crackle.com/images/s1e9_poster.jpg",
               "thumb": "http://ccc.crackle.com/images/s1e9_thumb.jpg"
               },
               "mediaUrl": "http://content.uplynk.com/ext/e8773f7770a44dbd886eee4fca16a66b/2488037.m3u8?ad=crackle_live",
               "urlSlug": "carl-reiner-mel-brooks-i-want-sandwiches-i-want-chicken",
               "pubDateTime": 1348156800,
               "slug": "carl-reiner-mel-brooks-i-want-sandwiches-i-want-chicken",
               "videoUrl": "http://content-ause4.uplynk.com/c10e80a9f54642dc898f799a6f7e7f8e/g.m3u8?ad=crackle_live&pbs=c46df97b0dd54b5baaa8d06ac4955de4"
               },
               {
               "mediaId": 2488053,
               "type": "episode",
               "season": "01",
               "episode": "0010",
               "launchDate": "9/27/2012",
               "pubDate": "2012-09-27T16:00:00.000Z",
               "duration": "17:13",
               "durationSeconds": "1033",
               "title": "It's Bubbly Time, Jerry",
               "description": "Jerry's special guest is Michael Richards in the season finale of Comedians In Cars Getting Coffee.",
               "guests": [
                          {
                          "name": "Michael Richards"
                          }
                          ],
               "images": {
               "poster": "http://ccc.crackle.com/images/s1e10_poster.jpg",
               "thumb": "http://ccc.crackle.com/images/s1e10_thumb.jpg"
               },
               "mediaUrl": "http://content.uplynk.com/ext/e8773f7770a44dbd886eee4fca16a66b/2488053.m3u8?ad=crackle_live",
               "urlSlug": "michael-richards-it-s-bubbly-time-jerry",
               "pubDateTime": 1348761600,
               "slug": "michael-richards-its-bubbly-time-jerry",
               "videoUrl": "http://content-ause2.uplynk.com/206e87ff7a414de9b67edaea0cf18dc9/g.m3u8?ad=crackle_live&pbs=0762f4e2d41745da9b854a91ab0bfbd3"
               },
               {
               "mediaId": 2489682,
               "type": "episode",
               "season": "02",
               "episode": "0001",
               "launchDate": "6/13/2013",
               "pubDate": "2013-06-13T16:00:00.000Z",
               "duration": "18:51",
               "durationSeconds": "1131",
               "title": "I'm Going To Change Your Life Forever",
               "description": "Jerry's special guest is Sarah Silverman in this episode of Comedians In Cars Getting Coffee.",
               "guests": [
                          {
                          "name": "Sarah Silverman"
                          }
                          ],
               "images": {
               "poster": "http://ccc.crackle.com/images/s2e1_poster.jpg",
               "thumb": "http://ccc.crackle.com/images/s2e1_thumb.jpg"
               },
               "mediaUrl": "http://content.uplynk.com/ext/e8773f7770a44dbd886eee4fca16a66b/2489682.m3u8?ad=crackle_live",
               "urlSlug": "sarah-silverman-i-m-going-to-change-your-life-forever",
               "pubDateTime": 1371139200,
               "slug": "sarah-silverman-im-going-to-change-your-life-forever",
               "videoUrl": "http://content-ause2.uplynk.com/82f41c7cb7104a89b1a40d4f869fc6a8/g.m3u8?ad=crackle_live&pbs=eae312c77f4440a0a7472ddfa9b57e5c"
               },
               {
               "mediaId": 2489725,
               "type": "season-trailer",
               "season": "02",
               "episode": "0001",
               "launchDate": "6/6/2013",
               "pubDate": "2013-06-06T16:00:00.000Z",
               "duration": "1:51",
               "durationSeconds": "111",
               "title": "Season 2 Promo",
               "description": "Jerry Seinfeld is joined by friends for a drive in a classic car and having coffee, sharing stories all along the way.",
               "guests": [
                          {
                          "name": "Sarah Silverman"
                          },
                          {
                          "name": "David Letterman"
                          },
                          {
                          "name": "Gad Elmaleh"
                          },
                          {
                          "name": "Don Rickles"
                          },
                          {
                          "name": "Seth Meyers"
                          },
                          {
                          "name": "Chris Rock"
                          }
                          ],
               "images": {
               "poster": "http://ccc.crackle.com/images/s2_trailer_poster.jpg",
               "thumb": "http://ccc.crackle.com/images/s2_trailer_thumb.jpg"
               },
               "mediaUrl": "http://content.uplynk.com/ext/e8773f7770a44dbd886eee4fca16a66b/2489725.m3u8?ad=crackle_live",
               "urlSlug": "sarah-silverman-david-letterman-gad-elmaleh-don-rickles-seth-meyers-chris-rock-season-2-promo",
               "pubDateTime": 1370534400,
               "slug": "sarah-silverman-david-letterman-gad-elmaleh-don-rickles-seth-meyers-chris-rock-season-trailer",
               "videoUrl": "http://content-ause2.uplynk.com/394139c36ddb4ca9b67824c22c2c742c/g.m3u8?ad=crackle_live&pbs=494075b0d3bc43cb8cfaee675b1b615e"
               },
               {
               "mediaId": 2494330,
               "type": "singleshot",
               "season": "02",
               "episode": "0001",
               "launchDate": "12/25/2014",
               "pubDate": "2014-12-25T17:00:00.000Z",
               "duration": "1:47",
               "durationSeconds": "107",
               "title": "Single Shot: What Is A Comedian?",
               "description": "Jerry and his special guests Brian Regan, Howard Stern, Sarah Silverman, Todd Barry, Aziz Ansari, Chris Rock and Jay Leno talk about what it means to be a comedian. Are comedians really just smart idiots?",
               "guests": [
                          {
                          "name": "Brian Regan"
                          },
                          {
                          "name": "Howard Stern"
                          },
                          {
                          "name": "Sarah Silverman"
                          },
                          {
                          "name": "Todd Barry"
                          },
                          {
                          "name": "Aziz Ansari"
                          },
                          {
                          "name": "Chris Rock"
                          },
                          {
                          "name": "Jay Leno"
                          }
                          ],
               "images": {
               "poster": "http://assets.comediansincarsgettingcoffee.com/single-shots/sss2e1_poster.jpg",
               "thumb": "http://assets.comediansincarsgettingcoffee.com/single-shots/sss2e1_thumb.jpg"
               },
               "mediaUrl": "http://content.uplynk.com/ext/e8773f7770a44dbd886eee4fca16a66b/2494330.m3u8",
               "urlSlug": "what-is-a-comedian",
               "slug": "what-is-a-comedian",
               "pubDateTime": "2014-12-25T17:00:00.000Z",
               "videoUrl": "http://content-aeui1.uplynk.com/34d60002efd04ce68170d3cdb30a658f/g.m3u8"
               },
               {
               "mediaId": 2489915,
               "type": "episode",
               "season": "02",
               "episode": "0002",
               "launchDate": "6/20/2013",
               "pubDate": "2013-06-20T16:00:00.000Z",
               "duration": "18:24",
               "durationSeconds": "1104",
               "title": "I Like Kettlecorn",
               "description": "Jerry's special guest is David Letterman in this episode of Comedians In Cars Getting Coffee.",
               "guests": [
                          {
                          "name": "David Letterman"
                          }
                          ],
               "images": {
               "poster": "http://ccc.crackle.com/images/s2e2_poster.jpg",
               "thumb": "http://ccc.crackle.com/images/s2e2_thumb.jpg"
               },
               "mediaUrl": "http://content.uplynk.com/ext/e8773f7770a44dbd886eee4fca16a66b/2489915.m3u8?ad=crackle_live",
               "urlSlug": "david-letterman-i-like-kettlecorn",
               "pubDateTime": 1371744000,
               "slug": "david-letterman-i-like-kettlecorn",
               "videoUrl": "http://content-ause4.uplynk.com/1a5c2a8074f3479d9fbc7ccd4b9f2fd0/g.m3u8?ad=crackle_live&pbs=43f2d983e50d4a15814afa73b5194c12"
               },
               {
               "mediaId": 2494331,
               "type": "singleshot",
               "season": "02",
               "episode": "0002",
               "launchDate": "01/01/2015",
               "pubDate": "2015-01-01T17:00:00.000Z",
               "duration": "2:09",
               "durationSeconds": "129",
               "title": "Single Shot: Tweet Nothings",
               "description": "Jerry and special guests including Miranda Sings, David Letterman, Tina Fey, Louis C.K., Bill Burr, Howard Stern, Bob Einstein, Todd Barry, Aziz Ansari and Jon Stewart question the use of Twitter and sharing 'tweet nothings.'",
               "guests": [
                          {
                          "name": "Miranda Sings"
                          },
                          {
                          "name": "David Letterman"
                          },
                          {
                          "name": "Tina Fey"
                          },
                          {
                          "name": "Louis C.K."
                          },
                          {
                          "name": "Bill Burr"
                          },
                          {
                          "name": "Howard Stern"
                          },
                          {
                          "name": "Bob Einstein"
                          },
                          {
                          "name": "Todd Barry"
                          },
                          {
                          "name": "Aziz Ansari"
                          },
                          {
                          "name": "Jon Stewart"
                          }
                          ],
               "images": {
               "poster": "http://assets.comediansincarsgettingcoffee.com/single-shots/sss2e2_poster.jpg",
               "thumb": "http://assets.comediansincarsgettingcoffee.com/single-shots/sss2e2_thumb.jpg"
               },
               "mediaUrl": "http://content.uplynk.com/ext/e8773f7770a44dbd886eee4fca16a66b/2494331.m3u8",
               "urlSlug": "tweet-nothings",
               "slug": "tweet-nothings",
               "pubDateTime": "2015-01-01T17:00:00.000Z",
               "videoUrl": "http://content-aeui2.uplynk.com/7fca4473bd954fd99bda261fb9bd3ded/g.m3u8"
               },
               {
               "mediaId": 2489958,
               "type": "episode",
               "season": "02",
               "episode": "0003",
               "launchDate": "6/27/2013",
               "pubDate": "2013-06-27T16:00:00.000Z",
               "duration": "17:44",
               "durationSeconds": "1064",
               "title": "No Lipsticks for Nuns",
               "description": "Jerry's special guest is Gad Elmaleh in this episode of Comedians In Cars Getting Coffee.",
               "guests": [
                          {
                          "name": "Gad Elmaleh"
                          }
                          ],
               "images": {
               "poster": "http://ccc.crackle.com/images/s2e3_poster.jpg",
               "thumb": "http://ccc.crackle.com/images/s2e3_thumb.jpg"
               },
               "mediaUrl": "http://content.uplynk.com/ext/e8773f7770a44dbd886eee4fca16a66b/2489958.m3u8?ad=crackle_live",
               "urlSlug": "gad-elmaleh-no-lipsticks-for-nuns",
               "pubDateTime": 1372348800,
               "slug": "gad-elmaleh-no-lipsticks-for-nuns",
               "videoUrl": "http://content-ause4.uplynk.com/bb375345520c4476aafc610b0cbc1a8a/g.m3u8?ad=crackle_live&pbs=2ceb058f32994d75bf888e0b2decc26f"
               },
               {
               "mediaId": 2494332,
               "type": "singleshot",
               "season": "02",
               "episode": "0003",
               "launchDate": "01/08/2015",
               "pubDate": "2015-01-08T17:00:00.000Z",
               "duration": "1:21",
               "durationSeconds": "81",
               "title": "Single Shot: Grow A Pair",
               "description": "Jerry and special guests Bob Einstein, Robert Klein, Sarah Jessica Parker, Amy Schumer, Miranda Sings, Howard Stern and Jon Stewart talk growing a pair of, well you know.",
               "guests": [
                          {
                          "name": "Bob Einstein"
                          },
                          {
                          "name": "Robert Klein"
                          },
                          {
                          "name": "Sarah Jessica Parker"
                          },
                          {
                          "name": "Amy Schumer"
                          },
                          {
                          "name": "Miranda Sings"
                          },
                          {
                          "name": "Howard Stern"
                          },
                          {
                          "name": "Jon Stewart"
                          }
                          ],
               "images": {
               "poster": "http://assets.comediansincarsgettingcoffee.com/single-shots/sss2e3_poster.jpg",
               "thumb": "http://assets.comediansincarsgettingcoffee.com/single-shots/sss2e3_thumb.jpg"
               },
               "mediaUrl": "http://content.uplynk.com/ext/e8773f7770a44dbd886eee4fca16a66b/2494332.m3u8",
               "urlSlug": "grow-a-pair",
               "slug": "grow-a-pair",
               "pubDateTime": "2015-01-08T17:00:00.000Z",
               "videoUrl": "http://content-aeui2.uplynk.com/773565b1dfcf40b790a19fd51255694d/g.m3u8"
               },
               {
               "mediaId": 2489973,
               "type": "episode",
               "season": "02",
               "episode": "0004",
               "launchDate": "7/04/2013",
               "pubDate": "2013-07-04T16:00:00.000Z",
               "duration": "12:51",
               "durationSeconds": "771",
               "title": "You'll Never Play the Copa",
               "description": "Jerry's special guest is Don Rickles in this episode of Comedians In Cars Getting Coffee.",
               "guests": [
                          {
                          "name": "Don Rickles"
                          }
                          ],
               "images": {
               "poster": "http://ccc.crackle.com/images/s2e4_poster.jpg",
               "thumb": "http://ccc.crackle.com/images/s2e4_thumb.jpg"
               },
               "mediaUrl": "http://content.uplynk.com/ext/e8773f7770a44dbd886eee4fca16a66b/2489973.m3u8?ad=crackle_live",
               "urlSlug": "don-rickles-you-ll-never-play-the-copa",
               "pubDateTime": 1372953600,
               "slug": "don-rickles-youll-never-play-the-copa",
               "videoUrl": "http://content-ause4.uplynk.com/3de18f92d1a6463aa864af96b2a7c09d/g.m3u8?ad=crackle_live&pbs=6cc53d2b70ce40be9da4e1e3f944a749"
               },
               {
               "mediaId": 2494430,
               "type": "singleshot",
               "season": "02",
               "episode": "0004",
               "launchDate": "01/15/2015",
               "pubDate": "2015-01-15T17:00:00.000Z",
               "duration": "1:44",
               "durationSeconds": "104",
               "title": "Single Shot: Eggs Any Style",
               "description": "Jerry and his very special guests including Seth Meyers, Tina Fey, Bill Burr and Michael Richards serve up some breakfast conversation, any style.",
               "guests": [
                          {
                          "name": "Bill Burr"
                          },
                          {
                          "name": "Larry David"
                          },
                          {
                          "name": "Bob Einstein"
                          },
                          {
                          "name": "Gad Elmaleh"
                          },
                          {
                          "name": "Tina Fey"
                          },
                          {
                          "name": "Ricky Gervais"
                          },
                          {
                          "name": "Mario Joyner"
                          },
                          {
                          "name": "Seth Meyers"
                          },
                          {
                          "name": "Sarah Jessica Parker"
                          },
                          {
                          "name": "Colin Quinn"
                          },
                          {
                          "name": "Carl Reiner"
                          },
                          {
                          "name": "Michael Richards"
                          },
                          {
                          "name": "Amy Schumer"
                          },
                          {
                          "name": "Sarah Silverman"
                          }
                          ],
               "images": {
               "poster": "http://assets.comediansincarsgettingcoffee.com/single-shots/sss2e4_poster.jpg",
               "thumb": "http://assets.comediansincarsgettingcoffee.com/single-shots/sss2e4_thumb.jpg"
               },
               "mediaUrl": "http://content.uplynk.com/ext/e8773f7770a44dbd886eee4fca16a66b/2494430.m3u8",
               "urlSlug": "eggs-any-style",
               "slug": "eggs-any-style",
               "pubDateTime": "2015-01-15T17:00:00.000Z",
               "videoUrl": "http://content-aeui1.uplynk.com/55fbeb38f14942c3a8c5cc265f891b14/g.m3u8"
               },
               {
               "mediaId": 2490011,
               "type": "episode",
               "season": "02",
               "episode": "0005",
               "launchDate": "7/11/2013",
               "pubDate": "2013-07-11T16:00:00.000Z",
               "duration": "14:23",
               "durationSeconds": "863",
               "title": "Really?!",
               "description": "Jerry's special guest is Seth Meyers in this episode of Comedians In Cars Getting Coffee.",
               "guests": [
                          {
                          "name": "Seth Meyers"
                          }
                          ],
               "images": {
               "poster": "http://ccc.crackle.com/images/s2e5_poster.jpg",
               "thumb": "http://ccc.crackle.com/images/s2e5_thumb.jpg"
               },
               "mediaUrl": "http://content.uplynk.com/ext/e8773f7770a44dbd886eee4fca16a66b/2490011.m3u8?ad=crackle_live",
               "urlSlug": "seth-meyers-really",
               "pubDateTime": 1373558400,
               "slug": "seth-meyers-really",
               "videoUrl": "http://content-ause2.uplynk.com/59b8ecf8d6184477bb07a0a51cc0b19b/g.m3u8?ad=crackle_live&pbs=f97fa4a9d8f54a438b5025bfb91e9ebf"
               },
               {
               "mediaId": 2494431,
               "type": "singleshot",
               "season": "02",
               "episode": "0005",
               "launchDate": "01/22/2015",
               "pubDate": "2015-01-22T17:00:00.000Z",
               "duration": "2:24",
               "durationSeconds": "144",
               "title": "Single Shot: OMG",
               "description": "Jerry and his variety of guests analyze and discuss the complexities of religion and the Big Guy upstairs.",
               "guests": [
                          {
                          "name": "Gad Elmaleh"
                          },
                          {
                          "name": "Mario Joyner"
                          },
                          {
                          "name": "Sarah Silverman"
                          },
                          {
                          "name": "Miranda Sings"
                          },
                          {
                          "name": "George Wallace"
                          }
                          ],
               "images": {
               "poster": "http://assets.comediansincarsgettingcoffee.com/single-shots/sss2e5_poster.jpg",
               "thumb": "http://assets.comediansincarsgettingcoffee.com/single-shots/sss2e5_thumb.jpg"
               },
               "mediaUrl": "http://content.uplynk.com/ext/e8773f7770a44dbd886eee4fca16a66b/2494431.m3u8",
               "urlSlug": "OMG",
               "slug": "OMG",
               "pubDateTime": "2015-01-22T17:00:00.000Z",
               "videoUrl": "http://content-aeui2.uplynk.com/35817a875dc545efb863e1762e75e876/g.m3u8"
               },
               {
               "mediaId": 2489979,
               "type": "episode",
               "season": "02",
               "episode": "0006",
               "launchDate": "7/18/2013",
               "pubDate": "2013-07-18T16:00:00.000Z",
               "duration": "15:33",
               "durationSeconds": "933",
               "title": "Kids Need Bullying",
               "description": "Jerry's special guest is Chris Rock in this episode of Comedians In Cars Getting Coffee.",
               "guests": [
                          {
                          "name": "Chris Rock"
                          }
                          ],
               "images": {
               "poster": "http://ccc.crackle.com/images/s2e6_poster.jpg",
               "thumb": "http://ccc.crackle.com/images/s2e6_thumb.jpg"
               },
               "mediaUrl": "http://content.uplynk.com/ext/e8773f7770a44dbd886eee4fca16a66b/2489979.m3u8?ad=crackle_live",
               "urlSlug": "chris-rock-kids-need-bullying",
               "pubDateTime": 1374163200,
               "slug": "chris-rock-kids-need-bullying",
               "videoUrl": "http://content-ause2.uplynk.com/bd702551074949c09f3e6230b2624ea5/g.m3u8?ad=crackle_live&pbs=310c1a958aff48cc85b3ebf56d8f6d77"
               },
               {
               "mediaId": 2494479,
               "type": "singleshot",
               "season": "02",
               "episode": "0006",
               "launchDate": "01/29/2015",
               "pubDate": "2015-01-29T17:00:00.000Z",
               "duration": "1:55",
               "durationSeconds": "115",
               "title": "Single Shot: Oh Brother",
               "description": "Jerry and his special guests reminisce on their childhood and the siblings that left them saying, 'Oh, brother.'",
               "guests": [
                          {
                          "name": "Ricky Gervais"
                          },
                          {
                          "name": "Brian Regan"
                          },
                          {
                          "name": "Alec Baldwin"
                          },
                          {
                          "name": "Jon Stewart"
                          },
                          {
                          "name": "Chris Rock"
                          }
                          ],
               "images": {
               "poster": "http://assets.comediansincarsgettingcoffee.com/single-shots/sss2e6_poster.jpg",
               "thumb": "http://assets.comediansincarsgettingcoffee.com/single-shots/sss2e6_thumb.jpg"
               },
               "mediaUrl": "http://content.uplynk.com/ext/e8773f7770a44dbd886eee4fca16a66b/2494479.m3u8",
               "urlSlug": "oh-brother",
               "slug": "oh-brother",
               "pubDateTime": "2015-01-29T17:00:00.000Z",
               "videoUrl": "http://content-aeui1.uplynk.com/18d5c86bc7774936b3f81269a637732f/g.m3u8"
               },
               {
               "mediaId": 2494480,
               "type": "singleshot",
               "season": "02",
               "episode": "0007",
               "launchDate": "02/05/2015",
               "pubDate": "2015-02-05T17:00:00.000Z",
               "duration": "2:14",
               "durationSeconds": "134",
               "title": "Single Shot: Mind Your Manners",
               "description": "Jerry and his special guests ponder over the manners of the everyday citizen (or lack thereof).",
               "guests": [
                          {
                          "name": "Brian Regan"
                          },
                          {
                          "name": "Miranda Sings"
                          },
                          {
                          "name": "Howard Stern"
                          },
                          {
                          "name": "Sarah Silverman"
                          },
                          {
                          "name": "Don Rickles"
                          },
                          {
                          "name": "Amy Schumer"
                          },
                          {
                          "name": "Ricky Gervais"
                          },
                          {
                          "name": "Bill Burr"
                          },
                          {
                          "name": "Chris Rock"
                          },
                          {
                          "name": "Sarah Jessica Parker"
                          },
                          {
                          "name": "Ted L. Nancy"
                          }
                          ],
               "images": {
               "poster": "http://assets.comediansincarsgettingcoffee.com/single-shots/sss2e7_poster.jpg",
               "thumb": "http://assets.comediansincarsgettingcoffee.com/single-shots/sss2e7_thumb.jpg"
               },
               "mediaUrl": "http://content.uplynk.com/ext/e8773f7770a44dbd886eee4fca16a66b/2494480.m3u8",
               "urlSlug": "mind-your-manners",
               "slug": "mind-your-manners",
               "pubDateTime": "2015-02-05T17:00:00.000Z",
               "videoUrl": "http://content-aeui1.uplynk.com/4fd27062d8ee4a658400b014c1f8432f/g.m3u8"
               },
               {
               "mediaId": 2494558,
               "type": "singleshot",
               "season": "02",
               "episode": "0008",
               "launchDate": "02/12/2015",
               "pubDate": "2015-02-12T17:00:00.000Z",
               "duration": "1:25",
               "durationSeconds": "85",
               "title": "Single Shot: Comedians Love Comedians",
               "description": "Jerry and his cast of special guests talk about the undeniable attraction between fellow comedians in the midst of 'regs.'",
               "guests": [
                          {
                          "name": "Amy Schumer"
                          },
                          {
                          "name": "Sarah Silverman"
                          },
                          {
                          "name": "Brian Regan"
                          },
                          {
                          "name": "Jimmy Fallon"
                          },
                          {
                          "name": "Fred Armisen"
                          },
                          {
                          "name": "Chris Rock"
                          }
                          ],
               "images": {
               "poster": "http://assets.comediansincarsgettingcoffee.com/single-shots/sss2e8_poster.jpg",
               "thumb": "http://assets.comediansincarsgettingcoffee.com/single-shots/sss2e8_thumb.jpg"
               },
               "mediaUrl": "http://content.uplynk.com/ext/e8773f7770a44dbd886eee4fca16a66b/2494558.m3u8",
               "urlSlug": "comedians-love-comedians",
               "slug": "comedians-love-comedians",
               "pubDateTime": "2015-02-12T17:00:00.000Z",
               "videoUrl": "http://content-aeui2.uplynk.com/3e44bffa82c74cc98c0b3bae9d02e300/g.m3u8"
               },
               {
               "mediaId": 2494559,
               "type": "singleshot",
               "season": "02",
               "episode": "0009",
               "launchDate": "02/19/2015",
               "pubDate": "2015-02-19T17:00:00.000Z",
               "duration": "2:12",
               "durationSeconds": "132",
               "title": "Single Shot: Passenger Restraint",
               "description": "Jerry and nearly every special guest he has had on the show attempt to decipher how to use the quality 5-star safety restrains in these classic cars.",
               "guests": [
                          {
                          "name": "Howard Stern"
                          },
                          {
                          "name": "Miranda Sings"
                          },
                          {
                          "name": "George Wallace"
                          },
                          {
                          "name": "Michael Richards"
                          },
                          {
                          "name": "Brian Regan"
                          },
                          {
                          "name": "Louis C.K."
                          },
                          {
                          "name": "Jimmy Fallon"
                          },
                          {
                          "name": "Jon Stewart"
                          },
                          {
                          "name": "Tina Fey"
                          },
                          {
                          "name": "Ted L. Nancy"
                          },
                          {
                          "name": "Fred Armisen"
                          },
                          {
                          "name": "Amy Schumer"
                          },
                          {
                          "name": "Sarah Jessica Parker"
                          },
                          {
                          "name": "Todd Barry"
                          },
                          {
                          "name": "Kevin Hart"
                          }
                          ],
               "images": {
               "poster": "http://assets.comediansincarsgettingcoffee.com/single-shots/sss2e9_poster.jpg",
               "thumb": "http://assets.comediansincarsgettingcoffee.com/single-shots/sss2e9_thumb.jpg"
               },
               "mediaUrl": "http://content.uplynk.com/ext/e8773f7770a44dbd886eee4fca16a66b/2494559.m3u8",
               "urlSlug": "passenger-restraint",
               "slug": "passenger-restraint",
               "pubDateTime": "2015-02-19T17:00:00.000Z",
               "videoUrl": "http://content-aeui2.uplynk.com/c71023040de649d290fde283d295e5c3/g.m3u8"
               },
               {
               "mediaId": 2494560,
               "type": "singleshot",
               "season": "02",
               "episode": "0010",
               "launchDate": "02/26/2015",
               "pubDate": "2015-02-26T17:00:00.000Z",
               "duration": "2:15",
               "durationSeconds": "135",
               "title": "Single Shot: Hitler",
               "description": "Jerry and his special guests think back to one of the most infamous figures in history: The Fuhrer, Adolf Hitler.",
               "guests": [
                          {
                          "name": "Carl Reiner"
                          },
                          {
                          "name": "Mel Brooks"
                          },
                          {
                          "name": "Michael Richards"
                          },
                          {
                          "name": "Ricky Gervais"
                          },
                          {
                          "name": "Bill Burr"
                          },
                          {
                          "name": "Ted L. Nancy"
                          }
                          ],
               "images": {
               "poster": "http://assets.comediansincarsgettingcoffee.com/single-shots/sss2e10_poster.jpg",
               "thumb": "http://assets.comediansincarsgettingcoffee.com/single-shots/sss2e10_thumb.jpg"
               },
               "mediaUrl": "http://content.uplynk.com/ext/e8773f7770a44dbd886eee4fca16a66b/2494560.m3u8",
               "urlSlug": "hitler",
               "slug": "hitler",
               "pubDateTime": "2015-02-26T17:00:00.000Z",
               "videoUrl": "http://content-aeui1.uplynk.com/ff07190209ff4ad891f89b529ed7d62a/g.m3u8"
               },
               {
               "mediaId": 2494594,
               "type": "singleshot",
               "season": "02",
               "episode": "0011",
               "launchDate": "03/5/2015",
               "pubDate": "2015-03-05T17:00:00.000Z",
               "duration": "1:04",
               "durationSeconds": "64",
               "title": "Single Shot: Hard Time",
               "description": "Jerry and his special guests, including Alec Baldwin and Michael Richards, discuss doing a little time in the 'slammer.'",
               "guests": [
                          {
                          "name": "Ted L. Nancy"
                          },
                          {
                          "name": "Alec Baldwin"
                          },
                          {
                          "name": "Chris Rock"
                          },
                          {
                          "name": "George Wallace"
                          },
                          {
                          "name": "Michael Richards"
                          },
                          {
                          "name": "Robert Klein"
                          }
                          ],
               "images": {
               "poster": "http://assets.comediansincarsgettingcoffee.com/single-shots/sss2e11_poster.jpg",
               "thumb": "http://assets.comediansincarsgettingcoffee.com/single-shots/sss2e11_thumb.jpg"
               },
               "mediaUrl": "http://content.uplynk.com/ext/e8773f7770a44dbd886eee4fca16a66b/2494594.m3u8",
               "urlSlug": "hard-time",
               "slug": "hard-time",
               "pubDateTime": "2015-03-05T17:00:00.000Z",
               "videoUrl": "http://content-aeui2.uplynk.com/ec685e83e7724ea1b9268ea6a4e777c6/g.m3u8"
               },
               {
               "mediaId": 2494595,
               "type": "singleshot",
               "season": "02",
               "episode": "0012",
               "launchDate": "03/12/2015",
               "pubDate": "2015-03-12T16:00:00.000Z",
               "duration": "1:38",
               "durationSeconds": "98",
               "title": "Single Shot: I've Got A Tip For You",
               "description": "Jerry and his special guests debate over what is an appropriate percentage celebrities should leave as a tip.",
               "guests": [
                          {
                          "name": "Sarah Jessica Parker"
                          },
                          {
                          "name": "Ali Wentworth"
                          },
                          {
                          "name": "Sarah Silverman"
                          },
                          {
                          "name": "George Wallace"
                          },
                          {
                          "name": "Alec Baldwin"
                          }
                          ],
               "images": {
               "poster": "http://assets.comediansincarsgettingcoffee.com/single-shots/sss2e12_poster.jpg",
               "thumb": "http://assets.comediansincarsgettingcoffee.com/single-shots/sss2e12_thumb.jpg"
               },
               "mediaUrl": "http://content.uplynk.com/ext/e8773f7770a44dbd886eee4fca16a66b/2494595.m3u8",
               "urlSlug": "i-ve-got-a-tip-for-you",
               "slug": "i-ve-got-a-tip-for-you",
               "pubDateTime": "2015-03-12T16:00:00.000Z",
               "videoUrl": "http://content-aeui1.uplynk.com/b11c047436c74024ae11bc038096a280/g.m3u8"
               },
               {
               "mediaId": 2494596,
               "type": "singleshot",
               "season": "02",
               "episode": "0013",
               "launchDate": "03/19/2015",
               "pubDate": "2015-03-19T16:00:00.000Z",
               "duration": "3:00",
               "durationSeconds": "180",
               "title": "Single Shot: When Comedians Reproduce",
               "description": "Jerry and his various special guests discuss the joys of parenting.",
               "guests": [
                          {
                          "name": "Jimmy Fallon"
                          },
                          {
                          "name": "Tina Fey"
                          },
                          {
                          "name": "Kevin Hart"
                          },
                          {
                          "name": "Patton Oswalt"
                          },
                          {
                          "name": "Michael Richards"
                          },
                          {
                          "name": "Ali Wentworth"
                          }
                          ],
               "images": {
               "poster": "http://assets.comediansincarsgettingcoffee.com/single-shots/sss2e13_poster.jpg",
               "thumb": "http://assets.comediansincarsgettingcoffee.com/single-shots/sss2e13_thumb.jpg"
               },
               "mediaUrl": "http://content.uplynk.com/ext/e8773f7770a44dbd886eee4fca16a66b/2494596.m3u8",
               "urlSlug": "when-comedians-reproduce",
               "slug": "when-comedians-reproduce",
               "pubDateTime": "2015-03-19T16:00:00.000Z",
               "videoUrl": "http://content-aeui2.uplynk.com/04913b659417484db3514e8e598239bd/g.m3u8"
               },
               {
               "mediaId": 2494597,
               "type": "singleshot",
               "season": "02",
               "episode": "0014",
               "launchDate": "03/26/2015",
               "pubDate": "2015-03-26T16:00:00.000Z",
               "duration": "1:37",
               "durationSeconds": "97",
               "title": "Single Shot: Playing Chicken",
               "description": "Jerry and his special guests Carl Reiner, Chris Rock, Kevin Hart, Larry David, Mario Joyner and Colin Quinn, grab some coffee and deliberate over eating chicken.",
               "guests": [
                          {
                          "name": "Carl Reiner"
                          },
                          {
                          "name": "Chris Rock"
                          },
                          {
                          "name": "Larry David"
                          },
                          {
                          "name": "Colin Quinn"
                          },
                          {
                          "name": "Mario Joyner"
                          },
                          {
                          "name": "Kevin Hart"
                          }
                          ],
               "images": {
               "poster": "http://assets.comediansincarsgettingcoffee.com/single-shots/sss2e14_poster.jpg",
               "thumb": "http://assets.comediansincarsgettingcoffee.com/single-shots/sss2e14_thumb.jpg"
               },
               "mediaUrl": "http://content.uplynk.com/ext/e8773f7770a44dbd886eee4fca16a66b/2494597.m3u8",
               "urlSlug": "playing-chicken",
               "slug": "playing-chicken",
               "pubDateTime": "2015-03-26T16:00:00.000Z",
               "videoUrl": "http://content-aeui1.uplynk.com/079c97e7f6cf4156a4041eb065f0f380/g.m3u8"
               },
               {
               "mediaId": 2494598,
               "type": "singleshot",
               "season": "02",
               "episode": "0015",
               "launchDate": "04/02/2015",
               "pubDate": "2015-04-02T16:00:00.000Z",
               "duration": "1:40",
               "durationSeconds": "100",
               "title": "Single Shot: Analogy Lad",
               "description": "Analogy Lad and his special guests put his useless super power to good use in this episode of Single Shot.",
               "guests": [
                          {
                          "name": "Todd Barry"
                          },
                          {
                          "name": "George Wallace"
                          },
                          {
                          "name": "Sarah Silverman"
                          },
                          {
                          "name": "Fred Armisen"
                          },
                          {
                          "name": "Kevin Hart"
                          },
                          {
                          "name": "Jimmy Fallon"
                          }
                          ],
               "images": {
               "poster": "http://assets.comediansincarsgettingcoffee.com/single-shots/sss2e15_poster.jpg",
               "thumb": "http://assets.comediansincarsgettingcoffee.com/single-shots/sss2e15_thumb.jpg"
               },
               "mediaUrl": "http://content.uplynk.com/ext/e8773f7770a44dbd886eee4fca16a66b/2494598.m3u8",
               "urlSlug": "analogy-lad",
               "slug": "analogy-lad",
               "pubDateTime": "2015-04-02T16:00:00.000Z",
               "videoUrl": "http://content-aeui1.uplynk.com/adc67845cee0465e91710097e294f29a/g.m3u8"
               },
               {
               "mediaId": 2494599,
               "type": "singleshot",
               "season": "02",
               "episode": "0016",
               "launchDate": "04/09/2015",
               "pubDate": "2015-04-09T16:00:00.000Z",
               "duration": "2:04",
               "durationSeconds": "124",
               "title": "Single Shot: Lazy Comedians",
               "description": "Jerry and his group of lethargic special guests continue to do nothing as they drive around, drink coffee and enjoy some good conversation.",
               "guests": [
                          {
                          "name": "Larry David"
                          },
                          {
                          "name": "Sarah Silverman"
                          },
                          {
                          "name": "Tina Fey"
                          },
                          {
                          "name": "Alec Baldwin"
                          },
                          {
                          "name": "Aziz Ansari"
                          },
                          {
                          "name": "Louis C.K."
                          },
                          {
                          "name": "Brian Regan"
                          }
                          ],
               "images": {
               "poster": "http://assets.comediansincarsgettingcoffee.com/single-shots/sss2e16_poster.jpg",
               "thumb": "http://assets.comediansincarsgettingcoffee.com/single-shots/sss2e16_thumb.jpg"
               },
               "mediaUrl": "http://content.uplynk.com/ext/e8773f7770a44dbd886eee4fca16a66b/2494599.m3u8",
               "urlSlug": "lazy-comedians",
               "slug": "lazy-comedians",
               "pubDateTime": "2015-04-09T16:00:00.000Z",
               "videoUrl": "http://content-aeui2.uplynk.com/2108cf26bd7d4352a9100781a56722b2/g.m3u8"
               },
               {
               "mediaId": 2494600,
               "type": "singleshot",
               "season": "02",
               "episode": "0017",
               "launchDate": "04/16/2015",
               "pubDate": "2015-04-16T16:00:00.000Z",
               "duration": "1:59",
               "durationSeconds": "119",
               "title": "Single Shot: Getting Paid",
               "description": " Jerry and his special guests think back to their first gigs as they discuss getting paid to make people laugh...or not.",
               "guests": [
                          {
                          "name": "George Wallace"
                          },
                          {
                          "name": "Don Rickles"
                          },
                          {
                          "name": "Jay Leno"
                          },
                          {
                          "name": "Bill Burr"
                          },
                          {
                          "name": "Seth Meyers"
                          },
                          {
                          "name": "Brian Regan"
                          },
                          {
                          "name": "Todd Barry"
                          }
                          ],
               "images": {
               "poster": "http://assets.comediansincarsgettingcoffee.com/single-shots/sss2e17_poster.jpg",
               "thumb": "http://assets.comediansincarsgettingcoffee.com/single-shots/sss2e17_thumb.jpg"
               },
               "mediaUrl": "http://content.uplynk.com/ext/e8773f7770a44dbd886eee4fca16a66b/2494600.m3u8",
               "urlSlug": "getting-paid",
               "slug": "getting-paid",
               "pubDateTime": "2015-04-16T16:00:00.000Z",
               "videoUrl": "http://content-aeui1.uplynk.com/99cd21a875b84f53aaabe83f73284d94/g.m3u8"
               },
               {
               "mediaId": 2494601,
               "type": "singleshot",
               "season": "02",
               "episode": "0018",
               "launchDate": "04/23/2015",
               "pubDate": "2015-04-23T16:00:00.000Z",
               "duration": "2:16",
               "durationSeconds": "136",
               "title": "Single Shot: High & Mighty",
               "description": "Jerry and his special guests discuss kickin' back and smoking some herb.",
               "guests": [
                          {
                          "name": "Sarah Silverman"
                          },
                          {
                          "name": "Louis C.K."
                          },
                          {
                          "name": "Bob Einstein"
                          },
                          {
                          "name": "Amy Schumer"
                          },
                          {
                          "name": "Jon Stewart"
                          }
                          ],
               "images": {
               "poster": "http://assets.comediansincarsgettingcoffee.com/single-shots/sss2e18_poster.jpg",
               "thumb": "http://assets.comediansincarsgettingcoffee.com/single-shots/sss2e18_thumb.jpg"
               },
               "mediaUrl": "http://content.uplynk.com/ext/e8773f7770a44dbd886eee4fca16a66b/2494601.m3u8",
               "urlSlug": "high-and-mighty",
               "slug": "high-and-mighty",
               "pubDateTime": "2015-04-23T16:00:00.000Z",
               "videoUrl": "http://content-aeui1.uplynk.com/a64ed6a1ab634be49c4cd4dce4f9bfbf/g.m3u8"
               },
               {
               "mediaId": 2494602,
               "type": "singleshot",
               "season": "02",
               "episode": "0019",
               "launchDate": "04/30/2015",
               "pubDate": "2015-04-30T16:00:00.000Z",
               "duration": "3:38",
               "durationSeconds": "218",
               "title": "Single Shot: Passing Ketchup",
               "description": "Jerry and his special guests enjoy the creamy red condiment as American as apple pie: Ketchup.",
               "guests": [
                          {
                          "name": "Gad Elmaleh"
                          },
                          {
                          "name": "Joel Hodgson"
                          },
                          {
                          "name": "Larry David"
                          },
                          {
                          "name": "Brian Regan"
                          },
                          {
                          "name": "Bob Einstein"
                          }
                          ],
               "images": {
               "poster": "http://assets.comediansincarsgettingcoffee.com/single-shots/sss2e19_poster.jpg",
               "thumb": "http://assets.comediansincarsgettingcoffee.com/single-shots/sss2e19_thumb.jpg"
               },
               "mediaUrl": "http://content.uplynk.com/ext/e8773f7770a44dbd886eee4fca16a66b/2494602.m3u8",
               "urlSlug": "passing-ketchup",
               "slug": "passing-ketchup",
               "pubDateTime": "2015-04-30T16:00:00.000Z",
               "videoUrl": "http://content-aeui1.uplynk.com/5f30e9c8002649148301ff0c126022e1/g.m3u8"
               },
               {
               "mediaId": 2494603,
               "type": "singleshot",
               "season": "02",
               "episode": "0020",
               "launchDate": "05/7/2015",
               "pubDate": "2015-05-07T16:00:00.000Z",
               "duration": "2:15",
               "durationSeconds": "135",
               "title": "Single Shot: Mr. Warmth",
               "description": "Jerry and his special guests, including Mr. Warmth himself, chat about the man, the myth, the legend: Don Rickles.",
               "guests": [
                          {
                          "name": "Sarah Silverman"
                          },
                          {
                          "name": "David Letterman"
                          },
                          {
                          "name": "Don Rickles"
                          },
                          {
                          "name": "Seth Meyers"
                          },
                          {
                          "name": "Howard Stern"
                          },
                          {
                          "name": "Jon Stewart"
                          }
                          ],
               "images": {
               "poster": "http://assets.comediansincarsgettingcoffee.com/single-shots/sss2e20_poster.jpg",
               "thumb": "http://assets.comediansincarsgettingcoffee.com/single-shots/sss2e20_thumb.jpg"
               },
               "mediaUrl": "http://content.uplynk.com/ext/e8773f7770a44dbd886eee4fca16a66b/2494603.m3u8",
               "urlSlug": "mr-warmth",
               "slug": "mr-warmth",
               "pubDateTime": "2015-05-07T16:00:00.000Z",
               "videoUrl": "http://content-aeui1.uplynk.com/eb4ee2149bfd47fcbe0eaf4dedd64b40/g.m3u8"
               },
               {
               "mediaId": 2494604,
               "type": "singleshot",
               "season": "02",
               "episode": "0021",
               "launchDate": "05/14/2015",
               "pubDate": "2015-05-14T16:00:00.000Z",
               "duration": "1:52",
               "durationSeconds": "112",
               "title": "Single Shot: Jewish Food",
               "description": "Jerry and his special guests discuss Jewish cuisine and the lewd eating habits that go along with it.",
               "guests": [
                          {
                          "name": "George Wallace"
                          },
                          {
                          "name": "Carl Reiner"
                          },
                          {
                          "name": "Mel Brooks"
                          },
                          {
                          "name": "Sarah Silverman"
                          },
                          {
                          "name": "Ali Wentworth"
                          },
                          {
                          "name": "Bob Einstein"
                          }
                          ],
               "images": {
               "poster": "http://assets.comediansincarsgettingcoffee.com/single-shots/sss2e21_poster.jpg",
               "thumb": "http://assets.comediansincarsgettingcoffee.com/single-shots/sss2e21_thumb.jpg"
               },
               "mediaUrl": "http://content.uplynk.com/ext/e8773f7770a44dbd886eee4fca16a66b/2494604.m3u8",
               "urlSlug": "jewish-food",
               "slug": "jewish-food",
               "pubDateTime": "2015-05-14T16:00:00.000Z",
               "videoUrl": "http://content-aeui1.uplynk.com/c0febc4d6782413eb87b68f7d531bb1e/g.m3u8"
               },
               {
               "mediaId": 2494605,
               "type": "singleshot",
               "season": "02",
               "episode": "0022",
               "launchDate": "05/21/2015",
               "pubDate": "2015-05-21T16:00:00.000Z",
               "duration": "1:46",
               "durationSeconds": "106",
               "title": "Single Shot: Death Trap",
               "description": "Jerry and his special guests come to grips with their own mortality in this episode of Single Shot.",
               "guests": [
                          {
                          "name": "Ricky Gervais"
                          },
                          {
                          "name": "Amy Schumer"
                          },
                          {
                          "name": "Jon Stewart"
                          },
                          {
                          "name": "David Letterman"
                          },
                          {
                          "name": "Michael Richards"
                          }
                          ],
               "images": {
               "poster": "http://assets.comediansincarsgettingcoffee.com/single-shots/sss2e22_poster.jpg",
               "thumb": "http://assets.comediansincarsgettingcoffee.com/single-shots/sss2e22_thumb.jpg"
               },
               "mediaUrl": "http://content.uplynk.com/ext/e8773f7770a44dbd886eee4fca16a66b/2494605.m3u8",
               "urlSlug": "death-trap",
               "slug": "death-trap",
               "pubDateTime": "2015-05-21T16:00:00.000Z",
               "videoUrl": "http://content-aeui2.uplynk.com/e4c69eb48a354e2da47d860acd22613a/g.m3u8"
               },
               {
               "mediaId": 2494822,
               "type": "singleshot",
               "season": "02",
               "episode": "0023",
               "launchDate": "05/28/2015",
               "pubDate": "2015-05-28T16:00:00.000Z",
               "duration": "2:03",
               "durationSeconds": "123",
               "title": "Single Shot: 108 Stitches",
               "description": "Jerry and his special guests discuss America's pastime in this episode of Single Shot.",
               "guests": [
                          {
                          "name": "George Wallace"
                          },
                          {
                          "name": "Seth Meyers"
                          },
                          {
                          "name": "Patton Oswalt"
                          },
                          {
                          "name": "Don Rickles"
                          },
                          {
                          "name": "Brian Regan"
                          },
                          {
                          "name": "Louis C.K."
                          }
                          ],
               "images": {
               "poster": "http://assets.comediansincarsgettingcoffee.com/single-shots/sss2e23_poster.jpg",
               "thumb": "http://assets.comediansincarsgettingcoffee.com/single-shots/sss2e23_thumb.jpg"
               },
               "mediaUrl": "http://content.uplynk.com/ext/e8773f7770a44dbd886eee4fca16a66b/2494822.m3u8",
               "urlSlug": "108-stitches",
               "slug": "108-stitches",
               "pubDateTime": "2015-05-28T16:00:00.000Z",
               "videoUrl": "http://content-aeui1.uplynk.com/851586bb30b74616bc094d9fb08ec2ed/g.m3u8"
               },
               {
               "mediaId": 2491275,
               "type": "season-trailer",
               "season": "03",
               "episode": "0000",
               "launchDate": "12/23/2013",
               "pubDate": "2013-12-23T18:00:00.000Z",
               "duration": "1:53",
               "durationSeconds": "113",
               "title": "Hop in. We're getting coffee with Patton Oswalt, Howard Stern, Jay Leno, Tina Fey, Todd Barry, and Louis C.K.",
               "description": "Jerry Seinfeld is joined by friends for a drive in a classic car and having coffee, sharing stories all along the way.",
               "guests": [
                          {
                          "name": "Next Week's Trailer"
                          }
                          ],
               "images": {
               "poster": "http://ccc.crackle.com/images/s3_trailer_poster.jpg",
               "thumb": "http://ccc.crackle.com/images/s3_trailer_thumb.jpg"
               },
               "mediaUrl": "http://content.uplynk.com/ext/e8773f7770a44dbd886eee4fca16a66b/2491275.m3u8",
               "urlSlug": "next-week-s-trailer-hop-in-we-re-getting-coffee-with-patton-oswalt-howard-stern-jay-leno-tina-fey-todd-barry-and-louis-c-k",
               "pubDateTime": 1387821600,
               "slug": "next-week-s-trailer-season-trailer",
               "videoUrl": "http://content-ause1.uplynk.com/e9d667da4966499288af2de1e12f6fc0/g.m3u8"
               },
               {
               "mediaId": 2491175,
               "type": "season-trailer",
               "season": "03",
               "episode": "0000",
               "launchDate": "12/12/2013",
               "pubDate": "2013-12-12T16:00:00.000Z",
               "duration": "1:03",
               "durationSeconds": "63",
               "title": "New season starts January 2nd.",
               "description": "Jerry Seinfeld is joined by friends for a drive in a classic car and having coffee, sharing stories all along the way.",
               "guests": [
                          {
                          "name": "New Year's Resolution. Watch More Comedians in Cars Getting Coffee."
                          }
                          ],
               "images": {
               "poster": "http://ccc.crackle.com/images/s3_trailer_poster.jpg",
               "thumb": "http://ccc.crackle.com/images/s3_trailer_thumb.jpg"
               },
               "mediaUrl": "http://content.uplynk.com/ext/e8773f7770a44dbd886eee4fca16a66b/2491175.m3u8",
               "urlSlug": "new-year-s-resolution-watch-more-comedians-in-cars-getting-coffee-new-season-starts-january-2nd",
               "pubDateTime": 1386864000,
               "slug": "new-year-s-resolution-watch-more-comedians-in-cars-getting-coffee-season-trailer",
               "videoUrl": "http://content-ause4.uplynk.com/7ceb582a2ec54751a9c83dea468a7cd5/g.m3u8"
               },
               {
               "mediaId": 2491279,
               "type": "episode",
               "season": "03",
               "episode": "0001",
               "launchDate": "1/02/2014",
               "pubDate": "2014-01-02T16:00:00.000Z",
               "duration": "22:39",
               "durationSeconds": "1359",
               "title": "Comedy, Sex and The Blue Numbers",
               "description": "Jerry's special guest is Louis C.K. in this episode of Comedians In Cars Getting Coffee.",
               "guests": [
                          {
                          "name": "Louis C.K."
                          }
                          ],
               "images": {
               "poster": "http://ccc.crackle.com/images/s3e1_episode_poster.jpg",
               "thumb": "http://ccc.crackle.com/images/s3e1_episode_thumb.jpg"
               },
               "mediaUrl": "http://content.uplynk.com/ext/e8773f7770a44dbd886eee4fca16a66b/2491279.m3u8?ad=crackle_live",
               "urlSlug": "louis-c-k-comedy-sex-and-the-blue-numbers",
               "pubDateTime": 1388678400,
               "slug": "louis-c-k-comedy-sex-and-the-blue-numbers",
               "videoUrl": "http://content-ause4.uplynk.com/bbcd0bc2529e439d92fab8bd7b0fb018/g.m3u8?ad=crackle_live&pbs=eb10f5ceb33444b4861453dff62f093d"
               },
               {
               "mediaId": 2495639,
               "type": "singleshot",
               "season": "03",
               "episode": "0001",
               "launchDate": "07/15/2015",
               "pubDate": "2015-07-16T03:30:00.000Z",
               "duration": "01:55",
               "durationSeconds": "115",
               "title": "Single Shot: In and Out",
               "description": "Jerry's special guests in this Single Shot include Alec Baldwin, Jim Carrey, Kevin Hart and Julia Louis-Dreyfus.",
               "guests": [
                          {
                          "name": "Alec Baldwin"
                          },
                          {
                          "name": "Jim Carrey"
                          },
                          {
                          "name": "Kevin Hart"
                          },
                          {
                          "name": "Julia Louis-Dreyfus"
                          },
                          {
                          "name": "Gad Elmaleh"
                          },
                          {
                          "name": "Jimmy Fallon"
                          },
                          {
                          "name": "Jay Leno"
                          },
                          {
                          "name": "Barry Marder"
                          },
                          {
                          "name": "Brian Regan"
                          },
                          {
                          "name": "Chris Rock"
                          },
                          {
                          "name": "George Wallace"
                          },
                          {
                          "name": "Jerry Seinfeld"
                          }
                          ],
               "images": {
               "poster": "http://assets.comediansincarsgettingcoffee.com/single-shots/sss3e1_poster.jpg",
               "thumb": "http://assets.comediansincarsgettingcoffee.com/single-shots/sss3e1_thumb.jpg"
               },
               "mediaUrl": "http://content.uplynk.com/ext/e8773f7770a44dbd886eee4fca16a66b/2495639.m3u8",
               "urlSlug": "in-and-out",
               "slug": "in-and-out",
               "pubDateTime": "2015-07-16T03:30:00.000Z",
               "videoUrl": "http://content-aeui1.uplynk.com/3ab27b530ae4457b88a22632dbb311bb/g.m3u8"
               },
               {
               "mediaId": 2495745,
               "type": "singleshot",
               "season": "03",
               "episode": "00014",
               "launchDate": "10/14/2015",
               "pubDate": "2015-10-15T03:30:00.000Z",
               "duration": "01:10",
               "durationSeconds": "70",
               "title": "Single Shot: Rain Man",
               "description": " There is no means of transportation too difficult for Jerry and his special guests in this episode of Single Shot.",
               "guests": [
                          {
                          "name": "Jerry Seinfeld"
                          },
                          {
                          "name": "Ricky Gervais"
                          },
                          {
                          "name": "Louis C.K."
                          },
                          {
                          "name": "Fred Armisen"
                          },
                          {
                          "name": "Chris Rock"
                          },
                          {
                          "name": "Steve Harvey"
                          },
                          {
                          "name": "Aziz Ansari"
                          },
                          {
                          "name": "Seth Meyers"
                          },
                          {
                          "name": "Howard Stern"
                          },
                          {
                          "name": "Trevor Noah"
                          },
                          {
                          "name": "Kevin Hart"
                          },
                          {
                          "name": "Jimmy Fallon"
                          }
                          ],
               "images": {
               "poster": "http://assets.comediansincarsgettingcoffee.com/single-shots/sss3e14_poster.jpg",
               "thumb": "http://assets.comediansincarsgettingcoffee.com/single-shots/sss3e14_thumb.jpg"
               },
               "mediaUrl": "http://content.uplynk.com/ext/e8773f7770a44dbd886eee4fca16a66b/2495745.m3u8",
               "urlSlug": "rain-man",
               "slug": "rain-man",
               "pubDateTime": "2015-10-15T03:30:00.000Z",
               "videoUrl": "http://content-aeui2.uplynk.com/2a9f2903d9b94123bada840451e3a5b2/g.m3u8"
               },
               {
               "mediaId": 2495746,
               "type": "singleshot",
               "season": "03",
               "episode": "00015",
               "launchDate": "10/21/2015",
               "pubDate": "2015-10-22T03:30:00.000Z",
               "duration": "01:10",
               "durationSeconds": "70",
               "title": "Single Shot: Say What",
               "description": " On this episode of Single Shot, Jerry and his esteemed guests dare to ask the burning questions that lie on all of our minds.",
               "guests": [
                          {
                          "name": "Jerry Seinfeld"
                          },
                          {
                          "name": "Gad Elmaleh"
                          },
                          {
                          "name": "Sarah Silverman"
                          },
                          {
                          "name": "Louis C.K."
                          },
                          {
                          "name": "Fred Armisen"
                          },
                          {
                          "name": "Todd Barry"
                          },
                          {
                          "name": "Julia Louis-Dreyfus"
                          },
                          {
                          "name": "Bill Maher"
                          },
                          {
                          "name": "Jon Stewart"
                          },
                          {
                          "name": "David Letterman"
                          },
                          {
                          "name": "Miranda Sings"
                          },
                          {
                          "name": "Larry David"
                          }
                          ],
               "images": {
               "poster": "http://assets.comediansincarsgettingcoffee.com/single-shots/sss3e15_poster.jpg",
               "thumb": "http://assets.comediansincarsgettingcoffee.com/single-shots/sss3e15_thumb.jpg"
               },
               "mediaUrl": "http://content.uplynk.com/ext/e8773f7770a44dbd886eee4fca16a66b/2495746.m3u8",
               "urlSlug": "say-what",
               "slug": "say-what",
               "pubDateTime": "2015-10-22T03:30:00.000Z",
               "videoUrl": "http://content-aeui2.uplynk.com/8211e5998cbb427383a7c0db508d23dc/g.m3u8"
               },
               {
               "mediaId": 2495747,
               "type": "singleshot",
               "season": "03",
               "episode": "00016",
               "launchDate": "10/28/2015",
               "pubDate": "2015-10-29T03:30:00.000Z",
               "duration": "01:36",
               "durationSeconds": "96",
               "title": "Single Shot: Forty-Five Seconds",
               "description": "Jerry and his special guests Steve Harvey, Kevin Hart, Chris Rock and Trevor Noah share their perspectives in this episode of Single Shot.",
               "guests": [
                          {
                          "name": "Jerry Seinfeld"
                          },
                          {
                          "name": "Steve Harvey"
                          },
                          {
                          "name": "Kevin Hart"
                          },
                          {
                          "name": "Chris Rock"
                          },
                          {
                          "name": "Trevor Noah"
                          }
                          ],
               "images": {
               "poster": "http://assets.comediansincarsgettingcoffee.com/single-shots/sss3e16_poster.jpg",
               "thumb": "http://assets.comediansincarsgettingcoffee.com/single-shots/sss3e16_thumb.jpg"
               },
               "mediaUrl": "http://content.uplynk.com/ext/e8773f7770a44dbd886eee4fca16a66b/2495747.m3u8",
               "urlSlug": "forty-five-seconds",
               "slug": "forty-five-seconds",
               "pubDateTime": "2015-10-29T03:30:00.000Z",
               "videoUrl": "http://content-aeui2.uplynk.com/fa8c9171ed8b4fc789f723a26335a8b6/g.m3u8"
               },
               {
               "mediaId": 2495748,
               "type": "singleshot",
               "season": "03",
               "episode": "00017",
               "launchDate": "11/4/2015",
               "pubDate": "2015-11-05T04:30:00.000Z",
               "duration": "01:56",
               "durationSeconds": "116",
               "title": "Single Shot: We Love Old Guys",
               "description": "Jerry and his special guests explore the subtleties of old guys and the reasons we love them.",
               "guests": [
                          {
                          "name": "Jerry Seinfeld"
                          },
                          {
                          "name": "Steve Harvey"
                          },
                          {
                          "name": "Robert Klein"
                          },
                          {
                          "name": "Carl Reiner"
                          },
                          {
                          "name": "George Wallace"
                          }
                          ],
               "images": {
               "poster": "http://assets.comediansincarsgettingcoffee.com/single-shots/sss3e17_poster.jpg",
               "thumb": "http://assets.comediansincarsgettingcoffee.com/single-shots/sss3e17_thumb.jpg"
               },
               "mediaUrl": "http://content.uplynk.com/ext/e8773f7770a44dbd886eee4fca16a66b/2495748.m3u8",
               "urlSlug": "we-love-old-guys",
               "slug": "we-love-old-guys",
               "pubDateTime": "2015-11-05T04:30:00.000Z",
               "videoUrl": "http://content-aeui1.uplynk.com/de072b14486a4ce68b76d6850b753d3a/g.m3u8"
               },
               {
               "mediaId": 2495749,
               "type": "singleshot",
               "season": "03",
               "episode": "00018",
               "launchDate": "11/11/2015",
               "pubDate": "2015-11-12T04:30:00.000Z",
               "duration": "01:56",
               "durationSeconds": "116",
               "title": "Single Shot: Joke-Ology",
               "description": "On today's episode of Single Shot, Jerry and his special guests explore the creativity of formulating jokes.",
               "guests": [
                          {
                          "name": "Jerry Seinfeld"
                          },
                          {
                          "name": "Aziz Ansari"
                          },
                          {
                          "name": "Jimmy Fallon"
                          },
                          {
                          "name": "Jim Carrey"
                          },
                          {
                          "name": "Louis C.K."
                          },
                          {
                          "name": "Todd Barry"
                          },
                          {
                          "name": "Trevor Noah"
                          },
                          {
                          "name": "Bill Maher"
                          }
                          ],
               "images": {
               "poster": "http://assets.comediansincarsgettingcoffee.com/single-shots/sss3e18_poster.jpg",
               "thumb": "http://assets.comediansincarsgettingcoffee.com/single-shots/sss3e18_thumb.jpg"
               },
               "mediaUrl": "http://content.uplynk.com/ext/e8773f7770a44dbd886eee4fca16a66b/2495749.m3u8",
               "urlSlug": "joke-ology",
               "slug": "joke-ology",
               "pubDateTime": "2015-11-12T04:30:00.000Z",
               "videoUrl": "http://content-aeui1.uplynk.com/c64e7284adc048c1b3af6b3ced8f6d95/g.m3u8"
               },
               {
               "mediaId": 2495750,
               "type": "singleshot",
               "season": "03",
               "episode": "00019",
               "launchDate": "11/18/2015",
               "pubDate": "2015-11-19T04:30:00.000Z",
               "duration": "01:33",
               "durationSeconds": "93",
               "title": "Single Shot: Jerry Is How Old",
               "description": "Jerry and his special guests share interesting reactions on the subject of Age in this episode of Single Shot.",
               "guests": [
                          {
                          "name": "Jerry Seinfeld"
                          },
                          {
                          "name": "Fred Armisen"
                          },
                          {
                          "name": "Mel Brooks"
                          },
                          {
                          "name": "Howard Stern"
                          },
                          {
                          "name": "Jim Carrey"
                          },
                          {
                          "name": "Steve Harvey"
                          },
                          {
                          "name": "Miranda Sings"
                          },
                          {
                          "name": "Stephen Colbert"
                          },
                          {
                          "name": "Chris Rock"
                          },
                          {
                          "name": "Julia Louis-Dreyfus"
                          },
                          {
                          "name": "George Wallace"
                          },
                          {
                          "name": "Trevor Noah"
                          },
                          {
                          "name": "Bill Burr"
                          }
                          ],
               "images": {
               "poster": "http://assets.comediansincarsgettingcoffee.com/single-shots/sss3e19_poster.jpg",
               "thumb": "http://assets.comediansincarsgettingcoffee.com/single-shots/sss3e19_thumb.jpg"
               },
               "mediaUrl": "http://content.uplynk.com/ext/e8773f7770a44dbd886eee4fca16a66b/2495750.m3u8",
               "urlSlug": "jerry-is-how-old",
               "slug": "jerry-is-how-old",
               "pubDateTime": "2015-11-19T04:30:00.000Z",
               "videoUrl": "http://content-aeui1.uplynk.com/20ed05c4d401497a9140f8e01f13d8b1/g.m3u8"
               },
               {
               "mediaId": 2491297,
               "type": "episode",
               "season": "03",
               "episode": "0002",
               "launchDate": "1/09/2014",
               "pubDate": "2014-01-09T16:00:00.000Z",
               "duration": "12:31",
               "durationSeconds": "751",
               "title": "How Would You Kill Superman?",
               "description": "Jerry's special guest is Patton Oswalt in this episode of Comedians In Cars Getting Coffee.",
               "guests": [
                          {
                          "name": "Patton Oswalt"
                          }
                          ],
               "images": {
               "poster": "http://ccc.crackle.com/images/s3e2_episode_poster.jpg",
               "thumb": "http://ccc.crackle.com/images/s3e2_episode_thumb.jpg"
               },
               "mediaUrl": "http://content.uplynk.com/ext/e8773f7770a44dbd886eee4fca16a66b/2491297.m3u8?ad=crackle_live",
               "urlSlug": "patton-oswalt-how-would-you-kill-superman",
               "pubDateTime": 1389283200,
               "slug": "patton-oswalt-how-would-you-kill-superman",
               "videoUrl": "http://content-ause1.uplynk.com/b1eac72398d849a9a4070b0499b6eab9/g.m3u8?ad=crackle_live&pbs=e779b2fd0299449f90aa433292430c0e"
               },
               {
               "mediaId": 2491282,
               "type": "episode-trailer",
               "season": "03",
               "episode": "0002",
               "launchDate": "01/06/2014",
               "pubDate": "2014-01-06T19:00:00.000Z",
               "duration": "00:57",
               "durationSeconds": "57",
               "title": "Episode Trailer",
               "description": "Jerry's special guest is Patton Oswalt in this episode of Comedians In Cars Getting Coffee.",
               "guests": [
                          {
                          "name": "Patton Oswalt"
                          }
                          ],
               "images": {
               "poster": "http://ccc.crackle.com/images/s3e2_poster.jpg",
               "thumb": "http://ccc.crackle.com/images/s3e2_thumb.jpg"
               },
               "mediaUrl": "http://content.uplynk.com/ext/e8773f7770a44dbd886eee4fca16a66b/2491282.m3u8",
               "urlSlug": "patton-oswalt-how-would-you-kill-superman",
               "pubDateTime": 1389034800,
               "slug": "patton-oswalt-episode-trailer",
               "videoUrl": "http://content-ause2.uplynk.com/c1048a44a21b43e1a797fcfcdb9e064f/g.m3u8"
               },
               {
               "mediaId": 2495640,
               "type": "singleshot",
               "season": "03",
               "episode": "0002",
               "launchDate": "07/22/2015",
               "pubDate": "2015-07-23T03:30:00.000Z",
               "duration": "01:26",
               "durationSeconds": "86",
               "title": "Single Shot: Who Cares?",
               "description": "Do you care about this weeks installment of Single Shot?  Of course you do!   Watch as Jerry and special guests debate the age-old question,  'Who Cares?'",
               "guests": [
                          {
                          "name": "Aziz Ansari"
                          },
                          {
                          "name": "Bill Burr"
                          },
                          {
                          "name": "Larry David"
                          },
                          {
                          "name": "Bob Einstein"
                          },
                          {
                          "name": "Gad Elmaleh"
                          },
                          {
                          "name": "Kevin Hart"
                          },
                          {
                          "name": "David Letterman"
                          },
                          {
                          "name": "Jay Leno"
                          },
                          {
                          "name": "Bill Maher"
                          },
                          {
                          "name": "Seth Meyers"
                          },
                          {
                          "name": "Brian Regan"
                          },
                          {
                          "name": "Michael Richards"
                          },
                          {
                          "name": "Don Rickles"
                          },
                          {
                          "name": "Chris Rock"
                          },
                          {
                          "name": "Howard Stern"
                          },
                          {
                          "name": "Jon Stewart"
                          },
                          {
                          "name": "George Wallace"
                          },
                          {
                          "name": "Ali Wentworth"
                          }
                          ],
               "images": {
               "poster": "http://assets.comediansincarsgettingcoffee.com/single-shots/sss3e2_poster.jpg",
               "thumb": "http://assets.comediansincarsgettingcoffee.com/single-shots/sss3e2_thumb.jpg"
               },
               "mediaUrl": "http://content.uplynk.com/ext/e8773f7770a44dbd886eee4fca16a66b/2495640.m3u8",
               "urlSlug": "who-cares",
               "slug": "who-cares",
               "pubDateTime": "2015-07-23T03:30:00.000Z",
               "videoUrl": "http://content-aeui1.uplynk.com/51fb8dffaaa1448a94b8629df85fd96d/g.m3u8"
               },
               {
               "mediaId": 2495751,
               "type": "singleshot",
               "season": "03",
               "episode": "00020",
               "launchDate": "11/25/2015",
               "pubDate": "2015-11-26T04:30:00.000Z",
               "duration": "01:40",
               "durationSeconds": "100",
               "title": "Single Shot: Stick It",
               "description": "Jerry and his special guests explore the complexities and rewards of driving stick shift vehicles in this episode of Single Shot.",
               "guests": [
                          {
                          "name": "Jerry Seinfeld"
                          },
                          {
                          "name": "Howard Stern"
                          },
                          {
                          "name": "Larry David"
                          },
                          {
                          "name": "Gad Elmaleh"
                          },
                          {
                          "name": "Stephen Colbert"
                          },
                          {
                          "name": "Sarah Silverman"
                          },
                          {
                          "name": "Fred Armisen"
                          }
                          ],
               "images": {
               "poster": "http://assets.comediansincarsgettingcoffee.com/single-shots/sss3e20_poster.jpg",
               "thumb": "http://assets.comediansincarsgettingcoffee.com/single-shots/sss3e20_thumb.jpg"
               },
               "mediaUrl": "http://content.uplynk.com/ext/e8773f7770a44dbd886eee4fca16a66b/2495751.m3u8",
               "urlSlug": "stick-it",
               "slug": "stick-it",
               "pubDateTime": "2015-11-26T04:30:00.000Z",
               "videoUrl": "http://content-aeui1.uplynk.com/1207895ef36c41ccabb656dc9fc3527c/g.m3u8"
               },
               {
               "mediaId": 2495895,
               "type": "singleshot",
               "season": "03",
               "episode": "00021",
               "launchDate": "12/2/2015",
               "pubDate": "2015-12-03T04:30:00.000Z",
               "duration": "02:08",
               "durationSeconds": "128",
               "title": "Single Shot: Potty Mouth",
               "description": "On this episode of Single Shot, Jerry Seinfeld and his esteemed guests find the humorous side of a dirty joke.",
               "guests": [
                          {
                          "name": "Jerry Seinfeld"
                          },
                          {
                          "name": "Bill Maher"
                          },
                          {
                          "name": "Larry David"
                          },
                          {
                          "name": "Robert Klein"
                          },
                          {
                          "name": "Todd Barry"
                          },
                          {
                          "name": "Bob Einstein"
                          }
                          ],
               "images": {
               "poster": "http://assets.comediansincarsgettingcoffee.com/single-shots/sss3e21_poster.jpg",
               "thumb": "http://assets.comediansincarsgettingcoffee.com/single-shots/sss3e21_thumb.jpg"
               },
               "mediaUrl": "http://content.uplynk.com/ext/e8773f7770a44dbd886eee4fca16a66b/2495895.m3u8",
               "urlSlug": "potty-mouth",
               "slug": "potty-mouth",
               "pubDateTime": "2015-12-03T04:30:00.000Z",
               "videoUrl": "http://content-aeui2.uplynk.com/cbf7b9ebc0864299bd06475e0062df4e/g.m3u8"
               },
               {
               "mediaId": 2495896,
               "type": "singleshot",
               "season": "03",
               "episode": "00022",
               "launchDate": "12/9/2015",
               "pubDate": "2015-12-10T04:30:00.000Z",
               "duration": "02:19",
               "durationSeconds": "139",
               "title": "Single Shot: Clothes Lines",
               "description": "Get a new take on style with Jerry Seinfeld and his special guests on today's episode of Single Shot!",
               "guests": [
                          {
                          "name": "Jerry Seinfeld"
                          },
                          {
                          "name": "Fred Armisen"
                          },
                          {
                          "name": "Jay Leno"
                          },
                          {
                          "name": "George Wallace"
                          },
                          {
                          "name": "Steve Harvey"
                          },
                          {
                          "name": "Tina Fey"
                          },
                          {
                          "name": "Ali Wentworth"
                          },
                          {
                          "name": "Larry David"
                          },
                          {
                          "name": "Jim Carrey"
                          }
                          ],
               "images": {
               "poster": "http://assets.comediansincarsgettingcoffee.com/single-shots/sss3e22_poster.jpg",
               "thumb": "http://assets.comediansincarsgettingcoffee.com/single-shots/sss3e22_thumb.jpg"
               },
               "mediaUrl": "http://content.uplynk.com/ext/e8773f7770a44dbd886eee4fca16a66b/2495896.m3u8",
               "urlSlug": "clothes-lines",
               "slug": "clothes-lines",
               "pubDateTime": "2015-12-10T04:30:00.000Z",
               "videoUrl": "http://content-aeui1.uplynk.com/dffba10385ec4e0bb4becbbbc52a1cb9/g.m3u8"
               },
               {
               "mediaId": 2495897,
               "type": "singleshot",
               "season": "03",
               "episode": "00023",
               "launchDate": "12/16/2015",
               "pubDate": "2015-12-17T04:30:00.000Z",
               "duration": "02:06",
               "durationSeconds": "126",
               "title": "Single Shot: Jay And Dave On Pryor",
               "description": "Jerry and his special guests Jay Leno, Seth Meyers and David Letterman reminisce about their experiences with comedic legend Richard Pryor, in this episode of Comedians In Cars Getting Coffee: Single Shot.",
               "guests": [
                          {
                          "name": "Jerry Seinfeld"
                          },
                          {
                          "name": "Seth Meyers"
                          },
                          {
                          "name": "Jay Leno"
                          },
                          {
                          "name": "David Letterman"
                          }
                          ],
               "images": {
               "poster": "http://assets.comediansincarsgettingcoffee.com/single-shots/sss3e23_poster.jpg",
               "thumb": "http://assets.comediansincarsgettingcoffee.com/single-shots/sss3e23_thumb.jpg"
               },
               "mediaUrl": "http://content.uplynk.com/ext/e8773f7770a44dbd886eee4fca16a66b/2495897.m3u8",
               "urlSlug": "jay-and-dave-on-pryor",
               "slug": "jay-and-dave-on-pryor",
               "pubDateTime": "2015-12-17T04:30:00.000Z",
               "videoUrl": "http://content-aeui2.uplynk.com/fca2f5d999df449f89702baba17b4d2b/g.m3u8"
               },
               {
               "mediaId": 2495898,
               "type": "singleshot",
               "season": "03",
               "episode": "00024",
               "launchDate": "12/23/2015",
               "pubDate": "2015-12-24T04:30:00.000Z",
               "duration": "01:57",
               "durationSeconds": "117",
               "title": "Single Shot: No Offense",
               "description": "Watch Jerry Seinfeld and his special guests throw caution to the wind, saying just what they feel in this exciting episode of Single Shot.",
               "guests": [
                          {
                          "name": "Jerry Seinfeld"
                          },
                          {
                          "name": "Bill Burr"
                          },
                          {
                          "name": "Alec Baldwin"
                          },
                          {
                          "name": "Steve Harvey"
                          },
                          {
                          "name": "Robert Klein"
                          },
                          {
                          "name": "Julia Louis-Dreyfus"
                          }
                          ],
               "images": {
               "poster": "http://assets.comediansincarsgettingcoffee.com/single-shots/sss3e24_poster.jpg",
               "thumb": "http://assets.comediansincarsgettingcoffee.com/single-shots/sss3e24_thumb.jpg"
               },
               "mediaUrl": "http://content.uplynk.com/ext/e8773f7770a44dbd886eee4fca16a66b/2495898.m3u8",
               "urlSlug": "no-offense",
               "slug": "no-offense",
               "pubDateTime": "2015-12-24T04:30:00.000Z",
               "videoUrl": "http://content-aeui2.uplynk.com/a98feec6ca934febb318faa53daac02b/g.m3u8"
               },
               {
               "mediaId": 2491305,
               "type": "episode",
               "season": "03",
               "episode": "0003",
               "launchDate": "1/16/2014",
               "pubDate": "2014-01-16T16:00:00.000Z",
               "duration": "20:52",
               "durationSeconds": "1252",
               "title": "Comedy Is a Concealed Weapon",
               "description": "Jerry's special guest is Jay Leno in this episode of Comedians In Cars Getting Coffee.",
               "guests": [
                          {
                          "name": "Jay Leno"
                          }
                          ],
               "images": {
               "poster": "http://ccc.crackle.com/images/s3e3_episode_poster.jpg",
               "thumb": "http://ccc.crackle.com/images/s3e3_episode_thumb.jpg"
               },
               "mediaUrl": "http://content.uplynk.com/ext/e8773f7770a44dbd886eee4fca16a66b/2491305.m3u8?ad=crackle_live",
               "urlSlug": "jay-leno-comedy-is-a-concealed-weapon",
               "pubDateTime": 1389888000,
               "slug": "jay-leno-comedy-is-a-concealed-weapon",
               "videoUrl": "http://content-ause2.uplynk.com/7c95b32c04ad493d8c504b1e89809c67/g.m3u8?ad=crackle_live&pbs=886306e398464fd5a6fddf435d2b8e97"
               },
               {
               "mediaId": 2491300,
               "type": "episode-trailer",
               "season": "03",
               "episode": "0003",
               "launchDate": "01/13/2014",
               "pubDate": "2014-01-13T16:15:00.000Z",
               "duration": "01:03",
               "durationSeconds": "63",
               "title": "Episode Trailer",
               "description": "Jerry's special guest is Jay Leno in this episode of Comedians In Cars Getting Coffee.",
               "guests": [
                          {
                          "name": "Jay Leno"
                          }
                          ],
               "images": {
               "poster": "http://ccc.crackle.com/images/s3e3_poster.jpg",
               "thumb": "http://ccc.crackle.com/images/s3e3_thumb.jpg"
               },
               "mediaUrl": "http://content.uplynk.com/ext/e8773f7770a44dbd886eee4fca16a66b/2491300.m3u8",
               "urlSlug": "jay-leno-comedy-is-a-concealed-weapon",
               "pubDateTime": 1389629700,
               "slug": "jay-leno-episode-trailer",
               "videoUrl": "http://content-ause2.uplynk.com/7807cdae5f6d49868a109ff0f2f5d1cc/g.m3u8"
               },
               {
               "mediaId": 2495691,
               "type": "singleshot",
               "season": "03",
               "episode": "0003",
               "launchDate": "07/29/2015",
               "pubDate": "2015-07-30T03:30:00.000Z",
               "duration": "01:26",
               "durationSeconds": "86",
               "title": "Single Shot: Really?",
               "description": "Jerry's special guests in this Single Shot include Aziz Ansari, Ali Wentworth, Kevin Hart and Sarah Silverman.",
               "guests": [
                          {
                          "name": "Aziz Ansari"
                          },
                          {
                          "name": "Fred Armisen"
                          },
                          {
                          "name": "Todd Barry"
                          },
                          {
                          "name": "Stephen Colbert"
                          },
                          {
                          "name": "Larry David"
                          },
                          {
                          "name": "Bob Einstein"
                          },
                          {
                          "name": "Jimmy Fallon"
                          },
                          {
                          "name": "Kevin Hart"
                          },
                          {
                          "name": "Steve Harvey"
                          },
                          {
                          "name": "Julia Louis-Dreyfus"
                          },
                          {
                          "name": "Bill Maher"
                          },
                          {
                          "name": "Don Rickles"
                          },
                          {
                          "name": "Sarah Silverman"
                          },
                          {
                          "name": "Ali Wentworth"
                          }
                          ],
               "images": {
               "poster": "http://assets.comediansincarsgettingcoffee.com/single-shots/sss3e3_poster.jpg",
               "thumb": "http://assets.comediansincarsgettingcoffee.com/single-shots/sss3e3_thumb.jpg"
               },
               "mediaUrl": "http://content.uplynk.com/ext/e8773f7770a44dbd886eee4fca16a66b/2495691.m3u8",
               "urlSlug": "really",
               "slug": "really",
               "pubDateTime": "2015-07-30T03:30:00.000Z",
               "videoUrl": "http://content-aeui1.uplynk.com/cf73f1071d494106a672a08769f8a479/g.m3u8"
               },
               {
               "mediaId": 2491306,
               "type": "episode-trailer",
               "season": "03",
               "episode": "0004",
               "launchDate": "01/20/2014",
               "pubDate": "2014-01-20T17:00:00.000Z",
               "duration": "00:53",
               "durationSeconds": "53",
               "title": "Episode Trailer",
               "description": "Jerry's special guest is Todd Barry in this episode of Comedians In Cars Getting Coffee.",
               "guests": [
                          {
                          "name": "Todd Barry"
                          }
                          ],
               "images": {
               "poster": "http://ccc.crackle.com/images/s3e4_poster.jpg",
               "thumb": "http://ccc.crackle.com/images/s3e4_thumb.jpg"
               },
               "mediaUrl": "http://content.uplynk.com/ext/e8773f7770a44dbd886eee4fca16a66b/2491306.m3u8",
               "urlSlug": "todd-barry-so-you-re-mellow-and-tense",
               "pubDateTime": 1390237200,
               "slug": "todd-barry-episode-trailer",
               "videoUrl": "http://content-ause4.uplynk.com/cde55074921a4b698d398d9821a2042b/g.m3u8"
               },
               {
               "mediaId": 2491304,
               "type": "episode",
               "season": "03",
               "episode": "0004",
               "launchDate": "1/22/2014",
               "pubDate": "2014-01-22T16:00:00.000Z",
               "duration": "14:49",
               "durationSeconds": "889",
               "title": "So You're Mellow and Tense?",
               "description": "Jerry's special guest is Todd Barry in this episode of Comedians In Cars Getting Coffee.",
               "guests": [
                          {
                          "name": "Todd Barry"
                          }
                          ],
               "images": {
               "poster": "http://ccc.crackle.com/images/s3e4_episode_poster.jpg",
               "thumb": "http://ccc.crackle.com/images/s3e4_episode_thumb.jpg"
               },
               "mediaUrl": "http://content.uplynk.com/ext/e8773f7770a44dbd886eee4fca16a66b/2491304.m3u8?ad=crackle_live",
               "urlSlug": "todd-barry-so-you-re-mellow-and-tense",
               "pubDateTime": 1390406400,
               "slug": "todd-barry-so-youre-mellow-and-tense",
               "videoUrl": "http://content-ause1.uplynk.com/153da3e7bd434f2ba3567e8349be8dc3/g.m3u8?ad=crackle_live&pbs=e02c796abfe5441695085d3294e31d6c"
               },
               {
               "mediaId": 2495735,
               "type": "singleshot",
               "season": "03",
               "episode": "0004",
               "launchDate": "08/05/2015",
               "pubDate": "2015-08-06T03:30:00.000Z",
               "duration": "01:50",
               "durationSeconds": "110",
               "title": "Single Shot: Gotta Be the Shoes",
               "description": "Jerry's special guests in this Single Shot include Colleen Ballinger, Jim Carrey, Louis C.K., Jimmy Fallon, to name just a few.",
               "guests": [
                          {
                          "name": "Jerry Seinfeld"
                          },
                          {
                          "name": "Colleen Ballinger"
                          },
                          {
                          "name": "Jim Carrey"
                          },
                          {
                          "name": "Louis C.K."
                          },
                          {
                          "name": "Bob Einstein"
                          },
                          {
                          "name": "Jimmy Fallon"
                          },
                          {
                          "name": "Tina Fey"
                          },
                          {
                          "name": "Kevin Hart"
                          },
                          {
                          "name": "Steve Harvey"
                          },
                          {
                          "name": "Bill Maher"
                          },
                          {
                          "name": "Trevor Noah"
                          },
                          {
                          "name": "Sarah Jessica Parker"
                          }
                          ],
               "images": {
               "poster": "http://assets.comediansincarsgettingcoffee.com/single-shots/sss3e4_poster.jpg",
               "thumb": "http://assets.comediansincarsgettingcoffee.com/single-shots/sss3e4_thumb.jpg"
               },
               "mediaUrl": "http://content.uplynk.com/ext/e8773f7770a44dbd886eee4fca16a66b/2495735.m3u8",
               "urlSlug": "gotta-be-the-shoes",
               "slug": "gotta-be-the-shoes",
               "pubDateTime": "2015-08-06T03:30:00.000Z",
               "videoUrl": "http://content-aeui1.uplynk.com/98cfd98fd54b4788a8c8aad2efb82fa3/g.m3u8"
               },
               {
               "mediaId": 2491375,
               "type": "episode",
               "season": "03",
               "episode": "0005",
               "launchDate": "1/30/2014",
               "pubDate": "2014-01-30T16:00:00.000Z",
               "duration": "16:05",
               "durationSeconds": "965",
               "title": "Feces Are My Purview",
               "description": "Jerry's special guest is Tina Fey in this episode of Comedians In Cars Getting Coffee.",
               "guests": [
                          {
                          "name": "Tina Fey"
                          }
                          ],
               "images": {
               "poster": "http://ccc.crackle.com/images/s3e5_episode_poster.jpg",
               "thumb": "http://ccc.crackle.com/images/s3e5_episode_thumb.jpg"
               },
               "mediaUrl": "http://content.uplynk.com/ext/e8773f7770a44dbd886eee4fca16a66b/2491375.m3u8?ad=crackle_live",
               "urlSlug": "tina-fey-feces-are-my-purview",
               "pubDateTime": 1391097600,
               "slug": "tina-fey-feces-are-my-purview",
               "videoUrl": "http://content-ause4.uplynk.com/9436f051cea740c49477e2e111435282/g.m3u8?ad=crackle_live&pbs=c374c1bc9ff14ae88710e5865b79f1f9"
               },
               {
               "mediaId": 2491376,
               "type": "episode-trailer",
               "season": "03",
               "episode": "0005",
               "launchDate": "01/28/2014",
               "pubDate": "2014-01-28T17:00:00.000Z",
               "duration": "01:02",
               "durationSeconds": "62",
               "title": "Episode Trailer",
               "description": "Jerry's special guest is Tina Fey in this episode of Comedians In Cars Getting Coffee.",
               "guests": [
                          {
                          "name": "Tina Fey"
                          }
                          ],
               "images": {
               "poster": "http://ccc.crackle.com/images/s3e5_poster.jpg",
               "thumb": "http://ccc.crackle.com/images/s3e5_thumb.jpg"
               },
               "mediaUrl": "http://content.uplynk.com/ext/e8773f7770a44dbd886eee4fca16a66b/2491376.m3u8",
               "urlSlug": "tina-fey-feces-are-my-purview",
               "pubDateTime": 1390928400,
               "slug": "tina-fey-episode-trailer",
               "videoUrl": "http://content-ause4.uplynk.com/3b9b0c72c803438697ec87fab008cd03/g.m3u8"
               },
               {
               "mediaId": 2495736,
               "type": "singleshot",
               "season": "03",
               "episode": "0005",
               "launchDate": "08/012/2015",
               "pubDate": "2015-08-13T03:30:00.000Z",
               "duration": "01:42",
               "durationSeconds": "102",
               "title": "Single Shot: Speaking Briefly",
               "description": "Jerry and his very special guests including Larry David, Carl Reiner, Trevor Noah and Bill Maher share their unique perspectives on undergarments.",
               "guests": [
                          {
                          "name": "Jerry Seinfeld"
                          },
                          {
                          "name": "Larry David"
                          },
                          {
                          "name": "Carl Reiner"
                          },
                          {
                          "name": "Trevor Noah"
                          },
                          {
                          "name": "Bill Maher"
                          }
                          ],
               "images": {
               "poster": "http://assets.comediansincarsgettingcoffee.com/single-shots/sss3e5_poster.jpg",
               "thumb": "http://assets.comediansincarsgettingcoffee.com/single-shots/sss3e5_thumb.jpg"
               },
               "mediaUrl": "http://content.uplynk.com/ext/e8773f7770a44dbd886eee4fca16a66b/2495736.m3u8",
               "urlSlug": "speaking-briefly",
               "slug": "speaking-briefly",
               "pubDateTime": "2015-08-13T03:30:00.000Z",
               "videoUrl": "http://content-aeui2.uplynk.com/16eeb2bad4ad4635ade0d64d66d12916/g.m3u8"
               },
               {
               "mediaId": 2491414,
               "type": "episode",
               "season": "03",
               "episode": "0006",
               "launchDate": "2/02/2014",
               "pubDate": "2014-02-02T23:30:00.000Z",
               "duration": "06:19",
               "durationSeconds": "379",
               "title": "The Over-Cheer",
               "description": "Jerry's special guest is George Costanza in this episode of Comedians In Cars Getting Coffee.",
               "guests": [
                          {
                          "name": "George Costanza"
                          }
                          ],
               "images": {
               "poster": "http://ccc.crackle.com/images/s3sb_poster.jpg",
               "thumb": "http://ccc.crackle.com/images/s3sb_thumb.jpg"
               },
               "mediaUrl": "http://content.uplynk.com/ext/e8773f7770a44dbd886eee4fca16a66b/2491414.m3u8?ad=crackle_live",
               "urlSlug": "george-costanza-the-over-cheer",
               "pubDateTime": 1391383800,
               "slug": "george-costanza-the-over-cheer",
               "videoUrl": "http://content-ause4.uplynk.com/e7554ef52ecd4dbfbd518fcadec9cea4/g.m3u8?ad=crackle_live&pbs=a9795dc909b34c5c97474036f53a01ad"
               },
               {
               "mediaId": 2495737,
               "type": "singleshot",
               "season": "03",
               "episode": "0006",
               "launchDate": "08/19/2015",
               "pubDate": "2015-08-20T03:30:00.000Z",
               "duration": "01:50",
               "durationSeconds": "110",
               "title": "Single Shot: Having A Breakdown",
               "description": "Jerry and his special guests flash their comedic wit while dealing with mechanical malfunctions.",
               "guests": [
                          {
                          "name": "Jerry Seinfeld"
                          },
                          {
                          "name": "Gad Elmaleh"
                          },
                          {
                          "name": "Brian Regan"
                          },
                          {
                          "name": "Patton Oswalt"
                          },
                          {
                          "name": "Amy Schumer"
                          },
                          {
                          "name": "Jimmy Fallon"
                          }
                          ],
               "images": {
               "poster": "http://assets.comediansincarsgettingcoffee.com/single-shots/sss3e6_poster.jpg",
               "thumb": "http://assets.comediansincarsgettingcoffee.com/single-shots/sss3e6_thumb.jpg"
               },
               "mediaUrl": "http://content.uplynk.com/ext/e8773f7770a44dbd886eee4fca16a66b/2495737.m3u8",
               "urlSlug": "having-a-breakdown",
               "slug": "having-a-breakdown",
               "pubDateTime": "2015-08-20T03:30:00.000Z",
               "videoUrl": "http://content-aeui1.uplynk.com/87b2a0e0f5cf4f4bb7f576c247ff9ed3/g.m3u8"
               },
               {
               "mediaId": 2491432,
               "type": "episode",
               "season": "03",
               "episode": "0007",
               "launchDate": "2/06/2014",
               "pubDate": "2014-02-06T16:00:00.000Z",
               "duration": "13:21",
               "durationSeconds": "801",
               "title": "The Last Days of Howard Stern",
               "description": "Jerry's special guest is Howard Stern in this episode of Comedians In Cars Getting Coffee.",
               "guests": [
                          {
                          "name": "Howard Stern"
                          }
                          ],
               "images": {
               "poster": "http://ccc.crackle.com/images/s3e6_episode_poster.jpg",
               "thumb": "http://ccc.crackle.com/images/s3e6_episode_thumb.jpg"
               },
               "mediaUrl": "http://content.uplynk.com/ext/e8773f7770a44dbd886eee4fca16a66b/2491432.m3u8?ad=crackle_live",
               "urlSlug": "howard-stern-the-last-days-of-howard-stern",
               "pubDateTime": 1391702400,
               "slug": "howard-stern-the-last-days-of-howard-stern",
               "videoUrl": "http://content-ause1.uplynk.com/2019d2f93bb7450a9f7bf15b44280dad/g.m3u8?ad=crackle_live&pbs=bb67e97de08f41cd851d2b8120112b63"
               },
               {
               "mediaId": 2491398,
               "type": "episode-trailer",
               "season": "03",
               "episode": "0007",
               "launchDate": "02/02/2014",
               "pubDate": "2014-02-02T23:31:00.000Z",
               "duration": "01:00",
               "durationSeconds": "60",
               "title": "Episode Trailer",
               "description": "Jerry's special guest is Howard Stern in this episode of Comedians In Cars Getting Coffee.",
               "guests": [
                          {
                          "name": "Howard Stern"
                          }
                          ],
               "images": {
               "poster": "http://ccc.crackle.com/images/s3e6_poster.jpg",
               "thumb": "http://ccc.crackle.com/images/s3e6_thumb.jpg"
               },
               "mediaUrl": "http://content.uplynk.com/ext/e8773f7770a44dbd886eee4fca16a66b/2491398.m3u8",
               "urlSlug": "howard-stern-the-last-days-of-howard-stern",
               "pubDateTime": 1391383860,
               "slug": "howard-stern-episode-trailer",
               "videoUrl": "http://content-ause2.uplynk.com/6455809a325d4af8b5704bfb91957b24/g.m3u8"
               },
               {
               "mediaId": 2495738,
               "type": "singleshot",
               "season": "03",
               "episode": "0007",
               "launchDate": "08/26/2015",
               "pubDate": "2015-08-27T03:30:00.000Z",
               "duration": "01:45",
               "durationSeconds": "105",
               "title": "Single Shot: Quick Impression",
               "description": "Jerry and his guests including Jim Carrey, Robert Klein, Alec Baldwin, David Letterman, Jimmy Fallon, Aziz Ansari, Bill Maher and Sarah Silverman entertain each other with anecdotal impressions.",
               "guests": [
                          {
                          "name": "Jerry Seinfeld"
                          },
                          {
                          "name": "Jim Carrey"
                          },
                          {
                          "name": "Robert Klein"
                          },
                          {
                          "name": "David Letterman"
                          },
                          {
                          "name": "Aziz Ansari"
                          },
                          {
                          "name": "Jimmy Fallon"
                          },
                          {
                          "name": "Sarah Silverman"
                          }
                          ],
               "images": {
               "poster": "http://assets.comediansincarsgettingcoffee.com/single-shots/sss3e7_poster.jpg",
               "thumb": "http://assets.comediansincarsgettingcoffee.com/single-shots/sss3e7_thumb.jpg"
               },
               "mediaUrl": "http://content.uplynk.com/ext/e8773f7770a44dbd886eee4fca16a66b/2495738.m3u8",
               "urlSlug": "quick-impression",
               "slug": "quick-impression",
               "pubDateTime": "2015-08-27T03:30:00.000Z",
               "videoUrl": "http://content-aeui1.uplynk.com/0a3d9bca3c7b4521820c503d29d158f6/g.m3u8"
               },
               {
               "mediaId": 2495739,
               "type": "singleshot",
               "season": "03",
               "episode": "0008",
               "launchDate": "9/2/2015",
               "pubDate": "2015-09-03T03:30:00.000Z",
               "duration": "02:07",
               "durationSeconds": "127",
               "title": "Single Shot: Golf For Dummies",
               "description": "Jerry and his special guests tee off about their good, bad and ugly golf experiences.",
               "guests": [
                          {
                          "name": "Jerry Seinfeld"
                          },
                          {
                          "name": "Steve Harvey"
                          },
                          {
                          "name": "George Wallace"
                          },
                          {
                          "name": "Bob Einstein"
                          },
                          {
                          "name": "Jimmy Fallon"
                          },
                          {
                          "name": "Ali Wentworth"
                          },
                          {
                          "name": "Bill Burr"
                          },
                          {
                          "name": "Louis C.K."
                          }
                          ],
               "images": {
               "poster": "http://assets.comediansincarsgettingcoffee.com/single-shots/sss3e8_poster.jpg",
               "thumb": "http://assets.comediansincarsgettingcoffee.com/single-shots/sss3e8_thumb.jpg"
               },
               "mediaUrl": "http://content.uplynk.com/ext/e8773f7770a44dbd886eee4fca16a66b/2495739.m3u8",
               "urlSlug": "golf-for-dummies",
               "slug": "golf-for-dummies",
               "pubDateTime": "2015-09-03T03:30:00.000Z",
               "videoUrl": "http://content-aeui2.uplynk.com/57952ce758354d918c7e85b6c0cb524d/g.m3u8"
               },
               {
               "mediaId": 2495740,
               "type": "singleshot",
               "season": "03",
               "episode": "0009",
               "launchDate": "9/9/2015",
               "pubDate": "2015-09-10T03:30:00.000Z",
               "duration": "01:28",
               "durationSeconds": "88",
               "title": "Single Shot: A Car Is Born",
               "description": "Jerry and his special guests share the synonymous year of their birthdays with the year the car was built in this episode of Single Shot.",
               "guests": [
                          {
                          "name": "Jerry Seinfeld"
                          },
                          {
                          "name": "Steve Harvey"
                          },
                          {
                          "name": "Stephen Colbert"
                          },
                          {
                          "name": "Trevor Noah"
                          },
                          {
                          "name": "Seth Meyers"
                          }
                          ],
               "images": {
               "poster": "http://assets.comediansincarsgettingcoffee.com/single-shots/sss3e9_poster.jpg",
               "thumb": "http://assets.comediansincarsgettingcoffee.com/single-shots/sss3e9_thumb.jpg"
               },
               "mediaUrl": "http://content.uplynk.com/ext/e8773f7770a44dbd886eee4fca16a66b/2495740.m3u8",
               "urlSlug": "a-car-is-born",
               "slug": "a-car-is-born",
               "pubDateTime": "2015-09-10T03:30:00.000Z",
               "videoUrl": "http://content-aeui2.uplynk.com/58ad394366fd40b181094d6bfc580162/g.m3u8"
               },
               {
               "mediaId": 2495741,
               "type": "singleshot",
               "season": "03",
               "episode": "0010",
               "launchDate": "9/16/2015",
               "pubDate": "2015-09-17T03:30:00.000Z",
               "duration": "02:43",
               "durationSeconds": "163",
               "title": "Single Shot: Dave",
               "description": "Jerry and his special guests discuss their admiration for David Letterman in this episode of Single Shot.",
               "guests": [
                          {
                          "name": "Jerry Seinfeld"
                          },
                          {
                          "name": "Chris Rock"
                          },
                          {
                          "name": "Louis C.K."
                          },
                          {
                          "name": "Jim Carrey"
                          },
                          {
                          "name": "Carl Reiner"
                          }
                          ],
               "images": {
               "poster": "http://assets.comediansincarsgettingcoffee.com/single-shots/sss3e10_poster.jpg",
               "thumb": "http://assets.comediansincarsgettingcoffee.com/single-shots/sss3e10_thumb.jpg"
               },
               "mediaUrl": "http://content.uplynk.com/ext/e8773f7770a44dbd886eee4fca16a66b/2495741.m3u8",
               "urlSlug": "dave",
               "slug": "dave",
               "pubDateTime": "2015-09-17T03:30:00.000Z",
               "videoUrl": "http://content-aeui1.uplynk.com/0b28090ec42b4dc4843dec902043f95c/g.m3u8"
               },
               {
               "mediaId": 2495742,
               "type": "singleshot",
               "season": "03",
               "episode": "0011",
               "launchDate": "9/23/2015",
               "pubDate": "2015-09-24T03:30:00.000Z",
               "duration": "02:16",
               "durationSeconds": "136",
               "title": "Single Shot: Synchronicity",
               "description": "Great minds think alike in this episode of Single Shot starring Jerry Seinfeld and his special guests.",
               "guests": [
                          {
                          "name": "Jerry Seinfeld"
                          },
                          {
                          "name": "Julia Louis-Dreyfus"
                          },
                          {
                          "name": "Louis C.K."
                          },
                          {
                          "name": "George Wallace"
                          },
                          {
                          "name": "Tina Fey"
                          },
                          {
                          "name": "Steve Harvey"
                          },
                          {
                          "name": "Jimmy Fallon"
                          }
                          ],
               "images": {
               "poster": "http://assets.comediansincarsgettingcoffee.com/single-shots/sss3e11_poster.jpg",
               "thumb": "http://assets.comediansincarsgettingcoffee.com/single-shots/sss3e11_thumb.jpg"
               },
               "mediaUrl": "http://content.uplynk.com/ext/e8773f7770a44dbd886eee4fca16a66b/2495742.m3u8",
               "urlSlug": "synchronicity",
               "slug": "synchronicity",
               "pubDateTime": "2015-09-24T03:30:00.000Z",
               "videoUrl": "http://content-aeui1.uplynk.com/dd2a23d4aab847ba86ea7d24fbe14344/g.m3u8"
               },
               {
               "mediaId": 2495743,
               "type": "singleshot",
               "season": "03",
               "episode": "0012",
               "launchDate": "9/30/2015",
               "pubDate": "2015-10-01T03:30:00.000Z",
               "duration": "02:18",
               "durationSeconds": "138",
               "title": "Single Shot: Inside Baseball",
               "description": "Jerry Seinfeld and his special guests add their views on the dynamics of comedic writing on this episode of Single Shot.",
               "guests": [
                          {
                          "name": "Jerry Seinfeld"
                          },
                          {
                          "name": "Jay Leno"
                          },
                          {
                          "name": "Louis C.K."
                          },
                          {
                          "name": "Sarah Silverman"
                          },
                          {
                          "name": "Stephen Colbert"
                          },
                          {
                          "name": "Jimmy Fallon"
                          }
                          ],
               "images": {
               "poster": "http://assets.comediansincarsgettingcoffee.com/single-shots/sss3e12_poster.jpg",
               "thumb": "http://assets.comediansincarsgettingcoffee.com/single-shots/sss3e12_thumb.jpg"
               },
               "mediaUrl": "http://content.uplynk.com/ext/e8773f7770a44dbd886eee4fca16a66b/2495743.m3u8",
               "urlSlug": "inside-baseball",
               "slug": "inside-baseball",
               "pubDateTime": "2015-10-01T03:30:00.000Z",
               "videoUrl": "http://content-aeui1.uplynk.com/298656334c0e4137a588cb2e2d97439c/g.m3u8"
               },
               {
               "mediaId": 2495744,
               "type": "singleshot",
               "season": "03",
               "episode": "0013",
               "launchDate": "10/07/2015",
               "pubDate": "2015-10-08T03:30:00.000Z",
               "duration": "01:40",
               "durationSeconds": "100",
               "title": "Single Shot: Vegas Baby",
               "description": "Jerry's special guests in this Single Shot include George Wallace, Jon Stewart, Miranda Sings, Sarah Silverman and Don Rickles just to name a few.",
               "guests": [
                          {
                          "name": "Jerry Seinfeld"
                          },
                          {
                          "name": "Jay Leno"
                          },
                          {
                          "name": "Louis C.K."
                          },
                          {
                          "name": "Sarah Silverman"
                          },
                          {
                          "name": "Stephen Colbert"
                          },
                          {
                          "name": "Jimmy Fallon"
                          }
                          ],
               "images": {
               "poster": "http://assets.comediansincarsgettingcoffee.com/single-shots/sss3e13_poster.jpg",
               "thumb": "http://assets.comediansincarsgettingcoffee.com/single-shots/sss3e13_thumb.jpg"
               },
               "mediaUrl": "http://content.uplynk.com/ext/e8773f7770a44dbd886eee4fca16a66b/2495744.m3u8",
               "urlSlug": "vegas-baby",
               "slug": "vegas-baby",
               "pubDateTime": "2015-10-08T03:30:00.000Z",
               "videoUrl": "http://content-aeui2.uplynk.com/836034a277904fbb8d638133db8264de/g.m3u8"
               },
               {
               "mediaId": 2492975,
               "type": "season-trailer",
               "season": "04",
               "episode": "0000",
               "launchDate": "6/09/2014",
               "pubDate": "2014-06-09T16:00:00.000Z",
               "duration": "01:40",
               "durationSeconds": "100",
               "title": "George Wallace, Aziz Ansari, Sarah Jessica Parker, Robert Klein and Jon Stewart",
               "description": "Jerry Seinfeld is joined by friends for a drive in a classic car and having coffee, sharing stories all along the way.",
               "guests": [
                          {
                          "name": "Season 4 - Premieres June 19, Noon ET / 9AM PT"
                          }
                          ],
               "images": {
               "poster": "http://ccc.crackle.com/images/s4_trailer_poster.jpg",
               "thumb": "http://ccc.crackle.com/images/s4_trailer_thumb.jpg"
               },
               "mediaUrl": "http://content.uplynk.com/ext/e8773f7770a44dbd886eee4fca16a66b/2492975.m3u8",
               "urlSlug": "season-4-premieres-june-19-noon-et-9am-pt",
               "pubDateTime": 1402329600,
               "slug": "season-4-premieres-june-19-noon-et-9am-pt-season-trailer",
               "videoUrl": "http://content-ause1.uplynk.com/ad82f86b2a274378a968b44efdb26081/g.m3u8"
               },
               {
               "mediaId": 2492927,
               "type": "season-trailer",
               "season": "04",
               "episode": "0000",
               "launchDate": "5/22/2014",
               "pubDate": "2014-05-22T16:00:00.000Z",
               "duration": "00:35",
               "durationSeconds": "35",
               "title": "George Wallace, Aziz Ansari, Sarah Jessica Parker, Robert Klein and Jon Stewart",
               "description": "Jerry Seinfeld is joined by friends for a drive in a classic car and having coffee, sharing stories all along the way.",
               "guests": [
                          {
                          "name": "Season 4 - Premiering June 19, Noon ET / 9AM PT"
                          }
                          ],
               "images": {
               "poster": "http://ccc.crackle.com/images/s4_promo_all.jpg",
               "thumb": "http://ccc.crackle.com/images/s4_promo.jpg"
               },
               "mediaUrl": "http://content.uplynk.com/ext/e8773f7770a44dbd886eee4fca16a66b/2492927.m3u8",
               "urlSlug": "season-4-premiering-june-19-noon-et-9am-pt",
               "pubDateTime": 1400774400,
               "slug": "season-4-premiering-june-19-noon-et-9am-pt-season-trailer",
               "videoUrl": "http://content-ause1.uplynk.com/8f551bca558e41828e51ebafaee68bdf/g.m3u8"
               },
               {
               "mediaId": 2495899,
               "type": "singleshot",
               "season": "04",
               "episode": "00001",
               "launchDate": "02/10/2016",
               "pubDate": "2016-02-11T04:25:00.000Z",
               "duration": "02:24",
               "durationSeconds": "144",
               "title": "Single Shot: A Little Advice",
               "description": "Take my advice, you won't want to miss Jerry Seinfeld and his special guests in this episode of Comedians In Cars Getting Coffee: Single Shot!",
               "guests": [
                          {
                          "name": "Jerry Seinfeld"
                          },
                          {
                          "name": "Miranda Sings"
                          },
                          {
                          "name": "Sarah Silverman"
                          },
                          {
                          "name": "Larry David"
                          },
                          {
                          "name": "George Wallace"
                          },
                          {
                          "name": " Bill Burr"
                          },
                          {
                          "name": "Bob Einstein"
                          },
                          {
                          "name": " Fred Armisen"
                          },
                          {
                          "name": " Chris Rock"
                          }
                          ],
               "images": {
               "poster": "http://assets.comediansincarsgettingcoffee.com/single-shots/sss3e25_poster.jpg",
               "thumb": "http://assets.comediansincarsgettingcoffee.com/single-shots/sss3e25_thumb.jpg"
               },
               "mediaUrl": "http://content.uplynk.com/ext/e8773f7770a44dbd886eee4fca16a66b/2495899.m3u8",
               "urlSlug": "a-little-advice",
               "slug": "a-little-advice",
               "pubDateTime": "2016-02-11T04:25:00.000Z",
               "videoUrl": "http://content-aeuf1.uplynk.com/40f13a3a4aa843449f004bb793a57a9f/g.m3u8"
               },
               {
               "mediaId": 2497977,
               "type": "singleshot",
               "season": "04",
               "episode": "00002",
               "launchDate": "02/17/2016",
               "pubDate": "2016-02-18T04:25:00.000Z",
               "duration": "1:12",
               "durationSeconds": "72",
               "title": "Single Shot: This Is Great",
               "description": "Jerry Seinfeld and his special guests enjoy the finer things in life. Great Cars, Great Coffee and Great Company.",
               "guests": [
                          {
                          "name": "Jerry Seinfeld"
                          },
                          {
                          "name": "Patton Oswald"
                          },
                          {
                          "name": "Michael Richards"
                          },
                          {
                          "name": "Jim Carrey"
                          },
                          {
                          "name": "Louis C.K."
                          },
                          {
                          "name": "Trevor Noah"
                          },
                          {
                          "name": "Todd Barry"
                          },
                          {
                          "name": "Steve Harvey"
                          },
                          {
                          "name": "Steve Martin"
                          },
                          {
                          "name": "Stephen Colbert"
                          },
                          {
                          "name": "Jimmy Fallon"
                          },
                          {
                          "name": "Kevin Hart"
                          },
                          {
                          "name": "Howard Stern"
                          }
                          ],
               "images": {
               "poster": "http://assets.comediansincarsgettingcoffee.com/single-shots/sss4e2_poster.jpg",
               "thumb": "http://assets.comediansincarsgettingcoffee.com/single-shots/sss4e2_thumb.jpg"
               },
               "mediaUrl": "http://content.uplynk.com/ext/e8773f7770a44dbd886eee4fca16a66b/2497977.m3u8",
               "urlSlug": "this-is-great",
               "slug": "this-is-great",
               "pubDateTime": "2016-02-18T04:25:00.000Z",
               "videoUrl": "http://content-aeui2.uplynk.com/5c49d9a8fcd642578a667d6c7f31c923/g.m3u8"
               },
               {
               "mediaId": 2493024,
               "type": "episode",
               "season": "04",
               "episode": "0001",
               "launchDate": "6/19/2014",
               "pubDate": "2014-06-19T16:00:00.000Z",
               "duration": "19:34",
               "durationSeconds": "1174",
               "title": "A Little Hyper-Aware",
               "description": "Jerry Seinfel and his special guest, Sarah Jessica Parker, sip a Starbucks while driving a 1976 Ford Country Station Wagon to Long Island's Colony Diner...for another cup of coffee.",
               "guests": [
                          {
                          "name": "Sarah Jessica Parker"
                          }
                          ],
               "images": {
               "poster": "http://ccc.crackle.com/images/s4e1_poster.jpg",
               "thumb": "http://ccc.crackle.com/images/s4e1_thumb.jpg"
               },
               "mediaUrl": "http://content.uplynk.com/ext/e8773f7770a44dbd886eee4fca16a66b/2493024.m3u8?ad=crackle_live",
               "urlSlug": "sarah-jessica-parker-a-little-hyper-aware",
               "pubDateTime": 1403193600,
               "slug": "sarah-jessica-parker-a-little-hyper-aware",
               "videoUrl": "http://content-ause4.uplynk.com/c8a46c92b13246bb84f838b4c1690e8a/g.m3u8?ad=crackle_live&pbs=6bd92aea69a6490993d9acf929cad8df"
               },
               {
               "mediaId": 2493158,
               "type": "singleshot",
               "season": "04",
               "episode": "0001",
               "launchDate": "7/24/2014",
               "pubDate": "2014-07-24T16:00:00.000Z",
               "duration": "02:11",
               "durationSeconds": "131",
               "title": "Single Shot: Donuts",
               "description": "Jerry Seinfeld and his guests Tina Fey, Brian Regan and Sarah Silverman converse about the most beloved of all pastries, the donut, in this episode of Comedians in Cars Getting Coffee: Single Shot.",
               "guests": [
                          {
                          "name": "Tina Fey"
                          },
                          {
                          "name": "Brian Regan"
                          },
                          {
                          "name": "Sarah Silverman"
                          }
                          ],
               "images": {
               "poster": "http://ccc.crackle.com/images/single-shots/sse1_poster.jpg",
               "thumb": "http://ccc.crackle.com/images/single-shots/sse1_thumb.jpg"
               },
               "mediaUrl": "http://content.uplynk.com/ext/e8773f7770a44dbd886eee4fca16a66b/2493158.m3u8",
               "urlSlug": "tina-fey-brian-regan-sarah-silverman-donuts",
               "slug": "tina-fey-brian-regan-sarah-silverman-donuts",
               "pubDateTime": "2014-07-24T16:00:00.000Z",
               "videoUrl": "http://content-aeui1.uplynk.com/6640670d169a436f80e7dfd26786b589/g.m3u8"
               },
               {
               "mediaId": 2493031,
               "type": "episode",
               "season": "04",
               "episode": "0002",
               "launchDate": "6/26/2014",
               "pubDate": "2014-06-26T16:00:00.000Z",
               "duration": "16:11",
               "durationSeconds": "971",
               "title": "Two Polish Airline Pilots",
               "description": "Jerry Seinfel and long-time friend George Wallace laugh about the good old days as they cruise down the Vegas strip in a 1965 Buick Riviera and stop for coffee at the famous Peppermill Restaurant.",
               "guests": [
                          {
                          "name": "George Wallace"
                          }
                          ],
               "images": {
               "poster": "http://ccc.crackle.com/images/s4e2_poster.jpg",
               "thumb": "http://ccc.crackle.com/images/s4e2_thumb.jpg"
               },
               "mediaUrl": "http://content.uplynk.com/ext/e8773f7770a44dbd886eee4fca16a66b/2493031.m3u8?ad=crackle_live",
               "urlSlug": "george-wallace-two-polish-airline-pilots",
               "pubDateTime": 1403798400,
               "slug": "george-wallace-two-polish-airline-pilots",
               "videoUrl": "http://content-ause1.uplynk.com/a5131b1507354ecb9fc63df43cfe215e/g.m3u8?ad=crackle_live&pbs=d1ccd85026ab493aa8ce73663c210797"
               },
               {
               "mediaId": 2493025,
               "type": "episode-trailer",
               "season": "04",
               "episode": "0002",
               "launchDate": "6/23/2014",
               "pubDate": "2014-06-23T16:00:00.000Z",
               "duration": "00:54",
               "durationSeconds": "54",
               "title": "Episode Trailer",
               "description": "Jerry Seinfeld' next special guest is George Wallace (The George Wallace Show).",
               "guests": [
                          {
                          "name": "George Wallace"
                          }
                          ],
               "images": {
               "poster": "http://ccc.crackle.com/images/s4e2_poster.jpg",
               "thumb": "http://ccc.crackle.com/images/s4e2_thumb.jpg"
               },
               "mediaUrl": "http://content.uplynk.com/ext/e8773f7770a44dbd886eee4fca16a66b/2493025.m3u8",
               "urlSlug": "george-wallace-jerry-s-next-guest-is-george-wallace",
               "pubDateTime": 1403539200,
               "slug": "george-wallace-episode-trailer",
               "videoUrl": "http://content-ause2.uplynk.com/c8501b1c718f4b05ac99180aef5c955d/g.m3u8"
               },
               {
               "mediaId": 2493173,
               "type": "singleshot",
               "season": "04",
               "episode": "0002",
               "launchDate": "7/31/2014",
               "pubDate": "2014-07-31T16:00:00.000Z",
               "duration": "01:46",
               "durationSeconds": "106",
               "title": "Single Shot: Gay Stuff",
               "description": "Jerry's special guests Alec Baldwin, Larry David, Ricky Gervais, Ted L. Nancy, Sarah Silverman and Howard Stern take their discussions out of the closet in this episode of Comedians in Cars Getting Coffee: Single Shot.",
               "guests": [
                          {
                          "name": "Alec Baldwin"
                          },
                          {
                          "name": "Larry David"
                          },
                          {
                          "name": "Ricky Gervais"
                          },
                          {
                          "name": "Ted L. Nancy"
                          },
                          {
                          "name": "Sarah Silverman"
                          },
                          {
                          "name": "Howard Stern"
                          }
                          ],
               "images": {
               "poster": "http://ccc.crackle.com/images/single-shots/sse2_poster.jpg",
               "thumb": "http://ccc.crackle.com/images/single-shots/sse2_thumb.jpg"
               },
               "mediaUrl": "http://content.uplynk.com/ext/e8773f7770a44dbd886eee4fca16a66b/2493173.m3u8",
               "urlSlug": "alec-baldwin-larry-david-ricky-gervais-barry-marder-sarah-silverman-howard-stern-gay-stuff",
               "slug": "alec-baldwin-larry-david-ricky-gervais-barry-marder-sarah-silverman-howard-stern-gay-stuff",
               "pubDateTime": "2014-07-31T16:00:00.000Z",
               "videoUrl": "http://content-aeui1.uplynk.com/6d5755fe4e5c4eeab7d7f31e203ef8c0/g.m3u8"
               },
               {
               "mediaId": 2493079,
               "type": "episode",
               "season": "04",
               "episode": "0003",
               "launchDate": "7/03/2014",
               "pubDate": "2014-07-03T16:00:00.000Z",
               "duration": "15:55",
               "durationSeconds": "955",
               "title": "Opera Pimp",
               "description": "Jerry Seinfeld and his hero, Robert Klein, cruise around Westchester County, NY, in a '67 Jaguar Mark II to look for lunch and a hot brew and somehow wind up at Sing Sing prison.",
               "guests": [
                          {
                          "name": "Robert Klein"
                          }
                          ],
               "images": {
               "poster": "http://ccc.crackle.com/images/s4e3_poster_prod.jpg",
               "thumb": "http://ccc.crackle.com/images/s4e3_thumb_prod.jpg"
               },
               "mediaUrl": "http://content.uplynk.com/ext/e8773f7770a44dbd886eee4fca16a66b/2493079.m3u8?ad=crackle_live",
               "urlSlug": "robert-klien-opera-pimp",
               "pubDateTime": 1404403200,
               "slug": "robert-klein-opera-pimp",
               "videoUrl": "http://content-ause1.uplynk.com/0e9954eb1e5643269f9677393a5ca067/g.m3u8?ad=crackle_live&pbs=2d507b6aefe644dca98e5f9c54819fec"
               },
               {
               "mediaId": 2493065,
               "type": "episode-trailer",
               "season": "04",
               "episode": "0003",
               "launchDate": "6/30/2014",
               "pubDate": "2014-06-30T16:00:00.000Z",
               "duration": "01:02",
               "durationSeconds": "62",
               "title": "Episode Trailer",
               "description": "Jerry Seinfeld' next special guest is iconic comedian Robert Klein.",
               "guests": [
                          {
                          "name": "Robert Klein"
                          }
                          ],
               "images": {
               "poster": "http://ccc.crackle.com/images/s4e3_poster.jpg",
               "thumb": "http://ccc.crackle.com/images/s4e3_thumb.jpg"
               },
               "mediaUrl": "http://content.uplynk.com/ext/e8773f7770a44dbd886eee4fca16a66b/2493065.m3u8",
               "urlSlug": "robert-klein-jerry-s-next-guest-is-robert-klein",
               "pubDateTime": 1404144000,
               "slug": "robert-klein-episode-trailer",
               "videoUrl": "http://content-ause2.uplynk.com/f606e8bd934e4a1c9953799d40a3ae9e/g.m3u8"
               },
               {
               "mediaId": 2493207,
               "type": "singleshot",
               "season": "04",
               "episode": "0003",
               "launchDate": "8/7/2014",
               "pubDate": "2014-08-07T16:00:00.000Z",
               "duration": "02:34",
               "durationSeconds": "154",
               "title": "Single Shot: Comedians Love Eating",
               "description": "Jerry and his laundry list of guests deliberate over the one thing comedians love above all else. Food.",
               "guests": [
                          {
                          "name": "Aziz Ansari"
                          },
                          {
                          "name": "Mel Brooks"
                          },
                          {
                          "name": "Larry David"
                          },
                          {
                          "name": "Bob Einstein"
                          },
                          {
                          "name": "Tina Fey"
                          },
                          {
                          "name": "Ricky Gervais"
                          },
                          {
                          "name": "Carl Reiner"
                          },
                          {
                          "name": "Don Rickles"
                          },
                          {
                          "name": "Sarah Jessica Parker"
                          },
                          {
                          "name": "Sarah Silverman"
                          }
                          ],
               "images": {
               "poster": "http://ccc.crackle.com/images/single-shots/sse3_poster.jpg",
               "thumb": "http://ccc.crackle.com/images/single-shots/sse3_thumb.jpg"
               },
               "mediaUrl": "http://content.uplynk.com/ext/e8773f7770a44dbd886eee4fca16a66b/2493207.m3u8",
               "urlSlug": "aziz-ansari-mel-brooks-larry-david-bob-einstein-tina-fey-ricky-gervais-sarah-jessica-parker-carl-reiner-don-rickles-sarah-silverman-comedians-love-eating",
               "slug": "aziz-ansari-mel-brooks-larry-david-bob-einstein-tina-fey-ricky-gervais-sarah-jessica-parker-carl-reiner-don-rickles-sarah-silverman-comedians-love-eating",
               "pubDateTime": "2014-08-07T16:00:00.000Z",
               "videoUrl": "http://content-aeui1.uplynk.com/afbfa9a33100488391e2bcfb582d53ab/g.m3u8"
               },
               {
               "mediaId": 2493030,
               "type": "episode-trailer",
               "season": "04",
               "episode": "0004",
               "launchDate": "7/7/2014",
               "pubDate": "2014-07-07T16:00:00.000Z",
               "duration": "01:08",
               "durationSeconds": "68",
               "title": "Episode Trailer",
               "description": "Jerry Seinfeld' next special guest is Aziz Ansari (Parks and Recreation).",
               "guests": [
                          {
                          "name": "Aziz Ansari"
                          }
                          ],
               "images": {
               "poster": "http://ccc.crackle.com/images/s4e4_trailer_poster.jpg",
               "thumb": "http://ccc.crackle.com/images/s4e4_trailer_thumb.jpg"
               },
               "mediaUrl": "http://content.uplynk.com/ext/e8773f7770a44dbd886eee4fca16a66b/2493030.m3u8",
               "urlSlug": "aziz-ansari-jerry-s-next-guest-is-aziz-ansari",
               "pubDateTime": 1404748800,
               "slug": "aziz-ansari-episode-trailer",
               "videoUrl": "http://content-ause4.uplynk.com/09e43fbeb94d427b8864e1ed732df55f/g.m3u8"
               },
               {
               "mediaId": 2493096,
               "type": "episode",
               "season": "04",
               "episode": "0004",
               "launchDate": "7/10/2014",
               "pubDate": "2014-07-10T16:00:00.000Z",
               "duration": "16:37",
               "durationSeconds": "997",
               "title": "It's Like Pushing a Building Off a Cliff",
               "description": "",
               "guests": [
                          {
                          "name": "Aziz Ansari"
                          }
                          ],
               "images": {
               "poster": "http://ccc.crackle.com/images/s4e4_poster.jpg",
               "thumb": "http://ccc.crackle.com/images/s4e4_thumb.jpg"
               },
               "mediaUrl": "http://content.uplynk.com/ext/e8773f7770a44dbd886eee4fca16a66b/2493096.m3u8?ad=crackle_live",
               "urlSlug": "aziz-ansari-its-like-pushing-a-building-off-a-cliff",
               "pubDateTime": 1405008000,
               "slug": "aziz-ansari-its-like-pushing-a-building-off-a-cliff",
               "videoUrl": "http://content-ause4.uplynk.com/0ea4e882f6994b18ab296fcc8a35c685/g.m3u8?ad=crackle_live&pbs=e14fb9c276d74aa7b579eb56153dcd46"
               },
               {
               "mediaId": 2493194,
               "type": "singleshot",
               "season": "04",
               "episode": "0004",
               "launchDate": "8/14/2014",
               "pubDate": "2014-08-14T16:00:00.000Z",
               "duration": "02:39",
               "durationSeconds": "159",
               "title": "Single Shot: Marriage",
               "description": "Jerry's special guests Robert Klein, Jay Leno, Don Rickles, Chris Rock and Sarah Silverman discuss the ups and downs of marriage in this episode of Comedians In Cars Getting Coffee: Single Shot.",
               "guests": [
                          {
                          "name": "Robert Klein"
                          },
                          {
                          "name": "Jay Leno"
                          },
                          {
                          "name": "Don Rickles"
                          },
                          {
                          "name": "Chris Rock"
                          },
                          {
                          "name": "Sarah Silverman"
                          }
                          ],
               "images": {
               "poster": "http://ccc.crackle.com/images/single-shots/sse4_poster.jpg",
               "thumb": "http://ccc.crackle.com/images/single-shots/sse4_thumb.jpg"
               },
               "mediaUrl": "http://content.uplynk.com/ext/e8773f7770a44dbd886eee4fca16a66b/2493194.m3u8",
               "urlSlug": "robert-klein-jay-leno-don-rickles-chris-rock-sarah-silverman-marriage",
               "slug": "robert-klein-jay-leno-don-rickles-chris-rock-sarah-silverman-marriage",
               "pubDateTime": "2014-08-14T16:00:00.000Z",
               "videoUrl": "http://content-aeui1.uplynk.com/b218f2d63d434046a5524e5453ab443d/g.m3u8"
               },
               {
               "mediaId": 2493123,
               "type": "episode",
               "season": "04",
               "episode": "0005",
               "launchDate": "7/17/2014",
               "pubDate": "2014-07-17T16:00:00.000Z",
               "duration": "18:13",
               "durationSeconds": "1093",
               "title": "The Sound of Virginity",
               "description": "",
               "guests": [
                          {
                          "name": "Jon Stewart"
                          }
                          ],
               "images": {
               "poster": "http://ccc.crackle.com/images/s4e5_poster.jpg",
               "thumb": "http://ccc.crackle.com/images/s4e5_thumb.jpg"
               },
               "mediaUrl": "http://content.uplynk.com/ext/e8773f7770a44dbd886eee4fca16a66b/2493123.m3u8?ad=crackle_live",
               "urlSlug": "jon-stewart-the-sound-of-virginity",
               "pubDateTime": 1405612800,
               "slug": "jon-stewart-the-sound-of-virginity",
               "videoUrl": "http://content-ause4.uplynk.com/2b44de470c994489a871258ee2754125/g.m3u8?ad=crackle_live&pbs=762597841158403eba6b5df70a01973a"
               },
               {
               "mediaId": 2493078,
               "type": "episode-trailer",
               "season": "04",
               "episode": "0005",
               "launchDate": "7/14/2014",
               "pubDate": "2014-07-14T16:00:00.000Z",
               "duration": "01:00",
               "durationSeconds": "60",
               "title": "Episode Trailer",
               "description": "Jerry Seinfeld' next special guest is Jon Stewart (The Daily Show)",
               "guests": [
                          {
                          "name": "Jon Stewart"
                          }
                          ],
               "images": {
               "poster": "http://ccc.crackle.com/images/s4e5_trailer_poster.jpg",
               "thumb": "http://ccc.crackle.com/images/s4e5_trailer_thumb.jpg"
               },
               "mediaUrl": "http://content.uplynk.com/ext/e8773f7770a44dbd886eee4fca16a66b/2493078.m3u8",
               "urlSlug": "jon-stewart-jerry-s-next-guest-is-jon-stewart",
               "pubDateTime": 1405353600,
               "slug": "jon-stewart-episode-trailer",
               "videoUrl": "http://content-ause2.uplynk.com/7023bbbed4d74f41a64bb3dd7e17d555/g.m3u8"
               },
               {
               "mediaId": 2493195,
               "type": "singleshot",
               "season": "04",
               "episode": "0005",
               "launchDate": "8/21/2014",
               "pubDate": "2014-08-21T16:00:00.000Z",
               "duration": "01:52",
               "durationSeconds": "112",
               "title": "Single Shot: The Money",
               "description": "Jerry and his special guests Louis C.K., Bob Einstein, Joel Hodgson, Seth Meyers and Michael Richards debate the complexities of making the big bucks in this episode of Comedians In Cars Getting Coffee: Single Shot.",
               "guests": [
                          {
                          "name": "Louis C.K."
                          },
                          {
                          "name": "Bob Einstein"
                          },
                          {
                          "name": "Joel Hodgson"
                          },
                          {
                          "name": "Seth Meyers"
                          },
                          {
                          "name": "Michael Richards"
                          }
                          ],
               "images": {
               "poster": "http://ccc.crackle.com/images/single-shots/sse5_poster.jpg",
               "thumb": "http://ccc.crackle.com/images/single-shots/sse5_thumb.jpg"
               },
               "mediaUrl": "http://content.uplynk.com/ext/e8773f7770a44dbd886eee4fca16a66b/2493195.m3u8",
               "urlSlug": "louis-c-k-bob-einstein-joel-hodgson-seth-meyers-michael-richards-the-money",
               "slug": "louis-c-k-bob-einstein-joel-hodgson-seth-meyers-michael-richards-the-money",
               "pubDateTime": "2014-08-21T16:00:00.000Z",
               "videoUrl": "http://content-aeui1.uplynk.com/edc06c681a634fa196d7597ddab29a64/g.m3u8"
               },
               {
               "mediaId": 2493203,
               "type": "singleshot",
               "season": "04",
               "episode": "0006",
               "launchDate": "8/28/2014",
               "pubDate": "2014-08-28T16:00:00.000Z",
               "duration": "02:51",
               "durationSeconds": "171",
               "title": "Single Shot: My Parents",
               "description": "Jerry and his special guests Larry David, Gad Elmaleh, Robert Klein, Jay Leno, Seth Meyers, Sarah Jessica Parker, Don Rickles, Sarah Silverman and Howard Stern reminisce about their humble roots in this episode of Comedians In Cars Getting Coffee: Single Shot.",
               "guests": [
                          {
                          "name": "Larry David"
                          },
                          {
                          "name": "Gad Elmaleh"
                          },
                          {
                          "name": "Robert Klein"
                          },
                          {
                          "name": "Jay Leno"
                          },
                          {
                          "name": "Seth Meyers"
                          },
                          {
                          "name": "Sarah Jessica Parker"
                          },
                          {
                          "name": "Don Rickles"
                          },
                          {
                          "name": "Sarah Silverman"
                          },
                          {
                          "name": "Howard Stern"
                          }
                          ],
               "images": {
               "poster": "http://ccc.crackle.com/images/single-shots/sse6_poster.jpg",
               "thumb": "http://ccc.crackle.com/images/single-shots/sse6_thumb.jpg"
               },
               "mediaUrl": "http://content.uplynk.com/ext/e8773f7770a44dbd886eee4fca16a66b/2493203.m3u8",
               "urlSlug": "larry-david-gad-elmaleh-robert-klein-jay-leno-seth-meyers-sarah-jessica-parker-don-rickles-sarah-silverman-howard-stern-my-parents",
               "slug": "larry-david-gad-elmaleh-robert-klein-jay-leno-seth-meyers-sarah-jessica-parker-don-rickles-sarah-silverman-howard-stern-my-parents",
               "pubDateTime": "2014-08-28T16:00:00.000Z",
               "videoUrl": "http://content-aeui1.uplynk.com/0e710ea3b04c4239a0a2ab749b8125a2/g.m3u8"
               },
               {
               "mediaId": 2493204,
               "type": "singleshot",
               "season": "04",
               "episode": "0007",
               "launchDate": "9/04/2014",
               "pubDate": "2014-09-04T16:00:00.000Z",
               "duration": "02:19",
               "durationSeconds": "139",
               "title": "Single Shot: New York Life",
               "description": "Jerry and his special guests Todd Barry, Gad Elmaleh, Tina Fey, Sarah Jessica Parker and Colin Quinn converse about life in The Big Apple.",
               "guests": [
                          {
                          "name": "Todd Barry"
                          },
                          {
                          "name": "Gad Elmaleh"
                          },
                          {
                          "name": "Tina Fey"
                          },
                          {
                          "name": "Sarah Jessica Parker"
                          },
                          {
                          "name": "Colin Quinn"
                          }
                          ],
               "images": {
               "poster": "http://ccc.crackle.com/images/single-shots/sse7_poster.jpg",
               "thumb": "http://ccc.crackle.com/images/single-shots/sse7_thumb.jpg"
               },
               "mediaUrl": "http://content.uplynk.com/ext/e8773f7770a44dbd886eee4fca16a66b/2493204.m3u8",
               "urlSlug": "todd-barry-gad-elmaleh-tina-fey-sarah-jessica-parker-colin-quinn-new-york-life",
               "slug": "todd-barry-gad-elmaleh-tina-fey-sarah-jessica-parker-colin-quinn-new-york-life",
               "pubDateTime": "2014-09-04T16:00:00.000Z",
               "videoUrl": "http://content-aeui1.uplynk.com/ecaebc8281404065bf4adf64caa6f2e7/g.m3u8"
               },
               {
               "mediaId": 2493214,
               "type": "singleshot",
               "season": "04",
               "episode": "0008",
               "launchDate": "9/11/2014",
               "pubDate": "2014-09-11T16:00:00.000Z",
               "duration": "02:42",
               "durationSeconds": "162",
               "title": "Single Shot: Sexy Talk",
               "description": "Jerry and his special guests Louis C.K., Gad Elmaleh, Bob Einstein, Sarah Silverman, Howard Stern and George Wallace take their discussions to a sexy new level.",
               "guests": [
                          {
                          "name": "Louis C.K."
                          },
                          {
                          "name": "Gad Elmaleh"
                          },
                          {
                          "name": "Bob Einstein"
                          },
                          {
                          "name": "Sarah Silverman"
                          },
                          {
                          "name": "Howard Stern"
                          },
                          {
                          "name": "George Wallace"
                          }
                          ],
               "images": {
               "poster": "http://ccc.crackle.com/images/single-shots/sse8_poster.jpg",
               "thumb": "http://ccc.crackle.com/images/single-shots/sse8_thumb.jpg"
               },
               "mediaUrl": "http://content.uplynk.com/ext/e8773f7770a44dbd886eee4fca16a66b/2493214.m3u8",
               "urlSlug": "louis-c-k-gad-elmaleh-bob-einstein-sarah-silverman-howard-stern-george-wallace-sexy-talk",
               "slug": "louis-c-k-gad-elmaleh-bob-einstein-sarah-silverman-howard-stern-george-wallace-sexy-talk",
               "pubDateTime": "2014-09-11T16:00:00.000Z",
               "videoUrl": "http://content-aeui1.uplynk.com/18b998ed1088408fab4fbd79d5e91bcb/g.m3u8"
               },
               {
               "mediaId": 2493358,
               "type": "singleshot",
               "season": "04",
               "episode": "0009",
               "launchDate": "9/18/2014",
               "pubDate": "2014-09-18T16:00:00.000Z",
               "duration": "02:45",
               "durationSeconds": "165",
               "title": "Single Shot: Leno and Letterman on Each Other",
               "description": "Jerry and his special guests Jay Leno and David Letterman grab a cup and talk about their favorite topic...each other.",
               "guests": [
                          {
                          "name": "David Letterman"
                          },
                          {
                          "name": "Jay Leno"
                          }
                          ],
               "images": {
               "poster": "http://ccc.crackle.com/images/single-shots/sse9_poster.jpg",
               "thumb": "http://ccc.crackle.com/images/single-shots/sse9_thumb.jpg"
               },
               "mediaUrl": "http://content.uplynk.com/ext/e8773f7770a44dbd886eee4fca16a66b/2493358.m3u8",
               "urlSlug": "david-letterman-jay-leno-on-eachother",
               "slug": "david-letterman-jay-leno-on-eachother",
               "pubDateTime": "2014-09-18T16:00:00.000Z",
               "videoUrl": "http://content-aeui1.uplynk.com/e8bede7af8ee4e2ca7ea05911cb85d8f/g.m3u8"
               },
               {
               "mediaId": 2493359,
               "type": "singleshot",
               "season": "04",
               "episode": "0010",
               "launchDate": "9/25/2014",
               "pubDate": "2014-09-25T16:00:00.000Z",
               "duration": "01:58",
               "durationSeconds": "118",
               "title": "Single Shot: Pee-Pee Time",
               "description": "Gotta go? Jerry and his special guests Mel Brooks, Larry David, Bob Einstein, Gad Elmaleh, Sarah Silverman, Howard Stern and George Wallace can't hold it any longer as navigate the complexities of toilet time.",
               "guests": [
                          {
                          "name": "Mel Brooks"
                          },
                          {
                          "name": "Larry David"
                          },
                          {
                          "name": "Bob Einstein"
                          },
                          {
                          "name": "Gad Elmaleh"
                          },
                          {
                          "name": "Sarah Silverman"
                          },
                          {
                          "name": "Howard Stern"
                          },
                          {
                          "name": "George Wallace"
                          }
                          ],
               "images": {
               "poster": "http://ccc.crackle.com/images/single-shots/sse10_poster.jpg",
               "thumb": "http://ccc.crackle.com/images/single-shots/sse10_thumb.jpg"
               },
               "mediaUrl": "http://content.uplynk.com/ext/e8773f7770a44dbd886eee4fca16a66b/2493359.m3u8",
               "urlSlug": "mel-brooks-larry-david-bob-einstein-gad-elmaleh-sarah-silverman-howard-stern-george-wallace-pee-pee-time",
               "slug": "mel-brooks-larry-david-bob-einstein-gad-elmaleh-sarah-silverman-howard-stern-george-wallace-pee-pee-time",
               "pubDateTime": "2014-09-25T16:00:00.000Z",
               "videoUrl": "http://content-aeui2.uplynk.com/4940d042e98346d08df7a16a9c2a0988/g.m3u8"
               },
               {
               "mediaId": 2493360,
               "type": "singleshot",
               "season": "04",
               "episode": "0011",
               "launchDate": "10/02/2014",
               "pubDate": "2014-10-02T16:00:00.000Z",
               "duration": "01:32",
               "durationSeconds": "92",
               "title": "Single Shot: Vocabulary Words",
               "description": "Jerry and his special guests Alec Baldwin, Larry David, Tina Fey, Robert Klein, Sarah Jessica Parker, Brian Regan and George Wallace confabulate apropos heterogeneous jargon while they luxuriate in coffee's unequivocal piquancy.",
               "guests": [
                          {
                          "name": "Larry David"
                          },
                          {
                          "name": "Tina Fey"
                          },
                          {
                          "name": "Robert Klein"
                          },
                          {
                          "name": "Sarah Jessica Parker"
                          },
                          {
                          "name": "Brian Regan"
                          },
                          {
                          "name": "George Wallace"
                          }
                          ],
               "images": {
               "poster": "http://ccc.crackle.com/images/single-shots/sse11_poster.jpg",
               "thumb": "http://ccc.crackle.com/images/single-shots/sse11_thumb.jpg"
               },
               "mediaUrl": "http://content.uplynk.com/ext/e8773f7770a44dbd886eee4fca16a66b/2493360.m3u8",
               "urlSlug": "larry-david-tina-fey-robert-klein-sarah-jessica-parker-brian-regan-george-wallace-vocabulary-words",
               "slug": "larry-david-tina-fey-robert-klein-sarah-jessica-parker-brian-regan-george-wallace-vocabulary-words",
               "pubDateTime": "2014-10-02T16:00:00.000Z",
               "videoUrl": "http://content-aeui1.uplynk.com/1257bd2f070740529db2dbf937535cac/g.m3u8"
               },
               {
               "mediaId": 2493361,
               "type": "singleshot",
               "season": "04",
               "episode": "0012",
               "launchDate": "10/09/2014",
               "pubDate": "2014-10-09T16:00:00.000Z",
               "duration": "02:48",
               "durationSeconds": "168",
               "title": "Single Shot: Real Jobs",
               "description": "Who WANTS to work? Jerry and his special guests Todd Barry, Louis C.K., Robert Klein, Seth Meyers, Patton Oswalt, Brian Regan, Jon Stewart and Colin Quin reflect on the jobs they once had that helped propel them into comedy when they learned...working sucks!",
               "guests": [
                          {
                          "name": "Todd Barry"
                          },
                          {
                          "name": "Louis C.K."
                          },
                          {
                          "name": "Robert Klein"
                          },
                          {
                          "name": "Seth Meyers"
                          },
                          {
                          "name": "Patton Oswalt"
                          },
                          {
                          "name": "Brian Regan"
                          },
                          {
                          "name": "Jon Stewart"
                          },
                          {
                          "name": "Colin Quinn"
                          }
                          ],
               "images": {
               "poster": "http://ccc.crackle.com/images/single-shots/sse12_poster.jpg",
               "thumb": "http://ccc.crackle.com/images/single-shots/sse12_thumb.jpg"
               },
               "mediaUrl": "http://content.uplynk.com/ext/e8773f7770a44dbd886eee4fca16a66b/2493361.m3u8",
               "urlSlug": "todd-barry-louis-c-k-robert-klein-seth-meyers-patton-oswalt-brian-regan-jon-stewart-colin-quinn-real-jobs",
               "slug": "todd-barry-louis-c-k-robert-klein-seth-meyers-patton-oswalt-brian-regan-jon-stewart-colin-quinn-real-jobs",
               "pubDateTime": "2014-10-09T16:00:00.000Z",
               "videoUrl": "http://content-aeui1.uplynk.com/7999069e1f1442e7949c4bd9633f825f/g.m3u8"
               },
               {
               "mediaId": 2493362,
               "type": "singleshot",
               "season": "04",
               "episode": "0013",
               "launchDate": "10/16/2014",
               "pubDate": "2014-10-16T16:00:00.000Z",
               "duration": "01:42",
               "durationSeconds": "102",
               "title": "Single Shot: Coffee or Tea?",
               "description": "Cream and sugar, or lemon and ice? Jerry and his special guests Larry David, Joel Hodgson and Michael Richards attempt to answer a question as old as time...coffee or tea?",
               "guests": [
                          {
                          "name": "Larry David"
                          },
                          {
                          "name": "Joel Hodgson"
                          },
                          {
                          "name": "Michael Richards"
                          }
                          ],
               "images": {
               "poster": "http://ccc.crackle.com/images/single-shots/sse13_poster.jpg",
               "thumb": "http://ccc.crackle.com/images/single-shots/sse13_thumb.jpg"
               },
               "mediaUrl": "http://content.uplynk.com/ext/e8773f7770a44dbd886eee4fca16a66b/2493362.m3u8",
               "urlSlug": "larry-david-joel-hodgson-michael-richards-coffee-or-tea",
               "slug": "larry-david-joel-hodgson-michael-richards-coffee-or-tea",
               "pubDateTime": "2014-10-16T16:00:00.000Z",
               "videoUrl": "http://content-aeui1.uplynk.com/29fac239ffee48d08e2f98902b9ea4da/g.m3u8"
               },
               {
               "mediaId": 2493363,
               "type": "singleshot",
               "season": "04",
               "episode": "0014",
               "launchDate": "10/24/2014",
               "pubDate": "2014-10-24T16:00:00.000Z",
               "duration": "01:49",
               "durationSeconds": "109",
               "title": "Single Shot: Hair",
               "description": "In this episode of Single Shot, Jerry and his special guests Louis C.K., Larry David, Tina Fey, Ricky Gervais and Howard Stern discuss some peoples, Tarzan-like, flowing manes and others shiny lack thereof.",
               "guests": [
                          {
                          "name": "Louis C.K."
                          },
                          {
                          "name": "Larry David"
                          },
                          {
                          "name": "Tina Fey"
                          },
                          {
                          "name": "Ricky Gervais"
                          },
                          {
                          "name": "Howard Stern"
                          }
                          ],
               "images": {
               "poster": "http://ccc.crackle.com/images/single-shots/sse14_poster.jpg",
               "thumb": "http://ccc.crackle.com/images/single-shots/sse14_thumb.jpg"
               },
               "mediaUrl": "http://content.uplynk.com/ext/e8773f7770a44dbd886eee4fca16a66b/2493363.m3u8",
               "urlSlug": "louis-c-k-larry-david-tina-fey-ricky-gervais-howard-stern-hair",
               "slug": "louis-c-k-larry-david-tina-fey-ricky-gervais-howard-stern-hair",
               "pubDateTime": "2014-10-24T16:00:00.000Z",
               "videoUrl": "http://content-aeui2.uplynk.com/22dc1aeb0000411b9551b5998f432931/g.m3u8"
               },
               {
               "mediaId": 2493364,
               "type": "singleshot",
               "season": "04",
               "episode": "0015",
               "launchDate": "10/31/2014",
               "pubDate": "2014-10-31T16:00:00.000Z",
               "duration": "02:13",
               "durationSeconds": "133",
               "title": "Single Shot: What is CCC?",
               "description": "Jerry and the majority of his special guests ask the same question we have been uttering for 3 long years...what is Comedians in Cars Getting Coffee?!",
               "guests": [
                          {
                          "name": "Alec Baldwin"
                          },
                          {
                          "name": "Todd Barry"
                          },
                          {
                          "name": "Mel Brooks"
                          },
                          {
                          "name": "Larry David"
                          },
                          {
                          "name": "Bob Einstein"
                          },
                          {
                          "name": "Tina Fey"
                          },
                          {
                          "name": "Ricky Gervais"
                          },
                          {
                          "name": "Jay Leno"
                          },
                          {
                          "name": "David Letterman"
                          },
                          {
                          "name": "Patton Oswalt"
                          },
                          {
                          "name": "Sarah Jessica Parker"
                          },
                          {
                          "name": "Brian Regan"
                          },
                          {
                          "name": "Michael Richards"
                          },
                          {
                          "name": "Chris Rock"
                          },
                          {
                          "name": "Sarah Silverman"
                          },
                          {
                          "name": "Jon Stewart"
                          }
                          ],
               "images": {
               "poster": "http://ccc.crackle.com/images/single-shots/sse15_poster.jpg",
               "thumb": "http://ccc.crackle.com/images/single-shots/sse15_thumb.jpg"
               },
               "mediaUrl": "http://content.uplynk.com/ext/e8773f7770a44dbd886eee4fca16a66b/2493364.m3u8",
               "urlSlug": "what-is-ccc",
               "slug": "what-is-ccc",
               "pubDateTime": "2014-10-31T16:00:00.000Z",
               "videoUrl": "http://content-aeui2.uplynk.com/0d276a5d8aa54f8db21e2f8f63a24e53/g.m3u8"
               },
               {
               "mediaId": 2493927,
               "type": "season-trailer",
               "season": "05",
               "episode": "0000",
               "launchDate": "10/30/2014",
               "pubDate": "2014-10-29T16:00:00.000Z",
               "duration": "01:37",
               "durationSeconds": "97",
               "title": "Season 5 Premiering November 6th",
               "description": "Jerry Seinfeld is joined by friends for a drive in a classic car and having coffee, sharing stories all along the way. Season 5 premiers November 6th.",
               "guests": [
                          {
                          "name": "Jimmy Fallon"
                          },
                          {
                          "name": "Kevin Hart"
                          },
                          {
                          "name": "Amy Schumer"
                          },
                          {
                          "name": "Fred Armisen"
                          },
                          {
                          "name": "Miranda Sings"
                          },
                          {
                          "name": "Bill Burr"
                          },
                          {
                          "name": "Ali Wentworth"
                          }
                          ],
               "images": {
               "poster": "http://ccc.crackle.com/images/s5_trailer_poster.jpg",
               "thumb": "http://ccc.crackle.com/images/s5_trailer_thumb.jpg"
               },
               "mediaUrl": "http://content.uplynk.com/ext/e8773f7770a44dbd886eee4fca16a66b/2493927.m3u8",
               "pubDateTime": 1414598400,
               "slug": "jimmy-fallon-kevin-hart-amy-schumer-fred-armisen-miranda-sings-bill-burr-ali-wentworth-season-trailer",
               "videoUrl": "http://content-ause2.uplynk.com/1fd5b1ca9f264be7bd1a71066e44cd51/g.m3u8"
               },
               {
               "mediaId": 2493914,
               "type": "season-trailer",
               "season": "05",
               "episode": "0000",
               "launchDate": "10/23/2014",
               "pubDate": "2014-10-23T16:00:00.000Z",
               "duration": "02:00",
               "durationSeconds": "120",
               "title": "Seinfeld's Meeting With Crackle Prez Gets Tense",
               "description": "Jerry Seinfeld is urgently called in to the Crackle World Headquarters to speak with the President, Dick Corcoran.",
               "guests": [
                          {
                          "name": "Season 5 - Coming Soon November 6, Noon ET / 9AM PT"
                          }
                          ],
               "images": {
               "poster": "http://ccc.crackle.com/images/s5_promo_poster.jpg",
               "thumb": "http://ccc.crackle.com/images/s5_promo_thumb.jpg"
               },
               "mediaUrl": "http://content.uplynk.com/ext/e8773f7770a44dbd886eee4fca16a66b/2493914.m3u8",
               "pubDateTime": 1414080000,
               "slug": "season-5-coming-soon-november-6-noon-et-9am-pt-season-trailer",
               "videoUrl": "http://content-ause4.uplynk.com/37734c629cfc409ab441da0da8f5a5ac/g.m3u8"
               },
               {
               "mediaId": 2493970,
               "type": "episode",
               "season": "05",
               "episode": "0001",
               "launchDate": "11/06/2014",
               "pubDate": "2014-11-06T17:00:00.000Z",
               "duration": "19:36",
               "durationSeconds": "1176",
               "title": "You Look Amazing in the Wind",
               "description": "Description: Jerry Seinfeld and his special guest Kevin Hart stylishly cruise around town in a 1959 Porsche RSK Spyder for their 'weird male date.'",
               "guests": [
                          {
                          "name": "Kevin Hart"
                          }
                          ],
               "images": {
               "poster": "http://assets.comediansincarsgettingcoffee.com/kevin-hart/s5e1_poster.jpg",
               "thumb": "http://assets.comediansincarsgettingcoffee.com/kevin-hart/s5e1_thumb.jpg"
               },
               "mediaUrl": "http://content.uplynk.com/ext/e8773f7770a44dbd886eee4fca16a66b/2493970.m3u8?ad=crackle_live",
               "pubDateTime": 1415293200,
               "slug": "kevin-hart-you-look-amazing-in-the-wind",
               "videoUrl": "http://content-ause4.uplynk.com/c521e0a4efa14cbc90358392eaf458f3/g.m3u8?ad=crackle_live&pbs=29b05cb91f6d47be867c4d93ccc8d409"
               },
               {
               "mediaId": 2494007,
               "type": "episode",
               "season": "05",
               "episode": "0002",
               "launchDate": "11/13/2014",
               "pubDate": "2014-11-13T17:00:00.000Z",
               "duration": "16:06",
               "durationSeconds": "966",
               "title": "I'm Wondering What It's Like To Date Me",
               "description": "Jerry Seinfeld and his special guest Amy Schumer check out 'cute bongs' as they walk to a local diner for some coffee after their 1970 Ferrari Daytona breaks down.",
               "guests": [
                          {
                          "name": "Amy Schumer"
                          }
                          ],
               "images": {
               "poster": "http://ccc.crackle.com/images/s5e2_poster.jpg",
               "thumb": "http://ccc.crackle.com/images/s5e2_thumb.jpg"
               },
               "mediaUrl": "http://content.uplynk.com/ext/e8773f7770a44dbd886eee4fca16a66b/2494007.m3u8?ad=crackle_live",
               "pubDateTime": 1415898000,
               "slug": "amy-schumer-im-wondering-what-its-like-to-date-me",
               "videoUrl": "http://content-ause4.uplynk.com/bc37b5d00a9a411c8c853bce990c56d8/g.m3u8?ad=crackle_live&pbs=91e41d3a5d3441b9b5bf57c37274dc27"
               },
               {
               "mediaId": 2493979,
               "type": "episode-trailer",
               "season": "05",
               "episode": "0002",
               "launchDate": "11/10/2014",
               "pubDate": "2014-11-10T17:00:00.000Z",
               "duration": "01:07",
               "durationSeconds": "67",
               "title": "Episode Trailer",
               "description": "Jerry Seinfeld' next special guest is Amy Schumer (Inside Amy Schumer).",
               "guests": [
                          {
                          "name": "Amy Schumer"
                          }
                          ],
               "images": {
               "poster": "http://ccc.crackle.com/images/s5e2_promo_poster.jpg",
               "thumb": "http://ccc.crackle.com/images/s5e2_promo_thumb.jpg"
               },
               "mediaUrl": "http://content.uplynk.com/ext/e8773f7770a44dbd886eee4fca16a66b/2493979.m3u8",
               "pubDateTime": 1415638800,
               "slug": "amy-schumer-episode-trailer",
               "videoUrl": "http://content-ause2.uplynk.com/5f3e23db33b8414296cf2d4736517bd8/g.m3u8"
               },
               {
               "mediaId": 2494065,
               "type": "episode",
               "season": "05",
               "episode": "0003",
               "launchDate": "11/20/2014",
               "pubDate": "2014-11-20T17:00:00.000Z",
               "duration": "16:03",
               "durationSeconds": "963",
               "title": "Smoking Past The Band",
               "description": "Jerry Seinfeld and his special guest Bill Burr cruise around L.A. in a 1970 Ford Mustang like a couple of bosses out on the town in the middle of the day.",
               "guests": [
                          {
                          "name": "Bill Burr"
                          }
                          ],
               "images": {
               "poster": "http://ccc.crackle.com/images/s5e3_poster.jpg",
               "thumb": "http://ccc.crackle.com/images/s5e3_thumb.jpg"
               },
               "mediaUrl": "http://content.uplynk.com/ext/e8773f7770a44dbd886eee4fca16a66b/2494065.m3u8?ad=crackle_live",
               "pubDateTime": 1416502800,
               "slug": "bill-burr-smoking-past-the-band",
               "videoUrl": "http://content-ause4.uplynk.com/5f7bcb9cbcdf4dfdb4c6ab1b112cdd78/g.m3u8?ad=crackle_live&pbs=e51a3aaa53db4593981b18221c1df238"
               },
               {
               "mediaId": 2494025,
               "type": "episode-trailer",
               "season": "05",
               "episode": "0003",
               "launchDate": "11/17/2014",
               "pubDate": "2014-11-17T17:00:00.000Z",
               "duration": "01:12",
               "durationSeconds": "72",
               "title": "Episode Trailer",
               "description": "Jerry Seinfeld' next special guest is Bill Burr (Date Night).",
               "guests": [
                          {
                          "name": "Jerry's Next Guest is Bill Burr"
                          }
                          ],
               "images": {
               "poster": "http://ccc.crackle.com/images/s5e3_promo_poster_v3.jpg",
               "thumb": "http://ccc.crackle.com/images/s5e3_promo_thumb.jpg"
               },
               "mediaUrl": "http://content.uplynk.com/ext/e8773f7770a44dbd886eee4fca16a66b/2494025.m3u8",
               "pubDateTime": 1416243600,
               "slug": "jerry-s-next-guest-is-bill-burr-episode-trailer",
               "videoUrl": "http://content-ause4.uplynk.com/ec277bb24fda40cd891b760195461a9c/g.m3u8"
               },
               {
               "mediaId": 2494164,
               "type": "episode",
               "season": "05",
               "episode": "0004",
               "launchDate": "11/27/2014",
               "pubDate": "2014-11-27T17:00:00.000Z",
               "duration": "20:32",
               "durationSeconds": "1232",
               "title": "Happy Thanksgiving Miranda",
               "description": "Jerry Seinfeld and his special guest Miranda Sings cruise around town in search of coffee, complaining and apologizing along the way.",
               "guests": [
                          {
                          "name": "Miranda Sings"
                          }
                          ],
               "images": {
               "poster": "http://ccc.crackle.com/images/s5e4_poster.jpg",
               "thumb": "http://ccc.crackle.com/images/s5e4_thumb.jpg"
               },
               "mediaUrl": "http://content.uplynk.com/ext/e8773f7770a44dbd886eee4fca16a66b/2494164.m3u8?ad=crackle_live",
               "pubDateTime": 1417107600,
               "slug": "miranda-sings-happy-thanksgiving-miranda",
               "videoUrl": "http://content-ause2.uplynk.com/6b50f58adfff44ebb5e997d7388ffd0e/g.m3u8?ad=crackle_live&pbs=71544139843244189fd519fc039e01af"
               },
               {
               "mediaId": 2494104,
               "type": "episode-trailer",
               "season": "05",
               "episode": "0004",
               "launchDate": "11/24/2014",
               "pubDate": "2014-11-24T17:00:00.000Z",
               "duration": "01:18",
               "durationSeconds": "78",
               "title": "Episode Trailer",
               "description": "Jerry Seinfeld' next special guest is Miranda Sings (YouTube).",
               "guests": [
                          {
                          "name": "Jerry's Next Guest is Miranda Sings"
                          }
                          ],
               "images": {
               "poster": "http://ccc.crackle.com/images/s5e4_promo_poster_v2.jpg",
               "thumb": "http://ccc.crackle.com/images/s5e4_promo_thumb_v2.jpg"
               },
               "mediaUrl": "http://content.uplynk.com/ext/e8773f7770a44dbd886eee4fca16a66b/2494104.m3u8",
               "pubDateTime": 1416848400,
               "slug": "jerry-s-next-guest-is-miranda-sings-episode-trailer",
               "videoUrl": "http://content-ause2.uplynk.com/485f018a4fd34e99a93860505ce25e4d/g.m3u8"
               },
               {
               "mediaId": 2494171,
               "type": "episode-trailer",
               "season": "05",
               "episode": "0005",
               "launchDate": "12/01/2014",
               "pubDate": "2014-12-01T17:00:00.000Z",
               "duration": "01:13",
               "durationSeconds": "73",
               "title": "Episode Trailer",
               "description": "Jerry Seinfeld' next special guest is Fred Armisen (Saturday Night Live).",
               "guests": [
                          {
                          "name": "Fred Armisen"
                          }
                          ],
               "images": {
               "poster": "http://assets.comediansincarsgettingcoffee.com/fred-armisen/s5e5_promo_poster.jpg",
               "thumb": "http://assets.comediansincarsgettingcoffee.com/fred-armisen/s5e5_promo_thumb.jpg"
               },
               "mediaUrl": "http://content.uplynk.com/ext/e8773f7770a44dbd886eee4fca16a66b/2494171.m3u8",
               "pubDateTime": 1417453200,
               "slug": "fred-armisen-episode-trailer",
               "videoUrl": "http://content-ause4.uplynk.com/de3f031e65154a009b0e0a90b8d1ba4e/g.m3u8"
               },
               {
               "mediaId": 2494190,
               "type": "episode",
               "season": "05",
               "episode": "0005",
               "launchDate": "12/04/2014",
               "pubDate": "2014-12-04T17:00:00.000Z",
               "duration": "20:56",
               "durationSeconds": "1256",
               "title": "I Wasn't Told About This...With Special Feature: I'm Dying, Jerry",
               "description": "Jerry Seinfeld and his special guest Fred Armisen cruise over to Portland's Coava in a 1965 Saab 96 Monte Carlo 850 for some coffee.",
               "guests": [
                          {
                          "name": "Fred Armisen"
                          }
                          ],
               "images": {
               "poster": "http://assets.comediansincarsgettingcoffee.com/fred-armisen/s5e5_poster.jpg",
               "thumb": "http://assets.comediansincarsgettingcoffee.com/fred-armisen/s5e5_thumb.jpg"
               },
               "mediaUrl": "http://content.uplynk.com/ext/e8773f7770a44dbd886eee4fca16a66b/2494190.m3u8?ad=crackle_live",
               "pubDateTime": 1417712400,
               "slug": "fred-armisen-i-wasnt-told-about-this-with-special-feature-im-dying-jerry",
               "videoUrl": "http://content-ause1.uplynk.com/7cc3e4f9226c489d93b3552c11ec03fa/g.m3u8?ad=crackle_live&pbs=b658a5574d7f4485a6286a53f3c3489d"
               },
               {
               "mediaId": 2494247,
               "type": "episode",
               "season": "05",
               "episode": "0006",
               "launchDate": "12/11/2014",
               "pubDate": "2014-12-11T17:00:00.000Z",
               "duration": " 17:54",
               "durationSeconds": "1074",
               "title": "I'm Going To Take A Percocet And Let That One Go",
               "description": "Jerry and his waspy special guest Ali Wentworth go out for a spin in a low-grill 1970 Mercedes 280SE Cabriolet to grab some coffee.",
               "guests": [
                          {
                          "name": "Ali Wentworth"
                          }
                          ],
               "images": {
               "poster": "http://assets.comediansincarsgettingcoffee.com/ali-wentworth/s5e6_poster.jpg",
               "thumb": "http://assets.comediansincarsgettingcoffee.com/ali-wentworth/s5e6_thumb.jpg"
               },
               "mediaUrl": "http://content.uplynk.com/ext/e8773f7770a44dbd886eee4fca16a66b/2494247.m3u8?ad=crackle_live",
               "pubDateTime": 1418317200,
               "slug": "ali-wentworth-im-going-to-take-a-percocet-and-let-that-one-go",
               "videoUrl": "http://content-ause4.uplynk.com/f894a6c655014e83b6b033fe81da3e8b/g.m3u8?ad=crackle_live&pbs=2ccff031ab4c4854ab72fb6beb385b7f"
               },
               {
               "mediaId": 2494191,
               "type": "episode-trailer",
               "season": "05",
               "episode": "0006",
               "launchDate": "12/08/2014",
               "pubDate": "2014-12-08T17:00:00.000Z",
               "duration": "01:07",
               "durationSeconds": "77",
               "title": "Episode Trailer",
               "description": "Jerry Seinfeld' next special guest is Ali Wentworth (Office Space).",
               "guests": [
                          {
                          "name": "Ali Wentworth"
                          }
                          ],
               "images": {
               "poster": "http://assets.comediansincarsgettingcoffee.com/ali-wentworth/s5e6_promo_poster.jpg",
               "thumb": "http://assets.comediansincarsgettingcoffee.com/ali-wentworth/s5e56_promo_thumb.jpg"
               },
               "mediaUrl": "http://content.uplynk.com/ext/e8773f7770a44dbd886eee4fca16a66b/2494191.m3u8",
               "pubDateTime": 1418058000,
               "slug": "ali-wentworth-episode-trailer",
               "videoUrl": "http://content-ause4.uplynk.com/cda2ed895a924f00aca48b04e66fe28e/g.m3u8"
               },
               {
               "mediaId": 2494322,
               "type": "episode",
               "season": "05",
               "episode": "0007",
               "launchDate": "12/18/2014",
               "pubDate": "2014-12-18T17:00:00.000Z",
               "duration": " 16:58",
               "durationSeconds": "1018",
               "title": "The Unsinkable Legend: Part 2",
               "description": "Jerry and his special guest Jimmy Fallon finish up their day on the water and head back to the mainland for John's Famous Pancake House and a cup of coffee.",
               "guests": [
                          {
                          "name": "Jimmy Fallon"
                          }
                          ],
               "images": {
               "poster": "http://assets.comediansincarsgettingcoffee.com/jimmy-fallon/s5e7_poster_p2.jpg",
               "thumb": "http://assets.comediansincarsgettingcoffee.com/jimmy-fallon/s5e7_thumb_p2.jpg"
               },
               "mediaUrl": "http://content.uplynk.com/ext/e8773f7770a44dbd886eee4fca16a66b/2494322.m3u8?ad=crackle_live",
               "pubDateTime": 1418922000,
               "slug": "jimmy-fallon-the-unsinkable-legend-part-2",
               "videoUrl": "http://content-ause4.uplynk.com/83e8a92f7c7848cb8bc2cd913d20566e/g.m3u8?ad=crackle_live&pbs=9a717c7e1e1a464ea24d0d9570983557"
               },
               {
               "mediaId": 2494259,
               "type": "episode-trailer",
               "season": "05",
               "episode": "0007",
               "launchDate": "12/15/2014",
               "pubDate": "2014-12-15T17:00:00.000Z",
               "duration": " 1:16",
               "durationSeconds": "76",
               "title": "Episode Trailer",
               "description": "Jerry Seinfeld' next special guest is Jimmy Fallon (The Tonight Show).",
               "guests": [
                          {
                          "name": "Jimmy Fallon"
                          }
                          ],
               "images": {
               "poster": "http://assets.comediansincarsgettingcoffee.com/jimmy-fallon/s5e7_promo_poster.jpg",
               "thumb": "http://assets.comediansincarsgettingcoffee.com/jimmy-fallon/s5e7_promo_thumb.jpg"
               },
               "mediaUrl": "http://content.uplynk.com/ext/e8773f7770a44dbd886eee4fca16a66b/2494259.m3u8",
               "pubDateTime": 1418662800,
               "slug": "jimmy-fallon-episode-trailer",
               "videoUrl": "http://content-ause1.uplynk.com/49be0cef15484e10a9731c9cc5e97dae/g.m3u8"
               },
               {
               "mediaId": 2494321,
               "type": "episode",
               "season": "05",
               "episode": "0008",
               "launchDate": "12/18/2014",
               "pubDate": "2014-12-18T17:00:01.000Z",
               "duration": " 17:04",
               "durationSeconds": "1024",
               "title": "The Unsinkable Legend: Part 1",
               "description": "Jerry and his special guest Jimmy Fallon cruise over to Jerry's actual car in a 1956 Chevy Corvette convertible to hop aboard yet another vehicle to enjoy some comedic sailing out at sea.",
               "guests": [
                          {
                          "name": "Jimmy Fallon"
                          }
                          ],
               "images": {
               "poster": "http://assets.comediansincarsgettingcoffee.com/jimmy-fallon/s5e7_poster.jpg",
               "thumb": "http://assets.comediansincarsgettingcoffee.com/jimmy-fallon/s5e7_thumb.jpg"
               },
               "mediaUrl": "http://content.uplynk.com/ext/e8773f7770a44dbd886eee4fca16a66b/2494321.m3u8?ad=crackle_live",
               "pubDateTime": 1418922001,
               "slug": "jimmy-fallon-the-unsinkable-legend-part-1",
               "videoUrl": "http://content-ause4.uplynk.com/ac654e2265cd4fd69d8a44acf9802ecf/g.m3u8?ad=crackle_live&pbs=de8bcae095f444829b3ca2c72fc7b5dc"
               },
               {
               "mediaId": 2495357,
               "type": "season-trailer",
               "season": "06",
               "episode": "0000",
               "launchDate": "05/26/2015",
               "pubDate": "2015-05-26T18:00:00.000Z",
               "duration": "02:00",
               "durationSeconds": "120",
               "title": "Season 6 Premiering June 3",
               "description": "Jerry returns for Season 6, premiering June 3 at 11:30 ET. Riding along are: Julia Louis-Dreyfus, Jim Carrey, Steve Harvey, Stephen Colbert, Bill Maher and Trevor Noah.",
               "guests": [
                          {
                          "name": "Julia Louis-Dreyfus"
                          },
                          {
                          "name": "Jim Carrey"
                          },
                          {
                          "name": "Steve Harvey"
                          },
                          {
                          "name": "Stephen Colbert"
                          },
                          {
                          "name": "Bill Maher"
                          },
                          {
                          "name": "Trevor Noah"
                          }
                          ],
               "images": {
               "poster": "http://assets.comediansincarsgettingcoffee.com/season-6-trailer/s6_promo_poster.jpg",
               "thumb": "http://assets.comediansincarsgettingcoffee.com/season-6-trailer/s6_promo_thumb.jpg"
               },
               "mediaUrl": "http://content.uplynk.com/ext/e8773f7770a44dbd886eee4fca16a66b/2495357.m3u8",
               "pubDateTime": 1432663200,
               "slug": "julia-louis-dreyfus-jim-carrey-steve-harvey-stephen-colbert-bill-maher-trevor-noah-season-trailer",
               "videoUrl": "http://content-ause4.uplynk.com/62bd6e91caa549c5b14ad337f9755614/g.m3u8"
               },
               {
               "mediaId": 2495368,
               "type": "episode",
               "season": "06",
               "episode": "0001",
               "launchDate": "06/03/2015",
               "pubDate": "2015-06-04T03:30:00.000Z",
               "duration": "17:09",
               "durationSeconds": "1029",
               "title": "I'll Go If I Don't Have To Talk",
               "description": "Jerry and the \"James Bond of comedy\" Julia Louis-Dreyfus reminisce as they share a cappuccino after cruising  the Pacific Palisades in a 1964 Aston martin DB5",
               "guests": [
                          {
                          "name": "Julia Louis-Dreyfus"
                          }
                          ],
               "images": {
               "poster": "http://assets.comediansincarsgettingcoffee.com/julia-louis-dreyfus/s6e1_poster.jpg",
               "thumb": "http://assets.comediansincarsgettingcoffee.com/julia-louis-dreyfus/s6e1_thumb.jpg"
               },
               "mediaUrl": "http://content.uplynk.com/ext/e8773f7770a44dbd886eee4fca16a66b/2495368.m3u8?ad=crackle_live",
               "pubDateTime": 1433388600,
               "slug": "julia-louis-dreyfus-ill-go-if-i-dont-have-to-talk",
               "videoUrl": "http://content-ause1.uplynk.com/50dd4d72206b4b00adb5c602df3285e2/g.m3u8?ad=crackle_live&pbs=18c1abe2add54259a51c664b1799c6b6"
               },
               {
               "mediaId": 2493914,
               "type": "episode-trailer",
               "season": "06",
               "episode": "0002",
               "launchDate": "06/08/2015",
               "pubDate": "2015-06-08T16:00:00.000Z",
               "duration": "02:00",
               "durationSeconds": "120",
               "title": "Episode Trailer",
               "description": "Jerry Seinfeld' next special guest is Steve Harvey (The Steve Harvey Show).",
               "guests": [
                          {
                          "name": "Steve Harvey"
                          }
                          ],
               "images": {
               "poster": "http://assets.comediansincarsgettingcoffee.com/steve-harvey/s6e2_promo_poster.jpg",
               "thumb": "http://assets.comediansincarsgettingcoffee.com/steve-harvey/s6e2_promo_thumb.jpg"
               },
               "mediaUrl": "http://content.uplynk.com/ext/e8773f7770a44dbd886eee4fca16a66b/2495367.m3u8",
               "pubDateTime": 1433779200,
               "slug": "steve-harvey-episode-trailer",
               "videoUrl": "http://content-ause4.uplynk.com/162108dc5b9f47308cec882e5686f8e8/g.m3u8"
               },
               {
               "mediaId": 2495406,
               "type": "episode",
               "season": "06",
               "episode": "0002",
               "launchDate": "06/10/2015",
               "pubDate": "2015-06-11T03:30:00.000Z",
               "duration": "18:18",
               "durationSeconds": "1098",
               "title": "Always Do The Banana Joke First",
               "description": "Jerry and Steve Harvey prowl Chicago in a '57 Chevy Bel Air convertible, enjoy some fine cigars and muse about offensive jokes and the futility of comedy class.",
               "guests": [
                          {
                          "name": "Steve Harvey"
                          }
                          ],
               "images": {
               "poster": "http://assets.comediansincarsgettingcoffee.com/steve-harvey/s6e2_poster.jpg",
               "thumb": "http://assets.comediansincarsgettingcoffee.com/steve-harvey/s6e2_thumb.jpg"
               },
               "mediaUrl": "http://content.uplynk.com/ext/e8773f7770a44dbd886eee4fca16a66b/2495406.m3u8?ad=crackle_live",
               "pubDateTime": 1433993400,
               "slug": "steve-harvey-always-do-the-banana-joke-first",
               "videoUrl": "http://content-ause4.uplynk.com/0e187b26a6d242dc93d5fef80d242993/g.m3u8?ad=crackle_live&pbs=1bd24b1c46b2461283633b7adce4c436"
               },
               {
               "mediaId": 2495401,
               "type": "episode-trailer",
               "season": "06",
               "episode": "0003",
               "launchDate": "06/15/2015",
               "pubDate": "2015-06-15T16:00:00.000Z",
               "duration": "0:59",
               "durationSeconds": "59",
               "title": "Episode Trailer",
               "description": "Jerry Seinfeld' next special guest is Jim Carrey (Dumb and Dumber).",
               "guests": [
                          {
                          "name": "Jim Carrey"
                          }
                          ],
               "images": {
               "poster": "http://assets.comediansincarsgettingcoffee.com/jim-carrey/s6e3_promo_poster.jpg",
               "thumb": "http://assets.comediansincarsgettingcoffee.com/jim-carrey/s6e3_promo_thumb.jpg"
               },
               "mediaUrl": "http://content.uplynk.com/ext/e8773f7770a44dbd886eee4fca16a66b/2495401.m3u8",
               "pubDateTime": 1434384000,
               "slug": "jim-carrey-episode-trailer",
               "videoUrl": "http://content-ause1.uplynk.com/b4d1ab5a4d6f4eb38a47224a0e0a6220/g.m3u8"
               },
               {
               "mediaId": 2495412,
               "type": "episode",
               "season": "06",
               "episode": "0003",
               "launchDate": "06/17/2015",
               "pubDate": "2015-06-18T03:30:00.000Z",
               "duration": "16:33",
               "durationSeconds": "993",
               "title": "We Love Breathing What You're Burning, Baby",
               "description": "Jerry's full of testosterone as he steps into a '76 Lamborghini Countach with Jim Carrey, who's between a three-week cleanse and a five-day silent retreat. After coffee, it's off to Carrey's studio to study a portrait of a gorilla with a machine gun. Wow.",
               "guests": [
                          {
                          "name": "Jim Carrey"
                          }
                          ],
               "images": {
               "poster": "http://assets.comediansincarsgettingcoffee.com/jim-carrey/s6e3_poster.jpg",
               "thumb": "http://assets.comediansincarsgettingcoffee.com/jim-carrey/s6e3_thumb.jpg"
               },
               "mediaUrl": "http://content.uplynk.com/ext/e8773f7770a44dbd886eee4fca16a66b/2495412.m3u8?ad=crackle_live",
               "pubDateTime": 1434598200,
               "slug": "jim-carrey-we-love-breathing-what-youre-burning-baby",
               "videoUrl": "http://content-ause4.uplynk.com/4c66fc43aec74d2b8bb759cabe13044f/g.m3u8?ad=crackle_live&pbs=9a305a650c464840a8dcb36d3d1e9129"
               },
               {
               "mediaId": 2495438,
               "type": "episode",
               "season": "06",
               "episode": "0004",
               "launchDate": "06/24/2015",
               "pubDate": "2015-06-25T03:30:00.000Z",
               "duration": "18:53",
               "durationSeconds": "1133",
               "title": "The Comedy Team of Smug and Arrogant",
               "description": "Jerry chooses a 1979 VW Bug police car for good buddy Bill Maher because, as he says, Maher seems to have authority but actually has none. Case in point: when Maher talks politics, Jerry asks, \"Boxers or briefs?\"",
               "guests": [
                          {
                          "name": "Bill Maher"
                          }
                          ],
               "images": {
               "poster": "http://assets.comediansincarsgettingcoffee.com/bill-maher/s6e4_poster.jpg",
               "thumb": "http://assets.comediansincarsgettingcoffee.com/bill-maher/s6e4_thumb.jpg"
               },
               "mediaUrl": "http://content.uplynk.com/ext/e8773f7770a44dbd886eee4fca16a66b/2495438.m3u8?ad=crackle_live",
               "pubDateTime": 1435203000,
               "slug": "bill-maher-the-comedy-team-of-smug-and-arrogant",
               "videoUrl": "http://content-ause2.uplynk.com/146815d38e0542ba9916c19ce0f49b9a/g.m3u8?ad=crackle_live&pbs=d78963d8ca99497396e2adeee6980c78"
               },
               {
               "mediaId": 2495415,
               "type": "episode-trailer",
               "season": "06",
               "episode": "0004",
               "launchDate": "06/22/2015",
               "pubDate": "2015-06-22T16:00:00.000Z",
               "duration": "0:59",
               "durationSeconds": "59",
               "title": "Episode Trailer",
               "description": "Jerry Seinfeld' next special guest is Bill Maher (Real Time with Bill Maher).",
               "guests": [
                          {
                          "name": "Bill Maher"
                          }
                          ],
               "images": {
               "poster": "http://assets.comediansincarsgettingcoffee.com/bill-maher/s6e4_promo_poster.jpg",
               "thumb": "http://assets.comediansincarsgettingcoffee.com/bill-maher/s6e4_promo_thumb.jpg"
               },
               "mediaUrl": "http://content.uplynk.com/ext/e8773f7770a44dbd886eee4fca16a66b/2495415.m3u8",
               "pubDateTime": 1434988800,
               "slug": "bill-maher-episode-trailer",
               "videoUrl": "http://content-ause3.uplynk.com/034b53a7806b42e686fb9d1ce6b72d55/g.m3u8"
               },
               {
               "mediaId": 2495534,
               "type": "episode",
               "season": "06",
               "episode": "0005",
               "launchDate": "07/01/2015",
               "pubDate": "2015-07-02T03:30:00.000Z",
               "duration": "20:58",
               "durationSeconds": "1258",
               "title": "That's the Whole Point of Apartheid, Jerry",
               "description": "Jerry takes incoming Daily Show host Trevor Noah on a tour down under the Brooklyn Bridge, where they riff on football (aka, soccer), apartheid's stupidity, and Noah's insane daily routine.",
               "guests": [
                          {
                          "name": "Trevor Noah"
                          }
                          ],
               "images": {
               "poster": "http://assets.comediansincarsgettingcoffee.com/trevor-noah/s6e5_poster.jpg",
               "thumb": "http://assets.comediansincarsgettingcoffee.com/trevor-noah/s6e5_thumb.jpg"
               },
               "mediaUrl": "http://content.uplynk.com/ext/e8773f7770a44dbd886eee4fca16a66b/2495534.m3u8?ad=crackle_live",
               "pubDateTime": 1435807800,
               "slug": "trevor-noah-thats-the-whole-point-of-apartheid-jerry",
               "videoUrl": "http://content-ause4.uplynk.com/56dd7962a5454b7e8eb99e5e75ed5880/g.m3u8?ad=crackle_live&pbs=f8eed7cac7ac4903883fe2420aa1e8e3"
               },
               {
               "mediaId": 2495480,
               "type": "episode-trailer",
               "season": "06",
               "episode": "0005",
               "launchDate": "06/29/2015",
               "pubDate": "2015-06-29T16:00:00.000Z",
               "duration": "1:05",
               "durationSeconds": "65",
               "title": "Episode Trailer",
               "description": "Jerry Seinfeld's next special guest is Trevor Noah, soon to be host of The Daily Show.",
               "guests": [
                          {
                          "name": "Trevor Noah"
                          }
                          ],
               "images": {
               "poster": "http://assets.comediansincarsgettingcoffee.com/trevor-noah/s6e5_promo_poster.jpg",
               "thumb": "http://assets.comediansincarsgettingcoffee.com/trevor-noah/s6e5_promo_thumb.jpg"
               },
               "mediaUrl": "http://content.uplynk.com/ext/e8773f7770a44dbd886eee4fca16a66b/2495480.m3u8",
               "pubDateTime": 1435593600,
               "slug": "trevor-noah-episode-trailer",
               "videoUrl": "http://content-ause2.uplynk.com/3a0d170300ce4bf28ddb4ad1dbb40222/g.m3u8"
               },
               {
               "mediaId": 2495591,
               "type": "episode-trailer",
               "season": "06",
               "episode": "0006",
               "launchDate": "07/06/2015",
               "pubDate": "2015-07-06T16:00:00.000Z",
               "duration": "0:59",
               "durationSeconds": "59",
               "title": "Episode Trailer",
               "description": "Jerry Seinfeld's next special guest is Stephen Colbert, soon to be host of The Late Show.",
               "guests": [
                          {
                          "name": "Stephen Colbert"
                          }
                          ],
               "images": {
               "poster": "http://assets.comediansincarsgettingcoffee.com/stephen-colbert/s6e6_promo_poster.jpg",
               "thumb": "http://assets.comediansincarsgettingcoffee.com/stephen-colbert/s6e6_promo_thumb.jpg"
               },
               "mediaUrl": "http://content.uplynk.com/ext/e8773f7770a44dbd886eee4fca16a66b/2495591.m3u8",
               "pubDateTime": 1436198400,
               "slug": "stephen-colbert-episode-trailer",
               "videoUrl": "http://content-ause2.uplynk.com/cbbe95c2b9b3422ebc776901d480cc7c/g.m3u8"
               },
               {
               "mediaId": 2495598,
               "type": "episode",
               "season": "06",
               "episode": "0006",
               "launchDate": "07/08/2015",
               "pubDate": "2015-07-09T03:30:00.000Z",
               "duration": "16:48",
               "durationSeconds": "1008",
               "title": "Cut Up And Bloody But Looking Good",
               "description": "Jerry rides shotgun with Stephen Colbert in a 1964 Morgan Plus 4, a British import that says you just don't care what people think. He's a late-night madman, according to Jerry, who's impressed with Colbert's beard and the manly way he pretends to smoke a pipe.",
               "guests": [
                          {
                          "name": "Stephen Colbert"
                          }
                          ],
               "images": {
               "poster": "http://assets.comediansincarsgettingcoffee.com/stephen-colbert/s6e6_poster.jpg",
               "thumb": "http://assets.comediansincarsgettingcoffee.com/stephen-colbert/s6e6_thumb.jpg"
               },
               "mediaUrl": "http://content.uplynk.com/ext/e8773f7770a44dbd886eee4fca16a66b/2495598.m3u8?ad=crackle_live",
               "pubDateTime": 1436412600,
               "slug": "stephen-colbert-cut-up-and-bloody-but-looking-good",
               "videoUrl": "http://content-ause2.uplynk.com/88319074ba5f45ce957bbc81b2c5fd2b/g.m3u8?ad=crackle_live&pbs=6e29915b35494669bd716f1e74614581"
               },
               {
               "mediaId": 2497688,
               "type": "season-trailer",
               "season": "07",
               "episode": "0000",
               "launchDate": "12/21/2015",
               "pubDate": "2015-12-21T20:00:00.000Z",
               "duration": "2:10",
               "durationSeconds": "130",
               "title": "Season 7 Premiering December 30",
               "description": "Jerry is back! President Barack Obama to kick off Season 7.  Will Ferrell, Steve Martin, Garry Shandling, Kathleen Madigan and Sebastian Maniscalco also guest star.",
               "guests": [
                          {
                          "name": "President Barack Obama"
                          },
                          {
                          "name": "Will Ferrell"
                          },
                          {
                          "name": "Steve Martin"
                          },
                          {
                          "name": "Kathleen Madigan"
                          },
                          {
                          "name": "Sebastian Maniscalco"
                          },
                          {
                          "name": "Garry Shandling"
                          }
                          ],
               "images": {
               "poster": "http://assets.comediansincarsgettingcoffee.com/season-7-trailer/s7_promo_poster.jpg",
               "thumb": "http://assets.comediansincarsgettingcoffee.com/season-7-trailer/s7_promo_thumb.jpg"
               },
               "mediaUrl": "http://content.uplynk.com/ext/e8773f7770a44dbd886eee4fca16a66b/2497688.m3u8",
               "pubDateTime": 1450728000,
               "slug": "president-barack-obama-will-ferrell-steve-martin-kathleen-madigan-sebastian-maniscalco-garry-shandling-season-trailer",
               "videoUrl": "http://content-aeui1.uplynk.com/5e6086f447ee413c8ba54231e5b6eef6/g.m3u8"
               },
               {
               "mediaId": 2497688,
               "type": "season-trailer",
               "season": "07",
               "episode": "0000",
               "launchDate": "12/21/2015",
               "pubDate": "2015-12-21T20:00:00.000Z",
               "duration": "2:10",
               "durationSeconds": "130",
               "title": "Season 7 Premiering December 30",
               "description": "Jerry is back! President Barack Obama to kick off Season 7.  Will Ferrell, Steve Martin, Garry Shandling, Kathleen Madigan and Sebastian Maniscalco also guest star.",
               "guests": [
                          {
                          "name": "President Barack Obama"
                          },
                          {
                          "name": "Will Ferrell"
                          },
                          {
                          "name": "Steve Martin"
                          },
                          {
                          "name": "Kathleen Madigan"
                          },
                          {
                          "name": "Chuck Martin"
                          },
                          {
                          "name": "Sebastian Maniscalco"
                          },
                          {
                          "name": "Garry Shandling"
                          }
                          ],
               "images": {
               "poster": "http://assets.comediansincarsgettingcoffee.com/season-7-trailer/s7_promo_poster.jpg",
               "thumb": "http://assets.comediansincarsgettingcoffee.com/season-7-trailer/s7_promo_thumb.jpg"
               },
               "mediaUrl": "http://content.uplynk.com/ext/e8773f7770a44dbd886eee4fca16a66b/2497688.m3u8",
               "pubDateTime": 1450728000,
               "slug": "president-barack-obama-will-ferrell-steve-martin-kathleen-madigan-chuck-martin-sebastian-maniscalco-garry-shandling-season-trailer",
               "videoUrl": "http://content-aeuf1.uplynk.com/5e6086f447ee413c8ba54231e5b6eef6/g.m3u8"
               },
               {
               "mediaId": 2497717,
               "type": "episode",
               "season": "07",
               "episode": "0001",
               "launchDate": "12/30/2015",
               "pubDate": "2015-12-31T04:25:00.000Z",
               "duration": "19:13",
               "durationSeconds": "1153",
               "title": "Just Tell Him Youre the President",
               "description": "For the premiere episode of Season 7, Jerry takes President Barack Obama for a spin in a 1963 Corvette Stingray Split Window Coupe but finds it hard to spirit the leader of the free world off the White House grounds.",
               "guests": [
                          {
                          "name": "President Barack Obama"
                          }
                          ],
               "images": {
               "poster": "http://assets.comediansincarsgettingcoffee.com/president-barack-obama/s7e1_poster.jpg",
               "thumb": "http://assets.comediansincarsgettingcoffee.com/president-barack-obama/s7e1_thumb.jpg"
               },
               "mediaUrl": "http://content.uplynk.com/ext/e8773f7770a44dbd886eee4fca16a66b/2497717.m3u8?ad=crackle_live",
               "pubDateTime": 1451535900,
               "slug": "president-barack-obama-just-tell-him-you-re-the-president",
               "videoUrl": "http://content-aeui1.uplynk.com/1d9e56b0d9064718a47cb31ba169db10/g.m3u8?ad=crackle_live&pbs=793352e620314984a9291f3b485fdb5c"
               },
               {
               "mediaId": 2497719,
               "type": "episode-trailer",
               "season": "07",
               "episode": "0002",
               "launchDate": "01/04/2016",
               "pubDate": "2016-01-04T16:55:00.000Z",
               "duration": "1:07",
               "durationSeconds": "67",
               "title": "Episode Trailer",
               "description": "Jerry Seinfeld's next special guest is Steve Martin.",
               "guests": [
                          {
                          "name": "Steve Martin"
                          }
                          ],
               "images": {
               "poster": "http://assets.comediansincarsgettingcoffee.com/steve-martin/s7e2_promo_poster.jpg",
               "thumb": "http://assets.comediansincarsgettingcoffee.com/steve-martin/s7e2_promo_thumb.jpg"
               },
               "mediaUrl": "http://content.uplynk.com/ext/e8773f7770a44dbd886eee4fca16a66b/2497719.m3u8",
               "pubDateTime": 1451926500,
               "slug": "steve-martin-episode-trailer",
               "videoUrl": "http://content-aeuf1.uplynk.com/0c05e59d5b4b4e1b9e230400c084d0fb/g.m3u8"
               },
               {
               "mediaId": 2497684,
               "type": "episode",
               "season": "07",
               "episode": "0002",
               "launchDate": "01/06/2016",
               "pubDate": "2016-01-07T04:25:00.000Z",
               "duration": "23:06",
               "durationSeconds": "1386",
               "title": "If You See This On A Toilet Seat, Don't Sit Down",
               "description": "Jerry goes up to the country with Steve Martin in a beautiful but delicate 1954 Siata 8v and come back to the city in something else altogether. In between they converse about confidence, quitting and the best opening lines.",
               "guests": [
                          {
                          "name": "Steve Martin"
                          }
                          ],
               "images": {
               "poster": "http://assets.comediansincarsgettingcoffee.com/steve-martin/s7e2_poster.jpg",
               "thumb": "http://assets.comediansincarsgettingcoffee.com/steve-martin/s7e2_thumb.jpg"
               },
               "mediaUrl": "http://content.uplynk.com/ext/e8773f7770a44dbd886eee4fca16a66b/2497684.m3u8?ad=crackle_live",
               "pubDateTime": 1452140700,
               "slug": "steve-martin-if-you-see-this-on-a-toilet-seat-dont-sit-down",
               "videoUrl": "http://content-aeuf1.uplynk.com/884601cb0be14946a24ee7cc8e20b0b0/g.m3u8?ad=crackle_live&pbs=d24e81d82dad436bbd585a9d946dff28"
               },
               {
               "mediaId": 2497714,
               "type": "episode-trailer",
               "season": "07",
               "episode": "0003",
               "launchDate": "01/11/2016",
               "pubDate": "2016-01-11T16:55:00.000Z",
               "duration": "1:10",
               "durationSeconds": "70",
               "title": "Episode Trailer",
               "description": "Jerry Seinfeld's next special guest is Kathleen Madigan and Chuck Martin.",
               "guests": [
                          {
                          "name": "Kathleen Madigan"
                          },
                          {
                          "name": "Chuck Martin"
                          }
                          ],
               "images": {
               "poster": "http://assets.comediansincarsgettingcoffee.com/kathleen-madigan-chuck-martin/s7e3_promo_poster.jpg",
               "thumb": "http://assets.comediansincarsgettingcoffee.com/kathleen-madigan-chuck-martin/s7e3_promo_thumb.jpg"
               },
               "mediaUrl": "http://content.uplynk.com/ext/e8773f7770a44dbd886eee4fca16a66b/2497714.m3u8",
               "pubDateTime": 1452531300,
               "slug": "kathleen-madigan-chuck-martin-episode-trailer",
               "videoUrl": "http://content-aeuf2.uplynk.com/9e4e8dbc035a43e9b06feaa9f35c8484/g.m3u8"
               },
               {
               "mediaId": 2497721,
               "type": "episode",
               "season": "07",
               "episode": "0003",
               "launchDate": "01/13/2016",
               "pubDate": "2016-01-14T04:25:00.000Z",
               "duration": "17:56",
               "durationSeconds": "1076",
               "title": "Stroked Out On A Hot Machine",
               "description": "",
               "guests": [
                          {
                          "name": "Kathleen Madigan"
                          },
                          {
                          "name": "Chuck Martin"
                          }
                          ],
               "images": {
               "poster": "http://assets.comediansincarsgettingcoffee.com/kathleen-madigan-chuck-martin/s7e3_poster.jpg",
               "thumb": "http://assets.comediansincarsgettingcoffee.com/kathleen-madigan-chuck-martin/s7e3_thumb.jpg"
               },
               "mediaUrl": "http://content.uplynk.com/ext/e8773f7770a44dbd886eee4fca16a66b/2497721.m3u8?ad=crackle_live",
               "pubDateTime": 1452745500,
               "slug": "kathleen-madigan-chuck-martin-stroked-out-on-a-hot-machine",
               "videoUrl": "http://content-aeuf2.uplynk.com/62a719a74635438b85a7536e39612712/g.m3u8?ad=crackle_live&pbs=0decc658fca84ff2a91688970c8ea94e"
               },
               {
               "mediaId": 2497760,
               "type": "episode-trailer",
               "season": "07",
               "episode": "0004",
               "launchDate": "01/18/2016",
               "pubDate": "2016-01-18T16:55:00.000Z",
               "duration": "1:20",
               "durationSeconds": "80",
               "title": "Episode Trailer",
               "description": "Jerry takes a trip to Seinfeld's old New York street set with special guest Garry Shandling.",
               "guests": [
                          {
                          "name": "Garry Shandling"
                          }
                          ],
               "images": {
               "poster": "http://assets.comediansincarsgettingcoffee.com/garry-shandling/s7e4_promo_poster.jpg",
               "thumb": "http://assets.comediansincarsgettingcoffee.com/garry-shandling/s7e4_promo_thumb.jpg"
               },
               "mediaUrl": "http://content.uplynk.com/ext/e8773f7770a44dbd886eee4fca16a66b/2497760.m3u8",
               "pubDateTime": 1453136100,
               "slug": "garry-shandling-episode-trailer",
               "videoUrl": "http://content-aeuf1.uplynk.com/eaf1fa76a844426c937072ea05af8367/g.m3u8"
               },
               {
               "mediaId": 2497780,
               "type": "episode",
               "season": "07",
               "episode": "0004",
               "launchDate": "01/20/2016",
               "pubDate": "2016-01-21T04:25:00.000Z",
               "duration": "21:44",
               "durationSeconds": "1304",
               "title": "It's Great That Garry Shandling Is Still Alive",
               "description": "Garry Shandling rides shotgun in a 1979 Porsche 930 as he and Jerry goof on Matthew McConaughey and the Dalai Lama during a trip to Seinfeld's old New York street set",
               "guests": [
                          {
                          "name": "Garry Shandling"
                          }
                          ],
               "images": {
               "poster": "http://assets.comediansincarsgettingcoffee.com/garry-shandling/s7e4_poster.jpg",
               "thumb": "http://assets.comediansincarsgettingcoffee.com/garry-shandling/s7e4_thumb.jpg"
               },
               "mediaUrl": "http://content.uplynk.com/ext/e8773f7770a44dbd886eee4fca16a66b/2497780.m3u8?ad=crackle_live",
               "pubDateTime": 1453350300,
               "slug": "garry-shandling-its-great-that-garry-shandling-is-still-alive",
               "videoUrl": "http://content-aeui2.uplynk.com/09a05946508640d0aaa9f207c3964b52/g.m3u8?ad=crackle_live&pbs=36e32890d765461681596b0206af6e41"
               },
               {
               "mediaId": 2497791,
               "type": "episode-trailer",
               "season": "07",
               "episode": "0005",
               "launchDate": "01/25/2016",
               "pubDate": "2016-01-25T16:55:00.000Z",
               "duration": "1:06",
               "durationSeconds": "66",
               "title": "Episode Trailer",
               "description": "Jerry Seinfeld hops in a classic car with a pal each week to grab a coffee and ponder the things that keep comedians up at night.",
               "guests": [
                          {
                          "name": "Sebastian Maniscalco"
                          }
                          ],
               "images": {
               "poster": "http://assets.comediansincarsgettingcoffee.com/sebastian-maniscalco/s7e5_promo_poster.jpg",
               "thumb": "http://assets.comediansincarsgettingcoffee.com/sebastian-maniscalco/s7e5_promo_thumb.jpg"
               },
               "mediaUrl": "http://content.uplynk.com/ext/e8773f7770a44dbd886eee4fca16a66b/2497791.m3u8",
               "pubDateTime": 1453740900,
               "slug": "sebastian-maniscalco-episode-trailer",
               "videoUrl": "http://content-aeuf2.uplynk.com/659d826e264b4994a30fb2f3400f436d/g.m3u8"
               },
               {
               "mediaId": 2497844,
               "type": "episode",
               "season": "07",
               "episode": "0005",
               "launchDate": "01/27/2016",
               "pubDate": "2016-01-28T04:25:00.000Z",
               "duration": "16:16",
               "durationSeconds": "976",
               "title": "I Don't Think That's Bestiality",
               "description": " In a perfect combination of guy, car and moment, Sebastian Maniscalco cruises the streets of L.A. with Jerry in a '69 Camaro Z/28 and talks about growing up in a Sicilian family, his grooming habits and having a mean resting face.",
               "guests": [
                          {
                          "name": "Sebastian Maniscalco"
                          }
                          ],
               "images": {
               "poster": "http://assets.comediansincarsgettingcoffee.com/sebastian-maniscalco/s7e5_poster.jpg",
               "thumb": "http://assets.comediansincarsgettingcoffee.com/sebastian-maniscalco/s7e5_thumb.jpg"
               },
               "mediaUrl": "http://content.uplynk.com/ext/e8773f7770a44dbd886eee4fca16a66b/2497844.m3u8?ad=crackle_live",
               "pubDateTime": 1453955100,
               "slug": "sebastian-maniscalco-i-dont-think-thats-bestiality",
               "videoUrl": "http://content-aeuf2.uplynk.com/83682dffc76e4a20ae9071e5164d5a1b/g.m3u8?ad=crackle_live&pbs=8f4950c840f24fadaaf6326ba82b5c49"
               },
               {
               "mediaId": 2497845,
               "type": "episode-trailer",
               "season": "07",
               "episode": "0006",
               "launchDate": "02/01/2016",
               "pubDate": "2016-02-01T16:55:00.000Z",
               "duration": "1:09",
               "durationSeconds": "69",
               "title": "Episode Trailer",
               "description": "Jerry Seinfeld hops in a classic car with a pal each week to grab a coffee and ponder the things that keep comedians up at night.",
               "guests": [
                          {
                          "name": "Will Ferrell"
                          }
                          ],
               "images": {
               "poster": "http://assets.comediansincarsgettingcoffee.com/will-ferrell/s7e6_promo_poster.jpg",
               "thumb": "http://assets.comediansincarsgettingcoffee.com/will-ferrell/s7e6_promo_thumb.jpg"
               },
               "mediaUrl": "http://content.uplynk.com/ext/e8773f7770a44dbd886eee4fca16a66b/2497845.m3u8",
               "pubDateTime": 1454345700,
               "slug": "will-ferrell-episode-trailer",
               "videoUrl": "http://content-aeuf2.uplynk.com/0dc09fa6f898440da2fc1503051a99be/g.m3u8"
               },
               {
               "mediaId": 2497950,
               "type": "episode",
               "season": "07",
               "episode": "0006",
               "launchDate": "02/03/2016",
               "pubDate": "2016-02-04T04:25:00.000Z",
               "duration": "18:15",
               "durationSeconds": "1095",
               "title": "Mr. Ferrell, For the Last Time, We're Going To Ask You To Put the Cigar Out",
               "description": "Will Ferrell says the secret to his comedy is that he looks like a banker but acts like a nut, which is why Jerry picks him up in a 'happy, silly' 1970 Plymouth Road Runner SuperBird for a mid-day break.",
               "guests": [
                          {
                          "name": "Will Ferrell"
                          }
                          ],
               "images": {
               "poster": "http://assets.comediansincarsgettingcoffee.com/will-ferrell/s7e6_poster.jpg",
               "thumb": "http://assets.comediansincarsgettingcoffee.com/will-ferrell/s7e6_thumb.jpg"
               },
               "mediaUrl": "http://content.uplynk.com/ext/e8773f7770a44dbd886eee4fca16a66b/2497950.m3u8?ad=crackle_live",
               "pubDateTime": 1454559900,
               "slug": "will-ferrell-mr-ferrell-for-the-last-time-were-going-to-ask-you-to-put-the-cigar-out",
               "videoUrl": "http://content-aeuf1.uplynk.com/66f3cf0179f74d33a7bf857d22c8f892/g.m3u8?ad=crackle_live&pbs=309c52f95cbf4d89b0ee01b8c4296fb3"
               }
               ]
}